R01AI130348,"Division of Pediatric Allergy and Immunology, Yale University School of Medicine, New Haven, Connecticut, USA.",2024,"Leeds, Stephanie; Slade, Martin; Hafler, Janet; Samady, Waheeda; Jiang, Jialing; Bilaver, Lucy; Gupta, Ruchi S",England,1743-498X,2,<a href='https://pubmed.ncbi.nlm.nih.gov/37935587'>The clinical teacher</a>,Clin Teach,21,eng,e13689,12199709,37935587,2024 Apr,<a href='https://www.ncbi.nlm.nih.gov/pmc/articles/12199709'>Development of an innovative curriculum for paediatricians on peanut allergy prevention: How do we address current guidelines?</a>,"<a href='https://pubmed.ncbi.nlm.nih.gov/?Db=pubmed&DbFrom=pubmed&Cmd=Link&LinkName=pubmed_pubmed&IdsFromResult=37935587&ordinalpos=1&itool=EntrezSystem2.PEntrez.Pubmed.Pubmed_ResultsPanel.Pubmed_DiscoveryPanel.Pubmed_Discovery_RA&log$=relatedarticles&logdbfrom=pubmed'>Related, PubMed</a>","<a href='https://scholar.google.com/scholar?q=related:https://pmc.ncbi.nlm.nih.gov/articles/PMC12199709/'>Related, Google Scholar</a>","<a href='https://pubmed.ncbi.nlm.nih.gov/?linkname=pubmed_pubmed_citedin&from_uid=37935587'>Cited By, PMID</a>","<a href='https://scholar.google.com/scholar?hl=en&lr=&cites=https://pmc.ncbi.nlm.nih.gov/articles/PMC12199709/'>Cited By, Google</a>", ,PMID(37935587) OR  ,2024,1743498X,,,
R21AI159562,"Division of Pediatric Allergy and Immunology, Yale University School of Medicine, New Haven, Connecticut, USA.",2024,"Leeds, Stephanie; Slade, Martin; Hafler, Janet; Samady, Waheeda; Jiang, Jialing; Bilaver, Lucy; Gupta, Ruchi S",England,1743-498X,2,<a href='https://pubmed.ncbi.nlm.nih.gov/37935587'>The clinical teacher</a>,Clin Teach,21,eng,e13689,12199709,37935587,2024 Apr,<a href='https://www.ncbi.nlm.nih.gov/pmc/articles/12199709'>Development of an innovative curriculum for paediatricians on peanut allergy prevention: How do we address current guidelines?</a>,"<a href='https://pubmed.ncbi.nlm.nih.gov/?Db=pubmed&DbFrom=pubmed&Cmd=Link&LinkName=pubmed_pubmed&IdsFromResult=37935587&ordinalpos=1&itool=EntrezSystem2.PEntrez.Pubmed.Pubmed_ResultsPanel.Pubmed_DiscoveryPanel.Pubmed_Discovery_RA&log$=relatedarticles&logdbfrom=pubmed'>Related, PubMed</a>","<a href='https://scholar.google.com/scholar?q=related:https://pmc.ncbi.nlm.nih.gov/articles/PMC12199709/'>Related, Google Scholar</a>","<a href='https://pubmed.ncbi.nlm.nih.gov/?linkname=pubmed_pubmed_citedin&from_uid=37935587'>Cited By, PMID</a>","<a href='https://scholar.google.com/scholar?hl=en&lr=&cites=https://pmc.ncbi.nlm.nih.gov/articles/PMC12199709/'>Cited By, Google</a>", ,PMID(37935587) OR  ,2024,1743498X,,,
R01CA261898,"Department of Pharmacology and Center for Pharmacogenomics, Northwestern University Feinberg School of Medicine, Chicago, Illinois, USA; email: paul.burridge@northwestern.edu.",2024,"Cejas, Romina B; Petrykey, Kateryna; Sapkota, Yadav; Burridge, Paul W",United States,1545-4304, ,<a href='https://pubmed.ncbi.nlm.nih.gov/37788492'>Annual review of pharmacology and toxicology</a>,Annu Rev Pharmacol Toxicol,64,eng,115-134,11260185,37788492,2024 Jan 23,<a href='https://www.ncbi.nlm.nih.gov/pmc/articles/11260185'>Anthracycline Toxicity: Light at the End of the Tunnel?</a>,"<a href='https://pubmed.ncbi.nlm.nih.gov/?Db=pubmed&DbFrom=pubmed&Cmd=Link&LinkName=pubmed_pubmed&IdsFromResult=37788492&ordinalpos=1&itool=EntrezSystem2.PEntrez.Pubmed.Pubmed_ResultsPanel.Pubmed_DiscoveryPanel.Pubmed_Discovery_RA&log$=relatedarticles&logdbfrom=pubmed'>Related, PubMed</a>","<a href='https://scholar.google.com/scholar?q=related:https://pmc.ncbi.nlm.nih.gov/articles/PMC11260185/'>Related, Google Scholar</a>","<a href='https://pubmed.ncbi.nlm.nih.gov/?linkname=pubmed_pubmed_citedin&from_uid=37788492'>Cited By, PMID</a>","<a href='https://scholar.google.com/scholar?hl=en&lr=&cites=https://pmc.ncbi.nlm.nih.gov/articles/PMC11260185/'>Cited By, Google</a>",3.94,PMID(37788492) OR  ,2024,15454304,,,
T32NS047987,"Department of Psychology, Northwestern University, 2029 Sheridan Rd, Evanston, IL, 60208, USA. Kate.Damme@u.northwestern.edu.",2024,"Damme, Katherine S F; Han, Y Catherine; Han, Ziyan; Reber, Paul J; Mittal, Vijay A",Germany,1433-8491,6,<a href='https://pubmed.ncbi.nlm.nih.gov/37458819'>European archives of psychiatry and clinical neuroscience</a>,Eur Arch Psychiatry Clin Neurosci,274,eng,1427-1435,10792107,37458819,2024 Sep,<a href='https://www.ncbi.nlm.nih.gov/pmc/articles/10792107'>Motor precision deficits in clinical high risk for psychosis.</a>,"<a href='https://pubmed.ncbi.nlm.nih.gov/?Db=pubmed&DbFrom=pubmed&Cmd=Link&LinkName=pubmed_pubmed&IdsFromResult=37458819&ordinalpos=1&itool=EntrezSystem2.PEntrez.Pubmed.Pubmed_ResultsPanel.Pubmed_DiscoveryPanel.Pubmed_Discovery_RA&log$=relatedarticles&logdbfrom=pubmed'>Related, PubMed</a>","<a href='https://scholar.google.com/scholar?q=related:https://pmc.ncbi.nlm.nih.gov/articles/PMC10792107/'>Related, Google Scholar</a>","<a href='https://pubmed.ncbi.nlm.nih.gov/?linkname=pubmed_pubmed_citedin&from_uid=37458819'>Cited By, PMID</a>","<a href='https://scholar.google.com/scholar?hl=en&lr=&cites=https://pmc.ncbi.nlm.nih.gov/articles/PMC10792107/'>Cited By, Google</a>", ,PMID(37458819) OR  ,2024,14338491,,,
T32MH126368,"Department of Psychology, Northwestern University, 2029 Sheridan Rd, Evanston, IL, 60208, USA. Kate.Damme@u.northwestern.edu.",2024,"Damme, Katherine S F; Han, Y Catherine; Han, Ziyan; Reber, Paul J; Mittal, Vijay A",Germany,1433-8491,6,<a href='https://pubmed.ncbi.nlm.nih.gov/37458819'>European archives of psychiatry and clinical neuroscience</a>,Eur Arch Psychiatry Clin Neurosci,274,eng,1427-1435,10792107,37458819,2024 Sep,<a href='https://www.ncbi.nlm.nih.gov/pmc/articles/10792107'>Motor precision deficits in clinical high risk for psychosis.</a>,"<a href='https://pubmed.ncbi.nlm.nih.gov/?Db=pubmed&DbFrom=pubmed&Cmd=Link&LinkName=pubmed_pubmed&IdsFromResult=37458819&ordinalpos=1&itool=EntrezSystem2.PEntrez.Pubmed.Pubmed_ResultsPanel.Pubmed_DiscoveryPanel.Pubmed_Discovery_RA&log$=relatedarticles&logdbfrom=pubmed'>Related, PubMed</a>","<a href='https://scholar.google.com/scholar?q=related:https://pmc.ncbi.nlm.nih.gov/articles/PMC10792107/'>Related, Google Scholar</a>","<a href='https://pubmed.ncbi.nlm.nih.gov/?linkname=pubmed_pubmed_citedin&from_uid=37458819'>Cited By, PMID</a>","<a href='https://scholar.google.com/scholar?hl=en&lr=&cites=https://pmc.ncbi.nlm.nih.gov/articles/PMC10792107/'>Cited By, Google</a>", ,PMID(37458819) OR  ,2024,14338491,,,
U54HL160273,"Osler Medical Residency, Department of Medicine, Johns Hopkins University School of Medicine, Baltimore, MD, USA.",2024,"Gudenkauf, Brent; Shaya, Gabriel; Mukherjee, Monica; Michos, Erin D; Madrazo, Jose; Mathews, Lena; Shah, Sanjiv J; Sharma, Kavita; Hays, Allison G",Netherlands,1876-4738,2,<a href='https://pubmed.ncbi.nlm.nih.gov/37364818'>Journal of cardiology</a>,J Cardiol,83,eng,100-104, ,37364818,2024 Feb,Insulin resistance is associated with subclinical myocardial dysfunction and reduced functional capacity in heart failure with preserved ejection fraction.,"<a href='https://pubmed.ncbi.nlm.nih.gov/?Db=pubmed&DbFrom=pubmed&Cmd=Link&LinkName=pubmed_pubmed&IdsFromResult=37364818&ordinalpos=1&itool=EntrezSystem2.PEntrez.Pubmed.Pubmed_ResultsPanel.Pubmed_DiscoveryPanel.Pubmed_Discovery_RA&log$=relatedarticles&logdbfrom=pubmed'>Related, PubMed</a>","<a href='https://scholar.google.com/scholar?hl=en&q=Insulin resistance is associated with subclinical myocardial dysfunction and reduced functional capacity in heart failure with preserved ejection fraction.'>Related, Google Scholar</a>","<a href='https://pubmed.ncbi.nlm.nih.gov/?linkname=pubmed_pubmed_citedin&from_uid=37364818'>Cited By, PMID</a>", ,2.57,PMID(37364818) OR  ,2024,18764738,,,
R01HL152712,"Division of Cardiology, University of Miami, 1120 NW 14th St.Clinical Research Building, 1124, 33161, Miami, FL, USA.",2024,"Mitrani, Raul D; Zaatari, Ghaith; Bohorquez, Jorge; Ng, Jason; Ng, Justin; Rivner, Harold; Velasquez, Alex; Lambrakos, Litsa; Arora, Rishi; Goldberger, Jeffrey J",Netherlands,1572-8595,1,<a href='https://pubmed.ncbi.nlm.nih.gov/37395978'>Journal of interventional cardiac electrophysiology : an international journal of arrhythmias and pacing</a>,J Interv Card Electrophysiol,67,eng,183-191,10761586,37395978,2024 Jan,<a href='https://www.ncbi.nlm.nih.gov/pmc/articles/10761586'>Electrogram morphology recurrence guided catheter ablation for repeat ablation of persistent atrial fibrillation.</a>,"<a href='https://pubmed.ncbi.nlm.nih.gov/?Db=pubmed&DbFrom=pubmed&Cmd=Link&LinkName=pubmed_pubmed&IdsFromResult=37395978&ordinalpos=1&itool=EntrezSystem2.PEntrez.Pubmed.Pubmed_ResultsPanel.Pubmed_DiscoveryPanel.Pubmed_Discovery_RA&log$=relatedarticles&logdbfrom=pubmed'>Related, PubMed</a>","<a href='https://scholar.google.com/scholar?q=related:https://pmc.ncbi.nlm.nih.gov/articles/PMC10761586/'>Related, Google Scholar</a>","<a href='https://pubmed.ncbi.nlm.nih.gov/?linkname=pubmed_pubmed_citedin&from_uid=37395978'>Cited By, PMID</a>","<a href='https://scholar.google.com/scholar?hl=en&lr=&cites=https://pmc.ncbi.nlm.nih.gov/articles/PMC10761586/'>Cited By, Google</a>", ,PMID(37395978) OR  ,2024,15728595,,,
R01DK131052,"Division of Nephrology and Hypertension, Northwestern University Feinberg School of Medicine, Chicago, Illinois.",2024,"Chung, Eunah; Deacon, Patrick; Hu, Yueh-Chiang; Lim, Hee-Woong; Park, Joo-Seop",United States,2692-8205, ,<a href='https://pubmed.ncbi.nlm.nih.gov/37645929'>bioRxiv : the preprint server for biology</a>,bioRxiv, ,eng, ,10461989,37645929,2024 May 05,<a href='https://www.ncbi.nlm.nih.gov/pmc/articles/10461989'>Hedgehog signaling is required for the maintenance of mesenchymal nephron progenitors.</a>,"<a href='https://pubmed.ncbi.nlm.nih.gov/?Db=pubmed&DbFrom=pubmed&Cmd=Link&LinkName=pubmed_pubmed&IdsFromResult=37645929&ordinalpos=1&itool=EntrezSystem2.PEntrez.Pubmed.Pubmed_ResultsPanel.Pubmed_DiscoveryPanel.Pubmed_Discovery_RA&log$=relatedarticles&logdbfrom=pubmed'>Related, PubMed</a>","<a href='https://scholar.google.com/scholar?q=related:https://pmc.ncbi.nlm.nih.gov/articles/PMC10461989/'>Related, Google Scholar</a>","<a href='https://pubmed.ncbi.nlm.nih.gov/?linkname=pubmed_pubmed_citedin&from_uid=37645929'>Cited By, PMID</a>","<a href='https://scholar.google.com/scholar?hl=en&lr=&cites=https://pmc.ncbi.nlm.nih.gov/articles/PMC10461989/'>Cited By, Google</a>", ,PMID(37645929) OR  ,2024,26928205,,,
R01DK092217,"Division of Gastroenterology and Hepatology, Stanford University, Redwood City.",2024,"Kamal, Afrin N; Kathpalia, Priya; Leiman, David A; Bredenoord, Albert J; Clarke, John O; Gyawali, C Prakash; Katzka, David A; Lazarescu, Adriana; Pandolfino, John E; Penagini, Roberto; Roman, Sabine; Savarino, Edoardo; Vela, Marcelo F; Otaki, Fouad",United States,1539-2031,10,<a href='https://pubmed.ncbi.nlm.nih.gov/38227852'>Journal of clinical gastroenterology</a>,J Clin Gastroenterol,58,eng,975-980,11534068,38227852,2024 Nov-Dec 01,<a href='https://www.ncbi.nlm.nih.gov/pmc/articles/11534068'>Quality Indicator Development for the Approach to Ineffective Esophageal Motility: A Modified Delphi Study.</a>,"<a href='https://pubmed.ncbi.nlm.nih.gov/?Db=pubmed&DbFrom=pubmed&Cmd=Link&LinkName=pubmed_pubmed&IdsFromResult=38227852&ordinalpos=1&itool=EntrezSystem2.PEntrez.Pubmed.Pubmed_ResultsPanel.Pubmed_DiscoveryPanel.Pubmed_Discovery_RA&log$=relatedarticles&logdbfrom=pubmed'>Related, PubMed</a>","<a href='https://scholar.google.com/scholar?q=related:https://pmc.ncbi.nlm.nih.gov/articles/PMC11534068/'>Related, Google Scholar</a>","<a href='https://pubmed.ncbi.nlm.nih.gov/?linkname=pubmed_pubmed_citedin&from_uid=38227852'>Cited By, PMID</a>","<a href='https://scholar.google.com/scholar?hl=en&lr=&cites=https://pmc.ncbi.nlm.nih.gov/articles/PMC11534068/'>Cited By, Google</a>", ,PMID(38227852) OR  ,2024,15392031,,,
U01HL146240,"Basic Science Program, Frederick National Laboratory for Cancer Research, National Cancer Institute, Frederick, MD, USA and Laboratory of Integrative Cancer Immunology, Center for Cancer Research, National Cancer Institute Bethesda, MD, USA.",2024,"Viard, Mathias; O'hUigin, Colm; Yuki, Yuko; Bashirova, Arman A; Collins, David R; Urbach, Jonathan M; Wolinsky, Steven; Buchbinder, Susan; Kirk, Gregory D; Goedert, James J; Michael, Nelson L; Haas, David W; Deeks, Steven G; Walker, Bruce D; Yu, Xu; Carrington, Mary",United States,1095-9203,6680,"<a href='https://pubmed.ncbi.nlm.nih.gov/38236978'>Science (New York, N.Y.)</a>",Science,383,eng,319-325,11395297,38236978,2024 Jan 19,<a href='https://www.ncbi.nlm.nih.gov/pmc/articles/11395297'>Impact of HLA class I functional divergence on HIV control.</a>,"<a href='https://pubmed.ncbi.nlm.nih.gov/?Db=pubmed&DbFrom=pubmed&Cmd=Link&LinkName=pubmed_pubmed&IdsFromResult=38236978&ordinalpos=1&itool=EntrezSystem2.PEntrez.Pubmed.Pubmed_ResultsPanel.Pubmed_DiscoveryPanel.Pubmed_Discovery_RA&log$=relatedarticles&logdbfrom=pubmed'>Related, PubMed</a>","<a href='https://scholar.google.com/scholar?q=related:https://pmc.ncbi.nlm.nih.gov/articles/PMC11395297/'>Related, Google Scholar</a>","<a href='https://pubmed.ncbi.nlm.nih.gov/?linkname=pubmed_pubmed_citedin&from_uid=38236978'>Cited By, PMID</a>","<a href='https://scholar.google.com/scholar?hl=en&lr=&cites=https://pmc.ncbi.nlm.nih.gov/articles/PMC11395297/'>Cited By, Google</a>",2.32,PMID(38236978) OR  ,2024,10959203,,,
R01HL147575,"Division of Thoracic Surgery, Northwestern University Feinberg School of Medicine, 676 N. Saint Clair Street, Suite 650, Chicago, IL, 60611, USA. chitaru.kurihara@northwestern.edu.",2024,"Kurihara, Chitaru; Kaiho, Taisuke; Bharat, Ankit",Germany,2198-7793,1,<a href='https://pubmed.ncbi.nlm.nih.gov/38240878'>Surgical case reports</a>,Surg Case Rep,10,eng,24,10798934,38240878,2024 Jan 19,<a href='https://www.ncbi.nlm.nih.gov/pmc/articles/10798934'>Unveiling the complexities of lung transplantation in situs inversus.</a>,"<a href='https://pubmed.ncbi.nlm.nih.gov/?Db=pubmed&DbFrom=pubmed&Cmd=Link&LinkName=pubmed_pubmed&IdsFromResult=38240878&ordinalpos=1&itool=EntrezSystem2.PEntrez.Pubmed.Pubmed_ResultsPanel.Pubmed_DiscoveryPanel.Pubmed_Discovery_RA&log$=relatedarticles&logdbfrom=pubmed'>Related, PubMed</a>","<a href='https://scholar.google.com/scholar?q=related:https://pmc.ncbi.nlm.nih.gov/articles/PMC10798934/'>Related, Google Scholar</a>","<a href='https://pubmed.ncbi.nlm.nih.gov/?linkname=pubmed_pubmed_citedin&from_uid=38240878'>Cited By, PMID</a>","<a href='https://scholar.google.com/scholar?hl=en&lr=&cites=https://pmc.ncbi.nlm.nih.gov/articles/PMC10798934/'>Cited By, Google</a>", ,PMID(38240878) OR  ,2024,21987793,,,
P01AG054407,"Leibniz Institute on Aging - Fritz Lipmann Institute (FLI), Jena, Germany.",2024,"Di Fraia, Domenico; Marino, Antonio; Lee, Jae Ho; Kelmer Sacramento, Erika; Baumgart, Mario; Bagnoli, Sara; Tomaz da Silva, Pedro; Kumar Sahu, Amit; Siano, Giacomo; Tiessen, Max; Terzibasi-Tozzini, Eva; Gagneur, Julien; Frydman, Judith; Cellerino, Alessandro; Ori, Alessandro",United States,2692-8205, ,<a href='https://pubmed.ncbi.nlm.nih.gov/38260253'>bioRxiv : the preprint server for biology</a>,bioRxiv, ,eng, ,10802395,38260253,2024 Jan 09,<a href='https://www.ncbi.nlm.nih.gov/pmc/articles/10802395'>Impaired biogenesis of basic proteins impacts multiple hallmarks of the aging brain.</a>,"<a href='https://pubmed.ncbi.nlm.nih.gov/?Db=pubmed&DbFrom=pubmed&Cmd=Link&LinkName=pubmed_pubmed&IdsFromResult=38260253&ordinalpos=1&itool=EntrezSystem2.PEntrez.Pubmed.Pubmed_ResultsPanel.Pubmed_DiscoveryPanel.Pubmed_Discovery_RA&log$=relatedarticles&logdbfrom=pubmed'>Related, PubMed</a>","<a href='https://scholar.google.com/scholar?q=related:https://pmc.ncbi.nlm.nih.gov/articles/PMC10802395/'>Related, Google Scholar</a>","<a href='https://pubmed.ncbi.nlm.nih.gov/?linkname=pubmed_pubmed_citedin&from_uid=38260253'>Cited By, PMID</a>","<a href='https://scholar.google.com/scholar?hl=en&lr=&cites=https://pmc.ncbi.nlm.nih.gov/articles/PMC10802395/'>Cited By, Google</a>", ,PMID(38260253) OR  ,2024,26928205,,,
P50DA044121,"Center for Translational Pain Research, Northwestern University Feinberg School of Medicine. Chicago, IL. 60610, USA.",2024,"Vigotsky, Andrew D; Cong, Olivia; Pinto, Camila B; Barroso, Joana; Perez, Jennifer; Petersen, Kristian Kjaer; Arendt-Nielsen, Lars; Hardt, Kevin; Manning, David; Apkarian, A Vania; Branco, Paulo",United States, , ,<a href='https://pubmed.ncbi.nlm.nih.gov/38293074'>medRxiv : the preprint server for health sciences</a>,medRxiv, ,eng, ,10827245,38293074,2024 Jan 17,<a href='https://www.ncbi.nlm.nih.gov/pmc/articles/10827245'>Mechanical hyperalgesia and neuropathic pain qualities impart risk for chronic postoperative pain after total knee replacement.</a>,"<a href='https://pubmed.ncbi.nlm.nih.gov/?Db=pubmed&DbFrom=pubmed&Cmd=Link&LinkName=pubmed_pubmed&IdsFromResult=38293074&ordinalpos=1&itool=EntrezSystem2.PEntrez.Pubmed.Pubmed_ResultsPanel.Pubmed_DiscoveryPanel.Pubmed_Discovery_RA&log$=relatedarticles&logdbfrom=pubmed'>Related, PubMed</a>","<a href='https://scholar.google.com/scholar?q=related:https://pmc.ncbi.nlm.nih.gov/articles/PMC10827245/'>Related, Google Scholar</a>","<a href='https://pubmed.ncbi.nlm.nih.gov/?linkname=pubmed_pubmed_citedin&from_uid=38293074'>Cited By, PMID</a>","<a href='https://scholar.google.com/scholar?hl=en&lr=&cites=https://pmc.ncbi.nlm.nih.gov/articles/PMC10827245/'>Cited By, Google</a>", ,PMID(38293074) OR  ,2024,,,,
R01HL156792,"Northwestern University Feinberg School of Medicine, Chicago, Illinois, USA.",2024,"Nazari, Ilana; Feinstein, Matthew J",United States,1098-6618,1,<a href='https://pubmed.ncbi.nlm.nih.gov/38299802'>Clinical microbiology reviews</a>,Clin Microbiol Rev,37,eng,e0009822,10938901,38299802,2024 Mar 14,<a href='https://www.ncbi.nlm.nih.gov/pmc/articles/10938901'>Evolving mechanisms and presentations of cardiovascular disease in people with HIV: implications for management.</a>,"<a href='https://pubmed.ncbi.nlm.nih.gov/?Db=pubmed&DbFrom=pubmed&Cmd=Link&LinkName=pubmed_pubmed&IdsFromResult=38299802&ordinalpos=1&itool=EntrezSystem2.PEntrez.Pubmed.Pubmed_ResultsPanel.Pubmed_DiscoveryPanel.Pubmed_Discovery_RA&log$=relatedarticles&logdbfrom=pubmed'>Related, PubMed</a>","<a href='https://scholar.google.com/scholar?q=related:https://pmc.ncbi.nlm.nih.gov/articles/PMC10938901/'>Related, Google Scholar</a>","<a href='https://pubmed.ncbi.nlm.nih.gov/?linkname=pubmed_pubmed_citedin&from_uid=38299802'>Cited By, PMID</a>","<a href='https://scholar.google.com/scholar?hl=en&lr=&cites=https://pmc.ncbi.nlm.nih.gov/articles/PMC10938901/'>Cited By, Google</a>",3.13,PMID(38299802) OR  ,2024,10986618,,,
F32HL164050,"Department of Psychology & Neuroscience, Baylor University, Waco, TX 76798, USA.",2024,"O'Riordan, Adam; Chen, Michelle A; Maza, Valentina; Vela, Nyla; Wu-Chung, Lydia; Henderson, Alexandria; Carney, Olivia L; LeRoy, Angie S",United States,2152-5250,1,<a href='https://pubmed.ncbi.nlm.nih.gov/38300637'>Aging and disease</a>,Aging Dis,16,eng,49-66,11745431,38300637,2024 Jan 19,<a href='https://www.ncbi.nlm.nih.gov/pmc/articles/11745431'>A Systematic Review of Intervention Trials Utilizing Biomarkers Among Informal Caregivers of People with Alzheimer's Disease & Related Dementias.</a>,"<a href='https://pubmed.ncbi.nlm.nih.gov/?Db=pubmed&DbFrom=pubmed&Cmd=Link&LinkName=pubmed_pubmed&IdsFromResult=38300637&ordinalpos=1&itool=EntrezSystem2.PEntrez.Pubmed.Pubmed_ResultsPanel.Pubmed_DiscoveryPanel.Pubmed_Discovery_RA&log$=relatedarticles&logdbfrom=pubmed'>Related, PubMed</a>","<a href='https://scholar.google.com/scholar?q=related:https://pmc.ncbi.nlm.nih.gov/articles/PMC11745431/'>Related, Google Scholar</a>","<a href='https://pubmed.ncbi.nlm.nih.gov/?linkname=pubmed_pubmed_citedin&from_uid=38300637'>Cited By, PMID</a>","<a href='https://scholar.google.com/scholar?hl=en&lr=&cites=https://pmc.ncbi.nlm.nih.gov/articles/PMC11745431/'>Cited By, Google</a>", ,PMID(38300637) OR  ,2024,21525250,,,
R01EY034444,"Feinberg School of Medicine, Northwestern University, Chicago, Illinois, USA.",2024,"Kanwar, Kunal; Margo, Curtis E; French, Dustin D",England,1744-5086,5,<a href='https://pubmed.ncbi.nlm.nih.gov/38315792'>Ophthalmic epidemiology</a>,Ophthalmic Epidemiol,31,eng,488-490,11298568,38315792,2024 Oct,Self-Reported Visual Disability and Unemployment: Findings from the National Health Interview Survey.,"<a href='https://pubmed.ncbi.nlm.nih.gov/?Db=pubmed&DbFrom=pubmed&Cmd=Link&LinkName=pubmed_pubmed&IdsFromResult=38315792&ordinalpos=1&itool=EntrezSystem2.PEntrez.Pubmed.Pubmed_ResultsPanel.Pubmed_DiscoveryPanel.Pubmed_Discovery_RA&log$=relatedarticles&logdbfrom=pubmed'>Related, PubMed</a>","<a href='https://scholar.google.com/scholar?q=related:https://pmc.ncbi.nlm.nih.gov/articles/PMC11298568/'>Related, Google Scholar</a>","<a href='https://pubmed.ncbi.nlm.nih.gov/?linkname=pubmed_pubmed_citedin&from_uid=38315792'>Cited By, PMID</a>","<a href='https://scholar.google.com/scholar?hl=en&lr=&cites=https://pmc.ncbi.nlm.nih.gov/articles/PMC11298568/'>Cited By, Google</a>", ,PMID(38315792) OR  ,2024,17445086,,,
T32HD007418,"School of Psychology, University of Nottingham, Nottingham, United Kingdom.",2024,"Rodriguez, Andrea Colins; Perich, Matthew G; Miller, Lee; Humphries, Mark D",United States,2692-8205, ,<a href='https://pubmed.ncbi.nlm.nih.gov/37292834'>bioRxiv : the preprint server for biology</a>,bioRxiv, ,eng, ,10246015,37292834,2024 May 17,<a href='https://www.ncbi.nlm.nih.gov/pmc/articles/10246015'>Motor cortex latent dynamics encode spatial and temporal arm movement parameters independently.</a>,"<a href='https://pubmed.ncbi.nlm.nih.gov/?Db=pubmed&DbFrom=pubmed&Cmd=Link&LinkName=pubmed_pubmed&IdsFromResult=37292834&ordinalpos=1&itool=EntrezSystem2.PEntrez.Pubmed.Pubmed_ResultsPanel.Pubmed_DiscoveryPanel.Pubmed_Discovery_RA&log$=relatedarticles&logdbfrom=pubmed'>Related, PubMed</a>","<a href='https://scholar.google.com/scholar?q=related:https://pmc.ncbi.nlm.nih.gov/articles/PMC10246015/'>Related, Google Scholar</a>","<a href='https://pubmed.ncbi.nlm.nih.gov/?linkname=pubmed_pubmed_citedin&from_uid=37292834'>Cited By, PMID</a>","<a href='https://scholar.google.com/scholar?hl=en&lr=&cites=https://pmc.ncbi.nlm.nih.gov/articles/PMC10246015/'>Cited By, Google</a>", ,PMID(37292834) OR  ,2024,26928205,,,
T32MH130325,"Institute for Sexual and Gender Minority Health and Wellbeing, Northwestern University, Chicago, Illinois, USA; email: brian@northwestern.edu.",2024,"Mustanski, Brian; Queiroz, Artur; Merle, James L; Zamantakis, Alithia; Zapata, Juan Pablo; Li, Dennis H; Benbow, Nanette; Pyra, Maria; Smith, Justin D",United States,1545-2085, ,<a href='https://pubmed.ncbi.nlm.nih.gov/37722749'>Annual review of psychology</a>,Annu Rev Psychol,75,eng,55-85,10872355,37722749,2024 Jan 18,<a href='https://www.ncbi.nlm.nih.gov/pmc/articles/10872355'>A Systematic Review of Implementation Research on Determinants and Strategies of Effective HIV Interventions for Men Who Have Sex with Men in the United States.</a>,"<a href='https://pubmed.ncbi.nlm.nih.gov/?Db=pubmed&DbFrom=pubmed&Cmd=Link&LinkName=pubmed_pubmed&IdsFromResult=37722749&ordinalpos=1&itool=EntrezSystem2.PEntrez.Pubmed.Pubmed_ResultsPanel.Pubmed_DiscoveryPanel.Pubmed_Discovery_RA&log$=relatedarticles&logdbfrom=pubmed'>Related, PubMed</a>","<a href='https://scholar.google.com/scholar?q=related:https://pmc.ncbi.nlm.nih.gov/articles/PMC10872355/'>Related, Google Scholar</a>","<a href='https://pubmed.ncbi.nlm.nih.gov/?linkname=pubmed_pubmed_citedin&from_uid=37722749'>Cited By, PMID</a>","<a href='https://scholar.google.com/scholar?hl=en&lr=&cites=https://pmc.ncbi.nlm.nih.gov/articles/PMC10872355/'>Cited By, Google</a>",9.13,PMID(37722749) OR  ,2024,15452085,,,
R01AI125247,"Department of Pharmacology and Nutritional Sciences, University of Kentucky College of Medicine, Lexington, Kentucky, United States.",2024,"Martinez, Genesee J; Appleton, Malik; Kipp, Zachary A; Loria, Analia S; Min, Booki; Hinds Jr, Terry D",United States,1522-1210,1,<a href='https://pubmed.ncbi.nlm.nih.gov/37732829'>Physiological reviews</a>,Physiol Rev,104,eng,473-532,11281820,37732829,2024 Jan 01,"<a href='https://www.ncbi.nlm.nih.gov/pmc/articles/11281820'>Glucocorticoids, their uses, sexual dimorphisms, and diseases: new concepts, mechanisms, and discoveries.</a>","<a href='https://pubmed.ncbi.nlm.nih.gov/?Db=pubmed&DbFrom=pubmed&Cmd=Link&LinkName=pubmed_pubmed&IdsFromResult=37732829&ordinalpos=1&itool=EntrezSystem2.PEntrez.Pubmed.Pubmed_ResultsPanel.Pubmed_DiscoveryPanel.Pubmed_Discovery_RA&log$=relatedarticles&logdbfrom=pubmed'>Related, PubMed</a>","<a href='https://scholar.google.com/scholar?q=related:https://pmc.ncbi.nlm.nih.gov/articles/PMC11281820/'>Related, Google Scholar</a>","<a href='https://pubmed.ncbi.nlm.nih.gov/?linkname=pubmed_pubmed_citedin&from_uid=37732829'>Cited By, PMID</a>","<a href='https://scholar.google.com/scholar?hl=en&lr=&cites=https://pmc.ncbi.nlm.nih.gov/articles/PMC11281820/'>Cited By, Google</a>",10.9,PMID(37732829) OR  ,2024,15221210,,,
