Core Project Number,Affiliation,Pub Year,Authors,Country,ISSN,Journal Issue,Journal (Link to PubMed abstract),Journal Title ABBR,Journal Volume,Language,Page Number,PMC ID,PMID,PUB Date,Title (Link to full-text in PubMed Central),Related Publications in PubMed,Related Publications in Google Scholar,Articles Citing from PubMed Central,Articles Citing from Google Scholar,Relative Citation Ratio,Unnamed: 21,_year_int,_issn_norm,APC 2025 (USD),Publisher,Journal
UL1TR001422,"Feinberg School of Medicine, Northwestern University, Chicago, Illinois, USA.",2024,"Hosseini, Mohammad; Senabre Hidalgo, Enric; Horbach, Serge P J M; Güttinger, Stephan; Penders, Bart",United States,1545-5815,5,<a href='https://pubmed.ncbi.nlm.nih.gov/36303330'>Accountability in research</a>,Account Res,31,eng,428-455,10163171,36303330,2024 Jul,<a href='https://www.ncbi.nlm.nih.gov/pmc/articles/10163171'>Messing with Merton: The intersection between open science practices and Mertonian values.</a>,"<a href='https://pubmed.ncbi.nlm.nih.gov/?Db=pubmed&DbFrom=pubmed&Cmd=Link&LinkName=pubmed_pubmed&IdsFromResult=36303330&ordinalpos=1&itool=EntrezSystem2.PEntrez.Pubmed.Pubmed_ResultsPanel.Pubmed_DiscoveryPanel.Pubmed_Discovery_RA&log$=relatedarticles&logdbfrom=pubmed'>Related, PubMed</a>","<a href='https://scholar.google.com/scholar?q=related:https://pmc.ncbi.nlm.nih.gov/articles/PMC10163171/'>Related, Google Scholar</a>","<a href='https://pubmed.ncbi.nlm.nih.gov/?linkname=pubmed_pubmed_citedin&from_uid=36303330'>Cited By, PMID</a>","<a href='https://scholar.google.com/scholar?hl=en&lr=&cites=https://pmc.ncbi.nlm.nih.gov/articles/PMC10163171/'>Cited By, Google</a>",2.94,PMID(36303330) OR  ,2024,15455815,,,
R01AG018436,"Department of Psychological and Brain Sciences, Washington University in St. Louis, St. Louis; MO, USA.",2024,"Pfund, Gabrielle N; Willroth, Emily C; Mroczek, Daniel K; Hill, Patrick L",United States,1948-5506,3,<a href='https://pubmed.ncbi.nlm.nih.gov/38435845'>Social psychological and personality science</a>,Soc Psychol Personal Sci,15,eng,275-287,10904030,38435845,2024 Apr,<a href='https://www.ncbi.nlm.nih.gov/pmc/articles/10904030'>Valuing versus having: The contrary roles of valuing and having money and prestige on well-being.</a>,"<a href='https://pubmed.ncbi.nlm.nih.gov/?Db=pubmed&DbFrom=pubmed&Cmd=Link&LinkName=pubmed_pubmed&IdsFromResult=38435845&ordinalpos=1&itool=EntrezSystem2.PEntrez.Pubmed.Pubmed_ResultsPanel.Pubmed_DiscoveryPanel.Pubmed_Discovery_RA&log$=relatedarticles&logdbfrom=pubmed'>Related, PubMed</a>","<a href='https://scholar.google.com/scholar?q=related:https://pmc.ncbi.nlm.nih.gov/articles/PMC10904030/'>Related, Google Scholar</a>","<a href='https://pubmed.ncbi.nlm.nih.gov/?linkname=pubmed_pubmed_citedin&from_uid=38435845'>Cited By, PMID</a>","<a href='https://scholar.google.com/scholar?hl=en&lr=&cites=https://pmc.ncbi.nlm.nih.gov/articles/PMC10904030/'>Cited By, Google</a>", ,PMID(38435845) OR  ,2024,19485506,,,
R01AI150998,"Division of Infectious Diseases, Department of Medicine, Feinberg School of Medicine, Northwestern University, Chicago, IL 60611, USA.",2024,"Cisneros, William J; Walter, Miriam; Soliman, Shimaa H A; Simons, Lacy M; Cornish, Daphne; Halle, Ariel W; Kim, Eun-Young; Wolinsky, Steven M; Shilatifard, Ali; Hultquist, Judd F",United States,2692-8205, ,<a href='https://pubmed.ncbi.nlm.nih.gov/38464055'>bioRxiv : the preprint server for biology</a>,bioRxiv, ,eng, ,10925308,38464055,2024 Mar 01,<a href='https://www.ncbi.nlm.nih.gov/pmc/articles/10925308'>Release of P-TEFb from the Super Elongation Complex promotes HIV-1 latency reversal.</a>,"<a href='https://pubmed.ncbi.nlm.nih.gov/?Db=pubmed&DbFrom=pubmed&Cmd=Link&LinkName=pubmed_pubmed&IdsFromResult=38464055&ordinalpos=1&itool=EntrezSystem2.PEntrez.Pubmed.Pubmed_ResultsPanel.Pubmed_DiscoveryPanel.Pubmed_Discovery_RA&log$=relatedarticles&logdbfrom=pubmed'>Related, PubMed</a>","<a href='https://scholar.google.com/scholar?q=related:https://pmc.ncbi.nlm.nih.gov/articles/PMC10925308/'>Related, Google Scholar</a>","<a href='https://pubmed.ncbi.nlm.nih.gov/?linkname=pubmed_pubmed_citedin&from_uid=38464055'>Cited By, PMID</a>","<a href='https://scholar.google.com/scholar?hl=en&lr=&cites=https://pmc.ncbi.nlm.nih.gov/articles/PMC10925308/'>Cited By, Google</a>", ,PMID(38464055) OR  ,2024,26928205,,,
F31NS120500,"Department of Physical Therapy and Human Movement Sciences, Feinberg School of Medicine, Northwestern University, Chicago, USA.",2024,"Gomes, Matheus M; Jenz, Sophia T; Beauchamp, James A; Negro, Francesco; Heckman, C J; Pearcey, Gregory E P",United States,2692-8205, ,<a href='https://pubmed.ncbi.nlm.nih.gov/38464115'>bioRxiv : the preprint server for biology</a>,bioRxiv, ,eng, ,10925258,38464115,2024 Mar 03,<a href='https://www.ncbi.nlm.nih.gov/pmc/articles/10925258'>Voluntary co-contraction of ankle muscles alters motor unit discharge characteristics and reduces estimates of persistent inward currents.</a>,"<a href='https://pubmed.ncbi.nlm.nih.gov/?Db=pubmed&DbFrom=pubmed&Cmd=Link&LinkName=pubmed_pubmed&IdsFromResult=38464115&ordinalpos=1&itool=EntrezSystem2.PEntrez.Pubmed.Pubmed_ResultsPanel.Pubmed_DiscoveryPanel.Pubmed_Discovery_RA&log$=relatedarticles&logdbfrom=pubmed'>Related, PubMed</a>","<a href='https://scholar.google.com/scholar?q=related:https://pmc.ncbi.nlm.nih.gov/articles/PMC10925258/'>Related, Google Scholar</a>","<a href='https://pubmed.ncbi.nlm.nih.gov/?linkname=pubmed_pubmed_citedin&from_uid=38464115'>Cited By, PMID</a>","<a href='https://scholar.google.com/scholar?hl=en&lr=&cites=https://pmc.ncbi.nlm.nih.gov/articles/PMC10925258/'>Cited By, Google</a>", ,PMID(38464115) OR  ,2024,26928205,,,
T32EY025202, ,2024,"Aranda, Marcos L; Bhoi, Jacob D; Parra, Omar A Payán; Lee, Seul Ki; Yamada, Tomoko; Yang, Yue; Schmidt, Tiffany M",United States,2692-8205, ,<a href='https://pubmed.ncbi.nlm.nih.gov/38712084'>bioRxiv : the preprint server for biology</a>,bioRxiv, ,eng, ,11071530,38712084,2024 Apr 28,<a href='https://www.ncbi.nlm.nih.gov/pmc/articles/11071530'>Genetic tuning of intrinsically photosensitive retinal ganglion cell subtype identity to drive visual behavior.</a>,"<a href='https://pubmed.ncbi.nlm.nih.gov/?Db=pubmed&DbFrom=pubmed&Cmd=Link&LinkName=pubmed_pubmed&IdsFromResult=38712084&ordinalpos=1&itool=EntrezSystem2.PEntrez.Pubmed.Pubmed_ResultsPanel.Pubmed_DiscoveryPanel.Pubmed_Discovery_RA&log$=relatedarticles&logdbfrom=pubmed'>Related, PubMed</a>","<a href='https://scholar.google.com/scholar?q=related:https://pmc.ncbi.nlm.nih.gov/articles/PMC11071530/'>Related, Google Scholar</a>","<a href='https://pubmed.ncbi.nlm.nih.gov/?linkname=pubmed_pubmed_citedin&from_uid=38712084'>Cited By, PMID</a>","<a href='https://scholar.google.com/scholar?hl=en&lr=&cites=https://pmc.ncbi.nlm.nih.gov/articles/PMC11071530/'>Cited By, Google</a>", ,PMID(38712084) OR  ,2024,26928205,,,
R01HL122309, ,2024,"Becker, Amanda; Filipp, Mallory; Lantz, Connor; Glinton, Kristofor; Thorp, Edward B",United States,2692-8205, ,<a href='https://pubmed.ncbi.nlm.nih.gov/38712137'>bioRxiv : the preprint server for biology</a>,bioRxiv, ,eng, ,11071477,38712137,2024 Apr 28,<a href='https://www.ncbi.nlm.nih.gov/pmc/articles/11071477'>HIF-1α is Required to Differentiate the Neonatal Macrophage Secretome from Adults.</a>,"<a href='https://pubmed.ncbi.nlm.nih.gov/?Db=pubmed&DbFrom=pubmed&Cmd=Link&LinkName=pubmed_pubmed&IdsFromResult=38712137&ordinalpos=1&itool=EntrezSystem2.PEntrez.Pubmed.Pubmed_ResultsPanel.Pubmed_DiscoveryPanel.Pubmed_Discovery_RA&log$=relatedarticles&logdbfrom=pubmed'>Related, PubMed</a>","<a href='https://scholar.google.com/scholar?q=related:https://pmc.ncbi.nlm.nih.gov/articles/PMC11071477/'>Related, Google Scholar</a>","<a href='https://pubmed.ncbi.nlm.nih.gov/?linkname=pubmed_pubmed_citedin&from_uid=38712137'>Cited By, PMID</a>","<a href='https://scholar.google.com/scholar?hl=en&lr=&cites=https://pmc.ncbi.nlm.nih.gov/articles/PMC11071477/'>Cited By, Google</a>", ,PMID(38712137) OR  ,2024,26928205,,,
T32GM008449,"Department of Chemical and Biological Engineering, Northwestern University, Evanston, Illinois 60208, USA.",2024,"Li, Yueyi; Lucci, Tyler; Dujovne, Matias Villarruel; Jung, Jaeyoung Kirsten; Capdevila, Daiana A; Lucks, Julius B",United States,2692-8205, ,<a href='https://pubmed.ncbi.nlm.nih.gov/38712145'>bioRxiv : the preprint server for biology</a>,bioRxiv, ,eng, ,11071457,38712145,2024 Apr 25,<a href='https://www.ncbi.nlm.nih.gov/pmc/articles/11071457'>Engineering a cell-free biosensor signal amplification circuit with polymerase strand recycling.</a>,"<a href='https://pubmed.ncbi.nlm.nih.gov/?Db=pubmed&DbFrom=pubmed&Cmd=Link&LinkName=pubmed_pubmed&IdsFromResult=38712145&ordinalpos=1&itool=EntrezSystem2.PEntrez.Pubmed.Pubmed_ResultsPanel.Pubmed_DiscoveryPanel.Pubmed_Discovery_RA&log$=relatedarticles&logdbfrom=pubmed'>Related, PubMed</a>","<a href='https://scholar.google.com/scholar?q=related:https://pmc.ncbi.nlm.nih.gov/articles/PMC11071457/'>Related, Google Scholar</a>","<a href='https://pubmed.ncbi.nlm.nih.gov/?linkname=pubmed_pubmed_citedin&from_uid=38712145'>Cited By, PMID</a>","<a href='https://scholar.google.com/scholar?hl=en&lr=&cites=https://pmc.ncbi.nlm.nih.gov/articles/PMC11071457/'>Cited By, Google</a>", ,PMID(38712145) OR  ,2024,26928205,,,
P30AG013854,"Department of Neurology and Neurological Sciences, Stanford University School of Medicine, Stanford, CA, USA.",2024,"Belloy, Michael E; Guen, Yann Le; Stewart, Ilaria; Herz, Joachim; Sherva, Richard; Zhang, Rui; Merritt, Victoria; Panizzon, Matthew S; Hauger, Richard L; VA Million Veteran Program; Gaziano, J Michael; Logue, Mark; Napolioni, Valerio; Greicius, Michael D",United States, , ,<a href='https://pubmed.ncbi.nlm.nih.gov/38712163'>medRxiv : the preprint server for health sciences</a>,medRxiv, ,eng, ,11071554,38712163,2024 Apr 23,<a href='https://www.ncbi.nlm.nih.gov/pmc/articles/11071554'>The Role of X Chromosome in Alzheimer's Disease Genetics.</a>,"<a href='https://pubmed.ncbi.nlm.nih.gov/?Db=pubmed&DbFrom=pubmed&Cmd=Link&LinkName=pubmed_pubmed&IdsFromResult=38712163&ordinalpos=1&itool=EntrezSystem2.PEntrez.Pubmed.Pubmed_ResultsPanel.Pubmed_DiscoveryPanel.Pubmed_Discovery_RA&log$=relatedarticles&logdbfrom=pubmed'>Related, PubMed</a>","<a href='https://scholar.google.com/scholar?q=related:https://pmc.ncbi.nlm.nih.gov/articles/PMC11071554/'>Related, Google Scholar</a>","<a href='https://pubmed.ncbi.nlm.nih.gov/?linkname=pubmed_pubmed_citedin&from_uid=38712163'>Cited By, PMID</a>","<a href='https://scholar.google.com/scholar?hl=en&lr=&cites=https://pmc.ncbi.nlm.nih.gov/articles/PMC11071554/'>Cited By, Google</a>", ,PMID(38712163) OR  ,2024,,,,
K99AG071838,"Department of Psychology, University of Houston, Houston, Texas, USA.",2024,"Atherton, Olivia E; Willroth, Emily C; Graham, Eileen K; Luo, Jing; Mroczek, Daniel K; Lewis-Thames, Marquita W",United States,1467-6494,1,<a href='https://pubmed.ncbi.nlm.nih.gov/36725776'>Journal of personality</a>,J Pers,92,eng,73-87,10390645,36725776,2024 Feb,<a href='https://www.ncbi.nlm.nih.gov/pmc/articles/10390645'>Rural-urban differences in personality traits and well-being in adulthood.</a>,"<a href='https://pubmed.ncbi.nlm.nih.gov/?Db=pubmed&DbFrom=pubmed&Cmd=Link&LinkName=pubmed_pubmed&IdsFromResult=36725776&ordinalpos=1&itool=EntrezSystem2.PEntrez.Pubmed.Pubmed_ResultsPanel.Pubmed_DiscoveryPanel.Pubmed_Discovery_RA&log$=relatedarticles&logdbfrom=pubmed'>Related, PubMed</a>","<a href='https://scholar.google.com/scholar?q=related:https://pmc.ncbi.nlm.nih.gov/articles/PMC10390645/'>Related, Google Scholar</a>","<a href='https://pubmed.ncbi.nlm.nih.gov/?linkname=pubmed_pubmed_citedin&from_uid=36725776'>Cited By, PMID</a>","<a href='https://scholar.google.com/scholar?hl=en&lr=&cites=https://pmc.ncbi.nlm.nih.gov/articles/PMC10390645/'>Cited By, Google</a>",4.14,PMID(36725776) OR  ,2024,14676494,,,
R01AG082954,"Department of Psychology, University of Houston, Houston, Texas, USA.",2024,"Atherton, Olivia E; Willroth, Emily C; Graham, Eileen K; Luo, Jing; Mroczek, Daniel K; Lewis-Thames, Marquita W",United States,1467-6494,1,<a href='https://pubmed.ncbi.nlm.nih.gov/36725776'>Journal of personality</a>,J Pers,92,eng,73-87,10390645,36725776,2024 Feb,<a href='https://www.ncbi.nlm.nih.gov/pmc/articles/10390645'>Rural-urban differences in personality traits and well-being in adulthood.</a>,"<a href='https://pubmed.ncbi.nlm.nih.gov/?Db=pubmed&DbFrom=pubmed&Cmd=Link&LinkName=pubmed_pubmed&IdsFromResult=36725776&ordinalpos=1&itool=EntrezSystem2.PEntrez.Pubmed.Pubmed_ResultsPanel.Pubmed_DiscoveryPanel.Pubmed_Discovery_RA&log$=relatedarticles&logdbfrom=pubmed'>Related, PubMed</a>","<a href='https://scholar.google.com/scholar?q=related:https://pmc.ncbi.nlm.nih.gov/articles/PMC10390645/'>Related, Google Scholar</a>","<a href='https://pubmed.ncbi.nlm.nih.gov/?linkname=pubmed_pubmed_citedin&from_uid=36725776'>Cited By, PMID</a>","<a href='https://scholar.google.com/scholar?hl=en&lr=&cites=https://pmc.ncbi.nlm.nih.gov/articles/PMC10390645/'>Cited By, Google</a>",4.14,PMID(36725776) OR  ,2024,14676494,,,
T32MH130325,"Institute for Sexual and Gender Minority Health and Wellbeing and the Department of Medical Social Sciences at Northwestern University. She is the author of Thinking Cis (Rowman & Littlefield, 2023) and Sexuality Social Justice (Press Books, 2024).",2024,"Zamantakis, Alithia; Zapata, Juan Pablo; Queiroz, Artur A F L N; Donoso, Valeria A",United States,2769-2124,4-Mar,<a href='https://pubmed.ncbi.nlm.nih.gov/39991728'>Bulletin of applied transgender studies</a>,Bull Appl Transgend Stud,3,eng,205-228,11845241,39991728,2024 Dec 15,<a href='https://www.ncbi.nlm.nih.gov/pmc/articles/11845241'>Barriers and Facilitators to Integrating Gender-Affirming Care and HIV Prevention/Treatment in Illinois and Missouri: Formative Interviews with Implementation Practitioners.</a>,"<a href='https://pubmed.ncbi.nlm.nih.gov/?Db=pubmed&DbFrom=pubmed&Cmd=Link&LinkName=pubmed_pubmed&IdsFromResult=39991728&ordinalpos=1&itool=EntrezSystem2.PEntrez.Pubmed.Pubmed_ResultsPanel.Pubmed_DiscoveryPanel.Pubmed_Discovery_RA&log$=relatedarticles&logdbfrom=pubmed'>Related, PubMed</a>","<a href='https://scholar.google.com/scholar?q=related:https://pmc.ncbi.nlm.nih.gov/articles/PMC11845241/'>Related, Google Scholar</a>","<a href='https://pubmed.ncbi.nlm.nih.gov/?linkname=pubmed_pubmed_citedin&from_uid=39991728'>Cited By, PMID</a>","<a href='https://scholar.google.com/scholar?hl=en&lr=&cites=https://pmc.ncbi.nlm.nih.gov/articles/PMC11845241/'>Cited By, Google</a>", ,PMID(39991728) OR  ,2024,27692124,,,
F31AG079630,"Department of Psychiatry and Behavioral Health, Ohio State University Wexner Medical Center, Columbus, OH, USA.",2024,"Che, Tiffanie; Kim, Soyoung; Greene, Deanna J; Heywood, Ashley; Ding, Jimin; Hershey, Tamara; Schlaggar, Bradley L; Black, Kevin J; Wang, Lei",United States,1092-8529,6,<a href='https://pubmed.ncbi.nlm.nih.gov/39604269'>CNS spectrums</a>,CNS Spectr,29,eng,652-664,11839322,39604269,2024 Dec,<a href='https://www.ncbi.nlm.nih.gov/pmc/articles/11839322'>Correlating clinical course with baseline subcortical shape in provisional tic disorder.</a>,"<a href='https://pubmed.ncbi.nlm.nih.gov/?Db=pubmed&DbFrom=pubmed&Cmd=Link&LinkName=pubmed_pubmed&IdsFromResult=39604269&ordinalpos=1&itool=EntrezSystem2.PEntrez.Pubmed.Pubmed_ResultsPanel.Pubmed_DiscoveryPanel.Pubmed_Discovery_RA&log$=relatedarticles&logdbfrom=pubmed'>Related, PubMed</a>","<a href='https://scholar.google.com/scholar?q=related:https://pmc.ncbi.nlm.nih.gov/articles/PMC11839322/'>Related, Google Scholar</a>","<a href='https://pubmed.ncbi.nlm.nih.gov/?linkname=pubmed_pubmed_citedin&from_uid=39604269'>Cited By, PMID</a>","<a href='https://scholar.google.com/scholar?hl=en&lr=&cites=https://pmc.ncbi.nlm.nih.gov/articles/PMC11839322/'>Cited By, Google</a>", ,PMID(39604269) OR  ,2024,10928529,,,
T32HL076139,"Department of Biomedical Engineering, Northwestern University, Evanston, IL 60208, USA.",2024,"Frederick, Jane; Virk, Ranya K A; Ye, I Chae; Almassalha, Luay M; Wodarcyk, Greta M; VanDerway, David; Gonzalez, Paola Carrillo; Nap, Rikkert J; Agrawal, Vasundhara; Anthony, Nicholas M; Carinato, John; Li, Wing Shun; Dunton, Cody L; Medina, Karla I; Kakkaramadam, Rivaan; Jain, Surbhi; Shahabi, Shohreh; Ameer, Guillermo; Szleifer, Igal G; Backman, Vadim",United States,2692-8205, ,<a href='https://pubmed.ncbi.nlm.nih.gov/39605341'>bioRxiv : the preprint server for biology</a>,bioRxiv, ,eng, ,11601449,39605341,2024 Nov 15,<a href='https://www.ncbi.nlm.nih.gov/pmc/articles/11601449'>Leveraging chromatin packing domains to target chemoevasion in vivo.</a>,"<a href='https://pubmed.ncbi.nlm.nih.gov/?Db=pubmed&DbFrom=pubmed&Cmd=Link&LinkName=pubmed_pubmed&IdsFromResult=39605341&ordinalpos=1&itool=EntrezSystem2.PEntrez.Pubmed.Pubmed_ResultsPanel.Pubmed_DiscoveryPanel.Pubmed_Discovery_RA&log$=relatedarticles&logdbfrom=pubmed'>Related, PubMed</a>","<a href='https://scholar.google.com/scholar?q=related:https://pmc.ncbi.nlm.nih.gov/articles/PMC11601449/'>Related, Google Scholar</a>","<a href='https://pubmed.ncbi.nlm.nih.gov/?linkname=pubmed_pubmed_citedin&from_uid=39605341'>Cited By, PMID</a>","<a href='https://scholar.google.com/scholar?hl=en&lr=&cites=https://pmc.ncbi.nlm.nih.gov/articles/PMC11601449/'>Cited By, Google</a>", ,PMID(39605341) OR  ,2024,26928205,,,
R01NS085002,"Department of Biomedical Engineering, McCormick School of Engineering and Applied Sciences, Northwestern University, Evanston, IL, United States.",2024,"Johnson, Hannah R; Wang, Max C; Stickland, Rachael C; Chen, Yufen; Parrish, Todd B; Sorond, Farzaneh A; Bright, Molly G",United States,2692-8205, ,<a href='https://pubmed.ncbi.nlm.nih.gov/39605678'>bioRxiv : the preprint server for biology</a>,bioRxiv, ,eng, ,11601454,39605678,2024 Nov 15,<a href='https://www.ncbi.nlm.nih.gov/pmc/articles/11601454'>Variable Cerebral Blood Flow Responsiveness to Acute Hypoxic Hypoxia.</a>,"<a href='https://pubmed.ncbi.nlm.nih.gov/?Db=pubmed&DbFrom=pubmed&Cmd=Link&LinkName=pubmed_pubmed&IdsFromResult=39605678&ordinalpos=1&itool=EntrezSystem2.PEntrez.Pubmed.Pubmed_ResultsPanel.Pubmed_DiscoveryPanel.Pubmed_Discovery_RA&log$=relatedarticles&logdbfrom=pubmed'>Related, PubMed</a>","<a href='https://scholar.google.com/scholar?q=related:https://pmc.ncbi.nlm.nih.gov/articles/PMC11601454/'>Related, Google Scholar</a>","<a href='https://pubmed.ncbi.nlm.nih.gov/?linkname=pubmed_pubmed_citedin&from_uid=39605678'>Cited By, PMID</a>","<a href='https://scholar.google.com/scholar?hl=en&lr=&cites=https://pmc.ncbi.nlm.nih.gov/articles/PMC11601454/'>Cited By, Google</a>", ,PMID(39605678) OR  ,2024,26928205,,,
P30AG072977,"Department of Cell Biology and Physiology, University of Kansas Medical Center, 3901 Rainbow Blvd, Kansas City, KS, 66160.",2024,"Mansel, Clayton; Mazzotti, Diego R; Townley, Ryan; Sardiu, Mihaela E; Swerdlow, Russell H; Honea, Robyn A; Veatch, Olivia J",United States, , ,<a href='https://pubmed.ncbi.nlm.nih.gov/39649607'>medRxiv : the preprint server for health sciences</a>,medRxiv, ,eng, ,11623748,39649607,2024 Nov 28,<a href='https://www.ncbi.nlm.nih.gov/pmc/articles/11623748'>Distinct medical and substance use histories associate with cognitive decline in Alzheimer's Disease.</a>,"<a href='https://pubmed.ncbi.nlm.nih.gov/?Db=pubmed&DbFrom=pubmed&Cmd=Link&LinkName=pubmed_pubmed&IdsFromResult=39649607&ordinalpos=1&itool=EntrezSystem2.PEntrez.Pubmed.Pubmed_ResultsPanel.Pubmed_DiscoveryPanel.Pubmed_Discovery_RA&log$=relatedarticles&logdbfrom=pubmed'>Related, PubMed</a>","<a href='https://scholar.google.com/scholar?q=related:https://pmc.ncbi.nlm.nih.gov/articles/PMC11623748/'>Related, Google Scholar</a>","<a href='https://pubmed.ncbi.nlm.nih.gov/?linkname=pubmed_pubmed_citedin&from_uid=39649607'>Cited By, PMID</a>","<a href='https://scholar.google.com/scholar?hl=en&lr=&cites=https://pmc.ncbi.nlm.nih.gov/articles/PMC11623748/'>Cited By, Google</a>", ,PMID(39649607) OR  ,2024,,,,
R35GM142441,"Department of Urology, Northwestern University, Feinberg School of Medicine, Chicago, IL, USA.",2024,"Li, Yangyang; Yang, Rendong",United States,2692-8205, ,<a href='https://pubmed.ncbi.nlm.nih.gov/37577677'>bioRxiv : the preprint server for biology</a>,bioRxiv, ,eng, ,10418261,37577677,2024 Feb 05,<a href='https://www.ncbi.nlm.nih.gov/pmc/articles/10418261'>PxBLAT: An efficient python binding library for BLAT.</a>,"<a href='https://pubmed.ncbi.nlm.nih.gov/?Db=pubmed&DbFrom=pubmed&Cmd=Link&LinkName=pubmed_pubmed&IdsFromResult=37577677&ordinalpos=1&itool=EntrezSystem2.PEntrez.Pubmed.Pubmed_ResultsPanel.Pubmed_DiscoveryPanel.Pubmed_Discovery_RA&log$=relatedarticles&logdbfrom=pubmed'>Related, PubMed</a>","<a href='https://scholar.google.com/scholar?q=related:https://pmc.ncbi.nlm.nih.gov/articles/PMC10418261/'>Related, Google Scholar</a>","<a href='https://pubmed.ncbi.nlm.nih.gov/?linkname=pubmed_pubmed_citedin&from_uid=37577677'>Cited By, PMID</a>","<a href='https://scholar.google.com/scholar?hl=en&lr=&cites=https://pmc.ncbi.nlm.nih.gov/articles/PMC10418261/'>Cited By, Google</a>", ,PMID(37577677) OR  ,2024,26928205,,,
F32HD104408,"Department of Psychology, Northwestern University.",2024,"Luchkina, Elena; Waxman, Sandra",United States,1745-6924,6,<a href='https://pubmed.ncbi.nlm.nih.gov/37603076'>Perspectives on psychological science : a journal of the Association for Psychological Science</a>,Perspect Psychol Sci,19,eng,978-992,10879458,37603076,2024 Nov,<a href='https://www.ncbi.nlm.nih.gov/pmc/articles/10879458'>Talking About the Absent and the Abstract: Referential Communication in Language and Gesture.</a>,"<a href='https://pubmed.ncbi.nlm.nih.gov/?Db=pubmed&DbFrom=pubmed&Cmd=Link&LinkName=pubmed_pubmed&IdsFromResult=37603076&ordinalpos=1&itool=EntrezSystem2.PEntrez.Pubmed.Pubmed_ResultsPanel.Pubmed_DiscoveryPanel.Pubmed_Discovery_RA&log$=relatedarticles&logdbfrom=pubmed'>Related, PubMed</a>","<a href='https://scholar.google.com/scholar?q=related:https://pmc.ncbi.nlm.nih.gov/articles/PMC10879458/'>Related, Google Scholar</a>","<a href='https://pubmed.ncbi.nlm.nih.gov/?linkname=pubmed_pubmed_citedin&from_uid=37603076'>Cited By, PMID</a>","<a href='https://scholar.google.com/scholar?hl=en&lr=&cites=https://pmc.ncbi.nlm.nih.gov/articles/PMC10879458/'>Cited By, Google</a>", ,PMID(37603076) OR  ,2024,17456924,,,
U54EB027049,"Center for Innovation in Global Health Technologies (CIGHT), Robert J. Havey Institute for Global Health, Northwestern University Feinberg School of Medicine, Chicago, IL 60611 United States; Department of Biomedical Engineering, Northwestern University, Evanston, IL 60208 United States.",2024,"Butzler, Matthew A; Reed, Jennifer L; Knapton, Kirsten M; Afzal, Tania; Agarwal, Abhishek K; Schaeffer, Jakob; Saraiya, Neeraj; Oti, Lisa; White, Ezekiel R; Giacobbe, Emilie; Simons, Lacy M; Ozer, Egon A; McFall, Sally M",United States,1879-0070,1,<a href='https://pubmed.ncbi.nlm.nih.gov/37898036'>Diagnostic microbiology and infectious disease</a>,Diagn Microbiol Infect Dis,108,eng,116120,10842742,37898036,2024 Jan,<a href='https://www.ncbi.nlm.nih.gov/pmc/articles/10842742'>Evaluation of the analytical performance of the 15-minute point-of-care DASH™ SARS-CoV-2 RT-qPCR test.</a>,"<a href='https://pubmed.ncbi.nlm.nih.gov/?Db=pubmed&DbFrom=pubmed&Cmd=Link&LinkName=pubmed_pubmed&IdsFromResult=37898036&ordinalpos=1&itool=EntrezSystem2.PEntrez.Pubmed.Pubmed_ResultsPanel.Pubmed_DiscoveryPanel.Pubmed_Discovery_RA&log$=relatedarticles&logdbfrom=pubmed'>Related, PubMed</a>","<a href='https://scholar.google.com/scholar?q=related:https://pmc.ncbi.nlm.nih.gov/articles/PMC10842742/'>Related, Google Scholar</a>","<a href='https://pubmed.ncbi.nlm.nih.gov/?linkname=pubmed_pubmed_citedin&from_uid=37898036'>Cited By, PMID</a>","<a href='https://scholar.google.com/scholar?hl=en&lr=&cites=https://pmc.ncbi.nlm.nih.gov/articles/PMC10842742/'>Cited By, Google</a>", ,PMID(37898036) OR  ,2024,18790070,,,
T32CA193193,"Positive Psychology Center, University of Pennsylvania, Pennsylvania, Philadelphia, USA.",2024,"Kerry, Nicholas; White, K C; O'Brien, Mark L; Perry, Laura M; Clifton, Jeremy D W",United States,1467-6494,4,<a href='https://pubmed.ncbi.nlm.nih.gov/37614186'>Journal of personality</a>,J Pers,92,eng,1129-1142,10988650,37614186,2024 Aug,"<a href='https://www.ncbi.nlm.nih.gov/pmc/articles/10988650'>Despite popular intuition, positive world beliefs poorly reflect several objective indicators of privilege, including wealth, health, sex, and neighborhood safety.</a>","<a href='https://pubmed.ncbi.nlm.nih.gov/?Db=pubmed&DbFrom=pubmed&Cmd=Link&LinkName=pubmed_pubmed&IdsFromResult=37614186&ordinalpos=1&itool=EntrezSystem2.PEntrez.Pubmed.Pubmed_ResultsPanel.Pubmed_DiscoveryPanel.Pubmed_Discovery_RA&log$=relatedarticles&logdbfrom=pubmed'>Related, PubMed</a>","<a href='https://scholar.google.com/scholar?q=related:https://pmc.ncbi.nlm.nih.gov/articles/PMC10988650/'>Related, Google Scholar</a>","<a href='https://pubmed.ncbi.nlm.nih.gov/?linkname=pubmed_pubmed_citedin&from_uid=37614186'>Cited By, PMID</a>","<a href='https://scholar.google.com/scholar?hl=en&lr=&cites=https://pmc.ncbi.nlm.nih.gov/articles/PMC10988650/'>Cited By, Google</a>",3.19,PMID(37614186) OR  ,2024,14676494,,,
