U54EB027049,Stellenbosch University.,2024,"Moodley, Suventha; Kroon, Elouise; Naidoo, Charissa C; Nyawo, Georgina R; Wu, Benjamin G; Naidoo, Selisha; Chiyaka, Tinaye L; Tshivhula, Happy; Singh, Shivani; Li, Yonghua; Warren, Robin M; Hoal, Eileen G; Schurr, Erwin; Clemente, Jose; Segal, Leopoldo N; Möller, Marlo; Theron, Grant",United States,2693-5015, ,<a href='https://pubmed.ncbi.nlm.nih.gov/38645218'>Research square</a>,Res Sq, ,eng, ,11030539,38645218,2024 Apr 02,<a href='https://www.ncbi.nlm.nih.gov/pmc/articles/11030539'>Latent tuberculosis infection is associated with an enrichment of short chain fatty acid producing bacteria in the stool of women living with HIV.</a>,"<a href='https://pubmed.ncbi.nlm.nih.gov/?Db=pubmed&DbFrom=pubmed&Cmd=Link&LinkName=pubmed_pubmed&IdsFromResult=38645218&ordinalpos=1&itool=EntrezSystem2.PEntrez.Pubmed.Pubmed_ResultsPanel.Pubmed_DiscoveryPanel.Pubmed_Discovery_RA&log$=relatedarticles&logdbfrom=pubmed'>Related, PubMed</a>","<a href='https://scholar.google.com/scholar?q=related:https://pmc.ncbi.nlm.nih.gov/articles/PMC11030539/'>Related, Google Scholar</a>","<a href='https://pubmed.ncbi.nlm.nih.gov/?linkname=pubmed_pubmed_citedin&from_uid=38645218'>Cited By, PMID</a>","<a href='https://scholar.google.com/scholar?hl=en&lr=&cites=https://pmc.ncbi.nlm.nih.gov/articles/PMC11030539/'>Cited By, Google</a>", ,38645218,2024,26935015,res sq,,,,Res Sq,Unknown,,False,False,False,
R35CA197532,"Department of Biochemistry and Molecular Genetics, Feinberg School of Medicine, Northwestern University, Chicago, IL 60611, USA.",2024,"Sahu, Umakant; Villa, Elodie; Reczek, Colleen R; Zhao, Zibo; O'Hara, Brendan P; Torno, Michael D; Mishra, Rohan; Shannon, William D; Asara, John M; Gao, Peng; Shilatifard, Ali; Chandel, Navdeep S; Ben-Sahra, Issam",United States,1095-9203,6690,"<a href='https://pubmed.ncbi.nlm.nih.gov/38547260'>Science (New York, N.Y.)</a>",Science,383,eng,1484-1492,11325697,38547260,2024 Mar 29,<a href='https://www.ncbi.nlm.nih.gov/pmc/articles/11325697'>Pyrimidines maintain mitochondrial pyruvate oxidation to support de novo lipogenesis.</a>,"<a href='https://pubmed.ncbi.nlm.nih.gov/?Db=pubmed&DbFrom=pubmed&Cmd=Link&LinkName=pubmed_pubmed&IdsFromResult=38547260&ordinalpos=1&itool=EntrezSystem2.PEntrez.Pubmed.Pubmed_ResultsPanel.Pubmed_DiscoveryPanel.Pubmed_Discovery_RA&log$=relatedarticles&logdbfrom=pubmed'>Related, PubMed</a>","<a href='https://scholar.google.com/scholar?q=related:https://pmc.ncbi.nlm.nih.gov/articles/PMC11325697/'>Related, Google Scholar</a>","<a href='https://pubmed.ncbi.nlm.nih.gov/?linkname=pubmed_pubmed_citedin&from_uid=38547260'>Cited By, PMID</a>","<a href='https://scholar.google.com/scholar?hl=en&lr=&cites=https://pmc.ncbi.nlm.nih.gov/articles/PMC11325697/'>Cited By, Google</a>",7.43,38547260,2024,10959203,science,,,,Science,Unknown,,False,False,False,
R01HL150624,"Department of Medicine, Northwestern University Feinberg School of Medicine, Chicago, IL, USA.",2024,"Xiao, Shiyu; Chen, Hongxia; Bai, Yunpeng; Zhang, Zhong-Yin; Liu, Yan",England,1744-7631,4,<a href='https://pubmed.ncbi.nlm.nih.gov/38653737'>Expert opinion on therapeutic targets</a>,Expert Opin Ther Targets,28,eng,259-271,12050007,38653737,2024 Apr,<a href='https://www.ncbi.nlm.nih.gov/pmc/articles/12050007'>Targeting PRL phosphatases in hematological malignancies.</a>,"<a href='https://pubmed.ncbi.nlm.nih.gov/?Db=pubmed&DbFrom=pubmed&Cmd=Link&LinkName=pubmed_pubmed&IdsFromResult=38653737&ordinalpos=1&itool=EntrezSystem2.PEntrez.Pubmed.Pubmed_ResultsPanel.Pubmed_DiscoveryPanel.Pubmed_Discovery_RA&log$=relatedarticles&logdbfrom=pubmed'>Related, PubMed</a>","<a href='https://scholar.google.com/scholar?q=related:https://pmc.ncbi.nlm.nih.gov/articles/PMC12050007/'>Related, Google Scholar</a>","<a href='https://pubmed.ncbi.nlm.nih.gov/?linkname=pubmed_pubmed_citedin&from_uid=38653737'>Cited By, PMID</a>","<a href='https://scholar.google.com/scholar?hl=en&lr=&cites=https://pmc.ncbi.nlm.nih.gov/articles/PMC12050007/'>Cited By, Google</a>", ,38653737,2024,17447631,expert opin ther targets,,,,Expert Opin Ther Targets,Unknown,,False,False,False,
UG1HD040512,"Columbia University, New York, New York.",2024,"Gyamfi-Bannerman, Cynthia; Clifton, Rebecca G; Tita, Alan T N; Blackwell, Sean C; Longo, Monica; de Voest, Jessica A; O'Shea, T Michael; Bousleiman, Sabine Z; Ortiz, Felecia; Rouse, Dwight J; Metz, Torri D; Saade, George R; Rood, Kara M; Heyborne, Kent D; Thorp Jr, John M; Swamy, Geeta K; Grobman, William A; Gibson, Kelly S; El-Sayed, Yasser Y; Macones, George A; Eunice Kennedy Shriver Maternal-Fetal Medicine Units Network",United States,1538-3598,19,<a href='https://pubmed.ncbi.nlm.nih.gov/38656759'>JAMA</a>,JAMA,331,eng,1629-1637,11044009,38656759,2024 May 21,<a href='https://www.ncbi.nlm.nih.gov/pmc/articles/11044009'>Neurodevelopmental Outcomes After Late Preterm Antenatal Corticosteroids: The ALPS Follow-Up Study.</a>,"<a href='https://pubmed.ncbi.nlm.nih.gov/?Db=pubmed&DbFrom=pubmed&Cmd=Link&LinkName=pubmed_pubmed&IdsFromResult=38656759&ordinalpos=1&itool=EntrezSystem2.PEntrez.Pubmed.Pubmed_ResultsPanel.Pubmed_DiscoveryPanel.Pubmed_Discovery_RA&log$=relatedarticles&logdbfrom=pubmed'>Related, PubMed</a>","<a href='https://scholar.google.com/scholar?q=related:https://pmc.ncbi.nlm.nih.gov/articles/PMC11044009/'>Related, Google Scholar</a>","<a href='https://pubmed.ncbi.nlm.nih.gov/?linkname=pubmed_pubmed_citedin&from_uid=38656759'>Cited By, PMID</a>","<a href='https://scholar.google.com/scholar?hl=en&lr=&cites=https://pmc.ncbi.nlm.nih.gov/articles/PMC11044009/'>Cited By, Google</a>",7.35,38656759,2024,15383598,jama,,,,JAMA,Unknown,,False,False,False,
U01TR003528,"MIT-IBM Watson AI Lab, Cambridge, MA, United States of America; CUNY Graduate School of Public Health and Health Policy, New York City, NY, United States of America.",2024,"Shahn, Zach; Jung, Boris; Talmor, Daniel; Kennedy, Edward H; Lehman, Li-Wei H; Baedorf-Kassis, Elias",United States,1557-8615, ,<a href='https://pubmed.ncbi.nlm.nih.gov/38552450'>Journal of critical care</a>,J Crit Care,82,eng,154803,11139559,38552450,2024 Aug,<a href='https://www.ncbi.nlm.nih.gov/pmc/articles/11139559'>The impact of aggressive and conservative propensity for initiation of neuromuscular blockade in mechanically ventilated patients with hypoxemic respiratory failure.</a>,"<a href='https://pubmed.ncbi.nlm.nih.gov/?Db=pubmed&DbFrom=pubmed&Cmd=Link&LinkName=pubmed_pubmed&IdsFromResult=38552450&ordinalpos=1&itool=EntrezSystem2.PEntrez.Pubmed.Pubmed_ResultsPanel.Pubmed_DiscoveryPanel.Pubmed_Discovery_RA&log$=relatedarticles&logdbfrom=pubmed'>Related, PubMed</a>","<a href='https://scholar.google.com/scholar?q=related:https://pmc.ncbi.nlm.nih.gov/articles/PMC11139559/'>Related, Google Scholar</a>","<a href='https://pubmed.ncbi.nlm.nih.gov/?linkname=pubmed_pubmed_citedin&from_uid=38552450'>Cited By, PMID</a>","<a href='https://scholar.google.com/scholar?hl=en&lr=&cites=https://pmc.ncbi.nlm.nih.gov/articles/PMC11139559/'>Cited By, Google</a>", ,38552450,2024,15578615,j crit care,,,,J Crit Care,Unknown,,False,False,False,
R00DA055111,"Salk Institute for Biological Studies, La Jolla, CA, USA.",2024,"Patel, Reesha R; Patarino, Makenzie; Kim, Kelly; Pamintuan, Rachelle; Taschbach, Felix H; Li, Hao; Lee, Christopher R; van Hoek, Aniek; Castro, Rogelio; Cazares, Christian; Miranda, Raymundo L; Jia, Caroline; Delahanty, Jeremy; Batra, Kanha; Keyes, Laurel R; Libster, Avraham; Wichmann, Romy; Pereira, Talmo D; Benna, Marcus K; Tye, Kay M",United States,2693-5015, ,<a href='https://pubmed.ncbi.nlm.nih.gov/38562728'>Research square</a>,Res Sq, ,eng, ,10984017,38562728,2024 Mar 21,<a href='https://www.ncbi.nlm.nih.gov/pmc/articles/10984017'>Social isolation recruits amygdala-cortical circuitry to escalate alcohol drinking.</a>,"<a href='https://pubmed.ncbi.nlm.nih.gov/?Db=pubmed&DbFrom=pubmed&Cmd=Link&LinkName=pubmed_pubmed&IdsFromResult=38562728&ordinalpos=1&itool=EntrezSystem2.PEntrez.Pubmed.Pubmed_ResultsPanel.Pubmed_DiscoveryPanel.Pubmed_Discovery_RA&log$=relatedarticles&logdbfrom=pubmed'>Related, PubMed</a>","<a href='https://scholar.google.com/scholar?q=related:https://pmc.ncbi.nlm.nih.gov/articles/PMC10984017/'>Related, Google Scholar</a>","<a href='https://pubmed.ncbi.nlm.nih.gov/?linkname=pubmed_pubmed_citedin&from_uid=38562728'>Cited By, PMID</a>","<a href='https://scholar.google.com/scholar?hl=en&lr=&cites=https://pmc.ncbi.nlm.nih.gov/articles/PMC10984017/'>Cited By, Google</a>", ,38562728,2024,26935015,res sq,,,,Res Sq,Unknown,,False,False,False,
U2CAG057441,"Center for Health Assessment Research and Translation, University of Delaware, Newark, DE, USA.",2024,"Tyner, Callie E; Boulton, Aaron J; Slotkin, Jerry; Cohen, Matthew L; Weintraub, Sandra; Gershon, Richard C; Tulsky, David S",England,1469-7661,6,<a href='https://pubmed.ncbi.nlm.nih.gov/38361424'>Journal of the International Neuropsychological Society : JINS</a>,J Int Neuropsychol Soc,30,eng,603-614,11327385,38361424,2024 Jul,<a href='https://www.ncbi.nlm.nih.gov/pmc/articles/11327385'>Exploring symptom clusters in mild cognitive impairment and dementia with the NIH Toolbox.</a>,"<a href='https://pubmed.ncbi.nlm.nih.gov/?Db=pubmed&DbFrom=pubmed&Cmd=Link&LinkName=pubmed_pubmed&IdsFromResult=38361424&ordinalpos=1&itool=EntrezSystem2.PEntrez.Pubmed.Pubmed_ResultsPanel.Pubmed_DiscoveryPanel.Pubmed_Discovery_RA&log$=relatedarticles&logdbfrom=pubmed'>Related, PubMed</a>","<a href='https://scholar.google.com/scholar?q=related:https://pmc.ncbi.nlm.nih.gov/articles/PMC11327385/'>Related, Google Scholar</a>","<a href='https://pubmed.ncbi.nlm.nih.gov/?linkname=pubmed_pubmed_citedin&from_uid=38361424'>Cited By, PMID</a>","<a href='https://scholar.google.com/scholar?hl=en&lr=&cites=https://pmc.ncbi.nlm.nih.gov/articles/PMC11327385/'>Cited By, Google</a>", ,38361424,2024,14697661,j int neuropsychol soc,,,,J Int Neuropsychol Soc,Unknown,,False,False,False,
U54HL160273,"Division of Cardiology, Department of Medicine, and Bluhm Cardiovascular Institute, Northwestern University Feinberg School of Medicine, Chicago, IL, USA. Electronic address: hide.yaku@northwestern.edu.",2024,"Yaku, Hidenori; Fudim, Marat; Shah, Sanjiv J",Netherlands,1876-4738,5,<a href='https://pubmed.ncbi.nlm.nih.gov/38369183'>Journal of cardiology</a>,J Cardiol,83,eng,330-337, ,38369183,2024 May,Role of splanchnic circulation in the pathogenesis of heart failure: State-of-the-art review.,"<a href='https://pubmed.ncbi.nlm.nih.gov/?Db=pubmed&DbFrom=pubmed&Cmd=Link&LinkName=pubmed_pubmed&IdsFromResult=38369183&ordinalpos=1&itool=EntrezSystem2.PEntrez.Pubmed.Pubmed_ResultsPanel.Pubmed_DiscoveryPanel.Pubmed_Discovery_RA&log$=relatedarticles&logdbfrom=pubmed'>Related, PubMed</a>","<a href='https://scholar.google.com/scholar?hl=en&q=Role of splanchnic circulation in the pathogenesis of heart failure: State-of-the-art review.'>Related, Google Scholar</a>","<a href='https://pubmed.ncbi.nlm.nih.gov/?linkname=pubmed_pubmed_citedin&from_uid=38369183'>Cited By, PMID</a>", , ,38369183,2024,18764738,j cardiol,,,,J Cardiol,Unknown,,False,False,False,
OT2OD026557,"Center for Genetic Epidemiology, Keck School of Medicine, University of Southern California, Los Angeles, CA, USA.",2024,"Lu, Zeyun; Wang, Xinran; Carr, Matthew; Kim, Artem; Gazal, Steven; Mohammadi, Pejman; Wu, Lang; Gusev, Alexander; Pirruccello, James; Kachuri, Linda; Mancuso, Nicholas",United States, , ,<a href='https://pubmed.ncbi.nlm.nih.gov/38699369'>medRxiv : the preprint server for health sciences</a>,medRxiv, ,eng, ,11065034,38699369,2024 Apr 16,<a href='https://www.ncbi.nlm.nih.gov/pmc/articles/11065034'>Improved multi-ancestry fine-mapping identifies cis-regulatory variants underlying molecular traits and disease risk.</a>,"<a href='https://pubmed.ncbi.nlm.nih.gov/?Db=pubmed&DbFrom=pubmed&Cmd=Link&LinkName=pubmed_pubmed&IdsFromResult=38699369&ordinalpos=1&itool=EntrezSystem2.PEntrez.Pubmed.Pubmed_ResultsPanel.Pubmed_DiscoveryPanel.Pubmed_Discovery_RA&log$=relatedarticles&logdbfrom=pubmed'>Related, PubMed</a>","<a href='https://scholar.google.com/scholar?q=related:https://pmc.ncbi.nlm.nih.gov/articles/PMC11065034/'>Related, Google Scholar</a>","<a href='https://pubmed.ncbi.nlm.nih.gov/?linkname=pubmed_pubmed_citedin&from_uid=38699369'>Cited By, PMID</a>","<a href='https://scholar.google.com/scholar?hl=en&lr=&cites=https://pmc.ncbi.nlm.nih.gov/articles/PMC11065034/'>Cited By, Google</a>", ,38699369,2024,,medrxiv,,,,medRxiv,Unknown,,False,False,False,
P30AG072977,"Department of Neurosurgery, Stanford University, Stanford, CA, USA.",2024,"Barisano, Giuseppe; Iv, Michael; Alzheimer’s Disease Neuroimaging Initiative; Choupan, Jeiran; Hayden-Gephart, Melanie",United States, , ,<a href='https://pubmed.ncbi.nlm.nih.gov/38712073'>medRxiv : the preprint server for health sciences</a>,medRxiv, ,eng, ,11071547,38712073,2024 Apr 26,<a href='https://www.ncbi.nlm.nih.gov/pmc/articles/11071547'>Cerebral perivascular spaces as predictors of dementia risk and accelerated brain atrophy.</a>,"<a href='https://pubmed.ncbi.nlm.nih.gov/?Db=pubmed&DbFrom=pubmed&Cmd=Link&LinkName=pubmed_pubmed&IdsFromResult=38712073&ordinalpos=1&itool=EntrezSystem2.PEntrez.Pubmed.Pubmed_ResultsPanel.Pubmed_DiscoveryPanel.Pubmed_Discovery_RA&log$=relatedarticles&logdbfrom=pubmed'>Related, PubMed</a>","<a href='https://scholar.google.com/scholar?q=related:https://pmc.ncbi.nlm.nih.gov/articles/PMC11071547/'>Related, Google Scholar</a>","<a href='https://pubmed.ncbi.nlm.nih.gov/?linkname=pubmed_pubmed_citedin&from_uid=38712073'>Cited By, PMID</a>","<a href='https://scholar.google.com/scholar?hl=en&lr=&cites=https://pmc.ncbi.nlm.nih.gov/articles/PMC11071547/'>Cited By, Google</a>", ,38712073,2024,,medrxiv,,,,medRxiv,Unknown,,False,False,False,
T32GM008382,"Interdisciplinary Biological Sciences Graduate Program, Northwestern University, Evanston, Illinois 60208, USA.",2024,"Bushhouse, David Z; Fu, Jiayu; Lucks, Julius B",United States,2692-8205, ,<a href='https://pubmed.ncbi.nlm.nih.gov/38585885'>bioRxiv : the preprint server for biology</a>,bioRxiv, ,eng, ,10996619,38585885,2024 Mar 29,<a href='https://www.ncbi.nlm.nih.gov/pmc/articles/10996619'>RNA folding kinetics control riboswitch sensitivity in vivo.</a>,"<a href='https://pubmed.ncbi.nlm.nih.gov/?Db=pubmed&DbFrom=pubmed&Cmd=Link&LinkName=pubmed_pubmed&IdsFromResult=38585885&ordinalpos=1&itool=EntrezSystem2.PEntrez.Pubmed.Pubmed_ResultsPanel.Pubmed_DiscoveryPanel.Pubmed_Discovery_RA&log$=relatedarticles&logdbfrom=pubmed'>Related, PubMed</a>","<a href='https://scholar.google.com/scholar?q=related:https://pmc.ncbi.nlm.nih.gov/articles/PMC10996619/'>Related, Google Scholar</a>","<a href='https://pubmed.ncbi.nlm.nih.gov/?linkname=pubmed_pubmed_citedin&from_uid=38585885'>Cited By, PMID</a>","<a href='https://scholar.google.com/scholar?hl=en&lr=&cites=https://pmc.ncbi.nlm.nih.gov/articles/PMC10996619/'>Cited By, Google</a>", ,38585885,2024,26928205,biorxiv,,,,bioRxiv,Unknown,,False,False,False,
U01HL146240,"Basic Science Program, Frederick National Laboratory for Cancer Research, National Cancer Institute, Frederick, MD, USA and Laboratory of Integrative Cancer Immunology, Center for Cancer Research, National Cancer Institute Bethesda, MD, USA.",2024,"Viard, Mathias; O'hUigin, Colm; Yuki, Yuko; Bashirova, Arman A; Collins, David R; Urbach, Jonathan M; Wolinsky, Steven; Buchbinder, Susan; Kirk, Gregory D; Goedert, James J; Michael, Nelson L; Haas, David W; Deeks, Steven G; Walker, Bruce D; Yu, Xu; Carrington, Mary",United States,1095-9203,6680,"<a href='https://pubmed.ncbi.nlm.nih.gov/38236978'>Science (New York, N.Y.)</a>",Science,383,eng,319-325,11395297,38236978,2024 Jan 19,<a href='https://www.ncbi.nlm.nih.gov/pmc/articles/11395297'>Impact of HLA class I functional divergence on HIV control.</a>,"<a href='https://pubmed.ncbi.nlm.nih.gov/?Db=pubmed&DbFrom=pubmed&Cmd=Link&LinkName=pubmed_pubmed&IdsFromResult=38236978&ordinalpos=1&itool=EntrezSystem2.PEntrez.Pubmed.Pubmed_ResultsPanel.Pubmed_DiscoveryPanel.Pubmed_Discovery_RA&log$=relatedarticles&logdbfrom=pubmed'>Related, PubMed</a>","<a href='https://scholar.google.com/scholar?q=related:https://pmc.ncbi.nlm.nih.gov/articles/PMC11395297/'>Related, Google Scholar</a>","<a href='https://pubmed.ncbi.nlm.nih.gov/?linkname=pubmed_pubmed_citedin&from_uid=38236978'>Cited By, PMID</a>","<a href='https://scholar.google.com/scholar?hl=en&lr=&cites=https://pmc.ncbi.nlm.nih.gov/articles/PMC11395297/'>Cited By, Google</a>",2.32,38236978,2024,10959203,science,,,,Science,Unknown,,False,False,False,
R01HL147575,"Division of Thoracic Surgery, Northwestern University Feinberg School of Medicine, 676 N. Saint Clair Street, Suite 650, Chicago, IL, 60611, USA. chitaru.kurihara@northwestern.edu.",2024,"Kurihara, Chitaru; Kaiho, Taisuke; Bharat, Ankit",Germany,2198-7793,1,<a href='https://pubmed.ncbi.nlm.nih.gov/38240878'>Surgical case reports</a>,Surg Case Rep,10,eng,24,10798934,38240878,2024 Jan 19,<a href='https://www.ncbi.nlm.nih.gov/pmc/articles/10798934'>Unveiling the complexities of lung transplantation in situs inversus.</a>,"<a href='https://pubmed.ncbi.nlm.nih.gov/?Db=pubmed&DbFrom=pubmed&Cmd=Link&LinkName=pubmed_pubmed&IdsFromResult=38240878&ordinalpos=1&itool=EntrezSystem2.PEntrez.Pubmed.Pubmed_ResultsPanel.Pubmed_DiscoveryPanel.Pubmed_Discovery_RA&log$=relatedarticles&logdbfrom=pubmed'>Related, PubMed</a>","<a href='https://scholar.google.com/scholar?q=related:https://pmc.ncbi.nlm.nih.gov/articles/PMC10798934/'>Related, Google Scholar</a>","<a href='https://pubmed.ncbi.nlm.nih.gov/?linkname=pubmed_pubmed_citedin&from_uid=38240878'>Cited By, PMID</a>","<a href='https://scholar.google.com/scholar?hl=en&lr=&cites=https://pmc.ncbi.nlm.nih.gov/articles/PMC10798934/'>Cited By, Google</a>", ,38240878,2024,21987793,surg case rep,,,,Surg Case Rep,Unknown,,False,False,False,
P50DA044121,"Center for Translational Pain Research, Northwestern University Feinberg School of Medicine. Chicago, IL. 60610, USA.",2024,"Vigotsky, Andrew D; Cong, Olivia; Pinto, Camila B; Barroso, Joana; Perez, Jennifer; Petersen, Kristian Kjaer; Arendt-Nielsen, Lars; Hardt, Kevin; Manning, David; Apkarian, A Vania; Branco, Paulo",United States, , ,<a href='https://pubmed.ncbi.nlm.nih.gov/38293074'>medRxiv : the preprint server for health sciences</a>,medRxiv, ,eng, ,10827245,38293074,2024 Jan 17,<a href='https://www.ncbi.nlm.nih.gov/pmc/articles/10827245'>Mechanical hyperalgesia and neuropathic pain qualities impart risk for chronic postoperative pain after total knee replacement.</a>,"<a href='https://pubmed.ncbi.nlm.nih.gov/?Db=pubmed&DbFrom=pubmed&Cmd=Link&LinkName=pubmed_pubmed&IdsFromResult=38293074&ordinalpos=1&itool=EntrezSystem2.PEntrez.Pubmed.Pubmed_ResultsPanel.Pubmed_DiscoveryPanel.Pubmed_Discovery_RA&log$=relatedarticles&logdbfrom=pubmed'>Related, PubMed</a>","<a href='https://scholar.google.com/scholar?q=related:https://pmc.ncbi.nlm.nih.gov/articles/PMC10827245/'>Related, Google Scholar</a>","<a href='https://pubmed.ncbi.nlm.nih.gov/?linkname=pubmed_pubmed_citedin&from_uid=38293074'>Cited By, PMID</a>","<a href='https://scholar.google.com/scholar?hl=en&lr=&cites=https://pmc.ncbi.nlm.nih.gov/articles/PMC10827245/'>Cited By, Google</a>", ,38293074,2024,,medrxiv,,,,medRxiv,Unknown,,False,False,False,
F32HL164050,"Department of Psychology & Neuroscience, Baylor University, Waco, TX 76798, USA.",2024,"O'Riordan, Adam; Chen, Michelle A; Maza, Valentina; Vela, Nyla; Wu-Chung, Lydia; Henderson, Alexandria; Carney, Olivia L; LeRoy, Angie S",United States,2152-5250,1,<a href='https://pubmed.ncbi.nlm.nih.gov/38300637'>Aging and disease</a>,Aging Dis,16,eng,49-66,11745431,38300637,2024 Jan 19,<a href='https://www.ncbi.nlm.nih.gov/pmc/articles/11745431'>A Systematic Review of Intervention Trials Utilizing Biomarkers Among Informal Caregivers of People with Alzheimer's Disease & Related Dementias.</a>,"<a href='https://pubmed.ncbi.nlm.nih.gov/?Db=pubmed&DbFrom=pubmed&Cmd=Link&LinkName=pubmed_pubmed&IdsFromResult=38300637&ordinalpos=1&itool=EntrezSystem2.PEntrez.Pubmed.Pubmed_ResultsPanel.Pubmed_DiscoveryPanel.Pubmed_Discovery_RA&log$=relatedarticles&logdbfrom=pubmed'>Related, PubMed</a>","<a href='https://scholar.google.com/scholar?q=related:https://pmc.ncbi.nlm.nih.gov/articles/PMC11745431/'>Related, Google Scholar</a>","<a href='https://pubmed.ncbi.nlm.nih.gov/?linkname=pubmed_pubmed_citedin&from_uid=38300637'>Cited By, PMID</a>","<a href='https://scholar.google.com/scholar?hl=en&lr=&cites=https://pmc.ncbi.nlm.nih.gov/articles/PMC11745431/'>Cited By, Google</a>", ,38300637,2024,21525250,aging dis,,,,Aging Dis,Unknown,,False,False,False,
K23HL146890,"Department of Medicine, Division of Allergy, Pulmonary, and Critical Care, University of Wisconsin School of Medicine and Public Health, Madison, Wisconsin, United States of America.",2024,"Kruser, Jacqueline M; Viglianti, Elizabeth M; Mylvaganam, Ruben; Krolikowski, Kristyn A; Khorzad, Rebeca; Detsky, Michael E; Wiegmann, Douglas A; Wunderink, Richard G; Holl, Jane L",United States,2472-5587,1,<a href='https://pubmed.ncbi.nlm.nih.gov/38646086'>IISE transactions on healthcare systems engineering</a>,IISE Trans Healthc Syst Eng,14,eng,32-41,11025699,38646086,2024,<a href='https://www.ncbi.nlm.nih.gov/pmc/articles/11025699'>Mapping the process of ICU care delivery to improve treatment decisions in acute respiratory failure.</a>,"<a href='https://pubmed.ncbi.nlm.nih.gov/?Db=pubmed&DbFrom=pubmed&Cmd=Link&LinkName=pubmed_pubmed&IdsFromResult=38646086&ordinalpos=1&itool=EntrezSystem2.PEntrez.Pubmed.Pubmed_ResultsPanel.Pubmed_DiscoveryPanel.Pubmed_Discovery_RA&log$=relatedarticles&logdbfrom=pubmed'>Related, PubMed</a>","<a href='https://scholar.google.com/scholar?q=related:https://pmc.ncbi.nlm.nih.gov/articles/PMC11025699/'>Related, Google Scholar</a>","<a href='https://pubmed.ncbi.nlm.nih.gov/?linkname=pubmed_pubmed_citedin&from_uid=38646086'>Cited By, PMID</a>","<a href='https://scholar.google.com/scholar?hl=en&lr=&cites=https://pmc.ncbi.nlm.nih.gov/articles/PMC11025699/'>Cited By, Google</a>",2.82,38646086,2024,24725587,iise trans healthc syst eng,,,,IISE Trans Healthc Syst Eng,Unknown,,False,False,False,
R01DK128477,"Department of Medicine, Division of Endocrinology, Metabolism and Molecular Medicine, Northwestern University, Chicago, IL 60611, USA.",2024,"McMorrow, Hayley E; Lorch, Carolyn M; Hayes, Nikolas W; Fleps, Stefan W; Frydman, Joshua A; Xia, Jessica L; Samms, Ricardo J; Beutler, Lisa R",United States,2692-8205, ,<a href='https://pubmed.ncbi.nlm.nih.gov/38562891'>bioRxiv : the preprint server for biology</a>,bioRxiv, ,eng, ,10983981,38562891,2024 Mar 20,<a href='https://www.ncbi.nlm.nih.gov/pmc/articles/10983981'>Incretin hormones and pharmacomimetics rapidly inhibit AgRP neuron activity to suppress appetite.</a>,"<a href='https://pubmed.ncbi.nlm.nih.gov/?Db=pubmed&DbFrom=pubmed&Cmd=Link&LinkName=pubmed_pubmed&IdsFromResult=38562891&ordinalpos=1&itool=EntrezSystem2.PEntrez.Pubmed.Pubmed_ResultsPanel.Pubmed_DiscoveryPanel.Pubmed_Discovery_RA&log$=relatedarticles&logdbfrom=pubmed'>Related, PubMed</a>","<a href='https://scholar.google.com/scholar?q=related:https://pmc.ncbi.nlm.nih.gov/articles/PMC10983981/'>Related, Google Scholar</a>","<a href='https://pubmed.ncbi.nlm.nih.gov/?linkname=pubmed_pubmed_citedin&from_uid=38562891'>Cited By, PMID</a>","<a href='https://scholar.google.com/scholar?hl=en&lr=&cites=https://pmc.ncbi.nlm.nih.gov/articles/PMC10983981/'>Cited By, Google</a>", ,38562891,2024,26928205,biorxiv,,,,bioRxiv,Unknown,,False,False,False,
R01AI153088,"Molecular Biosciences, Northwestern University, Evanston, Illinois, United States of America.",2024,"Shaver, Amanda O; Miller, Isabella R; Schaye, Etta S; Moya, Nicolas D; Collins, J B; Wit, Janneke; Blanco, Alyssa H; Shao, Fiona M; Andersen, Elliot J; Khan, Sharik A; Paredes, Gracie; Andersen, Erik C",United States,2692-8205, ,<a href='https://pubmed.ncbi.nlm.nih.gov/38370666'>bioRxiv : the preprint server for biology</a>,bioRxiv, ,eng, ,10871296,38370666,2024 Feb 06,<a href='https://www.ncbi.nlm.nih.gov/pmc/articles/10871296'>Quantifying the fitness effects of resistance alleles with and without anthelmintic selection pressure using Caenorhabditis elegans.</a>,"<a href='https://pubmed.ncbi.nlm.nih.gov/?Db=pubmed&DbFrom=pubmed&Cmd=Link&LinkName=pubmed_pubmed&IdsFromResult=38370666&ordinalpos=1&itool=EntrezSystem2.PEntrez.Pubmed.Pubmed_ResultsPanel.Pubmed_DiscoveryPanel.Pubmed_Discovery_RA&log$=relatedarticles&logdbfrom=pubmed'>Related, PubMed</a>","<a href='https://scholar.google.com/scholar?q=related:https://pmc.ncbi.nlm.nih.gov/articles/PMC10871296/'>Related, Google Scholar</a>","<a href='https://pubmed.ncbi.nlm.nih.gov/?linkname=pubmed_pubmed_citedin&from_uid=38370666'>Cited By, PMID</a>","<a href='https://scholar.google.com/scholar?hl=en&lr=&cites=https://pmc.ncbi.nlm.nih.gov/articles/PMC10871296/'>Cited By, Google</a>", ,38370666,2024,26928205,biorxiv,,,,bioRxiv,Unknown,,False,False,False,
