R01HL147575,"Department of Radiology, Molecular Imaging Program at Stanford (MIPS), Stanford University, School of Medicine, Stanford, CA, USA.",2024,"Suryadevara, Vidyani; Hudgins, Adam D; Rajesh, Adarsh; Pappalardo, Alberto; Karpova, Alla; Dey, Amit K; Hertzel, Ann; Agudelo, Anthony; Rocha, Azucena; Soygur, Bikem; Schilling, Birgit; Carver, Chase M; Aguayo-Mazzucato, Cristina; Baker, Darren J; Bernlohr, David A; Jurk, Diana; Mangarova, Dilyana B; Quardokus, Ellen M; Enninga, Elizabeth Ann L; Schmidt, Elizabeth L; Chen, Feng; Duncan, Francesca E; Cambuli, Francesco; Kaur, Gagandeep; Kuchel, George A; Lee, Gung; Daldrup-Link, Heike E; Martini, Helene; Phatnani, Hemali; Al-Naggar, Iman M; Rahman, Irfan; Nie, Jia; Passos, João F; Silverstein, Jonathan C; Campisi, Judith; Wang, Julia; Iwasaki, Kanako; Barbosa, Karina; Metis, Kay; Nernekli, Kerem; Niedernhofer, Laura J; Ding, Li; Wang, Lichao; Adams, Lisa C; Ruiyang, Liu; Doolittle, Madison L; Teneche, Marcos G; Schafer, Marissa J; Xu, Ming; Hajipour, Mohammadjavad; Boroumand, Mozhgan; Basisty, Nathan; Sloan, Nicholas; Slavov, Nikolai; Kuksenko, Olena; Robson, Paul; Gomez, Paul T; Vasilikos, Periklis; Adams, Peter D; Carapeto, Priscila; Zhu, Quan; Ramasamy, Ramalakshmi; Perez-Lorenzo, Rolando; Fan, Rong; Dong, Runze; Montgomery, Ruth R; Shaikh, Sadiya; Vickovic, Sanja; Yin, Shanshan; Kang, Shoukai; Suvakov, Sonja; Khosla, Sundeep; Garovic, Vesna D; Menon, Vilas; Xu, Yanxin; Song, Yizhe; Suh, Yousin; Dou, Zhixun; Neretti, Nicola",England,1471-0080,12,<a href='https://pubmed.ncbi.nlm.nih.gov/38831121'>Nature reviews. Molecular cell biology</a>,Nat Rev Mol Cell Biol,25,eng,1001-1023,11578798,38831121,2024 Dec,SenNet recommendations for detecting senescent cells in different tissues.,"<a href='https://pubmed.ncbi.nlm.nih.gov/?Db=pubmed&DbFrom=pubmed&Cmd=Link&LinkName=pubmed_pubmed&IdsFromResult=38831121&ordinalpos=1&itool=EntrezSystem2.PEntrez.Pubmed.Pubmed_ResultsPanel.Pubmed_DiscoveryPanel.Pubmed_Discovery_RA&log$=relatedarticles&logdbfrom=pubmed'>Related, PubMed</a>","<a href='https://scholar.google.com/scholar?q=related:https://pmc.ncbi.nlm.nih.gov/articles/PMC11578798/'>Related, Google Scholar</a>","<a href='https://pubmed.ncbi.nlm.nih.gov/?linkname=pubmed_pubmed_citedin&from_uid=38831121'>Cited By, PMID</a>","<a href='https://scholar.google.com/scholar?hl=en&lr=&cites=https://pmc.ncbi.nlm.nih.gov/articles/PMC11578798/'>Cited By, Google</a>",27.03,PMID(38831121) OR  ,2024,14710080,,,
R01HL147290,"Department of Radiology, Molecular Imaging Program at Stanford (MIPS), Stanford University, School of Medicine, Stanford, CA, USA.",2024,"Suryadevara, Vidyani; Hudgins, Adam D; Rajesh, Adarsh; Pappalardo, Alberto; Karpova, Alla; Dey, Amit K; Hertzel, Ann; Agudelo, Anthony; Rocha, Azucena; Soygur, Bikem; Schilling, Birgit; Carver, Chase M; Aguayo-Mazzucato, Cristina; Baker, Darren J; Bernlohr, David A; Jurk, Diana; Mangarova, Dilyana B; Quardokus, Ellen M; Enninga, Elizabeth Ann L; Schmidt, Elizabeth L; Chen, Feng; Duncan, Francesca E; Cambuli, Francesco; Kaur, Gagandeep; Kuchel, George A; Lee, Gung; Daldrup-Link, Heike E; Martini, Helene; Phatnani, Hemali; Al-Naggar, Iman M; Rahman, Irfan; Nie, Jia; Passos, João F; Silverstein, Jonathan C; Campisi, Judith; Wang, Julia; Iwasaki, Kanako; Barbosa, Karina; Metis, Kay; Nernekli, Kerem; Niedernhofer, Laura J; Ding, Li; Wang, Lichao; Adams, Lisa C; Ruiyang, Liu; Doolittle, Madison L; Teneche, Marcos G; Schafer, Marissa J; Xu, Ming; Hajipour, Mohammadjavad; Boroumand, Mozhgan; Basisty, Nathan; Sloan, Nicholas; Slavov, Nikolai; Kuksenko, Olena; Robson, Paul; Gomez, Paul T; Vasilikos, Periklis; Adams, Peter D; Carapeto, Priscila; Zhu, Quan; Ramasamy, Ramalakshmi; Perez-Lorenzo, Rolando; Fan, Rong; Dong, Runze; Montgomery, Ruth R; Shaikh, Sadiya; Vickovic, Sanja; Yin, Shanshan; Kang, Shoukai; Suvakov, Sonja; Khosla, Sundeep; Garovic, Vesna D; Menon, Vilas; Xu, Yanxin; Song, Yizhe; Suh, Yousin; Dou, Zhixun; Neretti, Nicola",England,1471-0080,12,<a href='https://pubmed.ncbi.nlm.nih.gov/38831121'>Nature reviews. Molecular cell biology</a>,Nat Rev Mol Cell Biol,25,eng,1001-1023,11578798,38831121,2024 Dec,SenNet recommendations for detecting senescent cells in different tissues.,"<a href='https://pubmed.ncbi.nlm.nih.gov/?Db=pubmed&DbFrom=pubmed&Cmd=Link&LinkName=pubmed_pubmed&IdsFromResult=38831121&ordinalpos=1&itool=EntrezSystem2.PEntrez.Pubmed.Pubmed_ResultsPanel.Pubmed_DiscoveryPanel.Pubmed_Discovery_RA&log$=relatedarticles&logdbfrom=pubmed'>Related, PubMed</a>","<a href='https://scholar.google.com/scholar?q=related:https://pmc.ncbi.nlm.nih.gov/articles/PMC11578798/'>Related, Google Scholar</a>","<a href='https://pubmed.ncbi.nlm.nih.gov/?linkname=pubmed_pubmed_citedin&from_uid=38831121'>Cited By, PMID</a>","<a href='https://scholar.google.com/scholar?hl=en&lr=&cites=https://pmc.ncbi.nlm.nih.gov/articles/PMC11578798/'>Cited By, Google</a>",27.03,PMID(38831121) OR  ,2024,14710080,,,
R01AR074274,"Center for Translational Pain Research, Northwestern University Feinberg School of Medicine, Chicago, Illinois, USA.",2024,"Vigotsky, Andrew D; Cong, Olivia; Pinto, Camila B; Barroso, Joana; Perez, Jennifer; Petersen, Kristian Kjaer; Arendt-Nielsen, Lars; Hardt, Kevin D; Manning, David; Apkarian, A Vania; Branco, Paulo",England,1532-2149,8,"<a href='https://pubmed.ncbi.nlm.nih.gov/38850090'>European journal of pain (London, England)</a>",Eur J Pain,28,eng,1387-1401, ,38850090,2024 Sep,Prognostic value of preoperative mechanical hyperalgesia and neuropathic pain qualities for postoperative pain after total knee replacement.,"<a href='https://pubmed.ncbi.nlm.nih.gov/?Db=pubmed&DbFrom=pubmed&Cmd=Link&LinkName=pubmed_pubmed&IdsFromResult=38850090&ordinalpos=1&itool=EntrezSystem2.PEntrez.Pubmed.Pubmed_ResultsPanel.Pubmed_DiscoveryPanel.Pubmed_Discovery_RA&log$=relatedarticles&logdbfrom=pubmed'>Related, PubMed</a>","<a href='https://scholar.google.com/scholar?hl=en&q=Prognostic value of preoperative mechanical hyperalgesia and neuropathic pain qualities for postoperative pain after total knee replacement.'>Related, Google Scholar</a>","<a href='https://pubmed.ncbi.nlm.nih.gov/?linkname=pubmed_pubmed_citedin&from_uid=38850090'>Cited By, PMID</a>", , ,PMID(38850090) OR  ,2024,15322149,,,
P01AG054407,"Department of Biology, Stanford University, Stanford, California, USA.",2024,"Chou, Ching-Chieh; Vest, Ryan; Prado, Miguel A; Wilson-Grady, Joshua; Paulo, Joao A; Shibuya, Yohei; Moran-Losada, Patricia; Lee, Ting-Ting; Luo, Jian; Gygi, Steven P; Kelly, Jeffery W; Finley, Daniel; Wernig, Marius; Wyss-Coray, Tony; Frydman, Judith",United States,2693-5015, ,<a href='https://pubmed.ncbi.nlm.nih.gov/38853828'>Research square</a>,Res Sq, ,eng, ,11160905,38853828,2024 May 30,<a href='https://www.ncbi.nlm.nih.gov/pmc/articles/11160905'>Human tNeurons reveal aging-linked proteostasis deficits driving Alzheimer's phenotypes.</a>,"<a href='https://pubmed.ncbi.nlm.nih.gov/?Db=pubmed&DbFrom=pubmed&Cmd=Link&LinkName=pubmed_pubmed&IdsFromResult=38853828&ordinalpos=1&itool=EntrezSystem2.PEntrez.Pubmed.Pubmed_ResultsPanel.Pubmed_DiscoveryPanel.Pubmed_Discovery_RA&log$=relatedarticles&logdbfrom=pubmed'>Related, PubMed</a>","<a href='https://scholar.google.com/scholar?q=related:https://pmc.ncbi.nlm.nih.gov/articles/PMC11160905/'>Related, Google Scholar</a>","<a href='https://pubmed.ncbi.nlm.nih.gov/?linkname=pubmed_pubmed_citedin&from_uid=38853828'>Cited By, PMID</a>","<a href='https://scholar.google.com/scholar?hl=en&lr=&cites=https://pmc.ncbi.nlm.nih.gov/articles/PMC11160905/'>Cited By, Google</a>", ,PMID(38853828) OR  ,2024,26935015,,,
F32HL162418,"Division of Pulmonary and Critical Care Medicine, Northwestern University Feinberg School of Medicine, Chicago, IL 60611 USA.",2024,"Mambetsariev, Nurbek; Torres Acosta, Manuel A; Liu, Qianli; Flores, Carla P Reyes; Joudi, Anthony M; Helmin, Kathryn A; Gurkan, Jonathan K; Steinert, Elizabeth M; Morales-Nebreda, Luisa; Singer, Benjamin D",United States,2692-8205, ,<a href='https://pubmed.ncbi.nlm.nih.gov/38853959'>bioRxiv : the preprint server for biology</a>,bioRxiv, ,eng, ,11160713,38853959,2024 Jun 02,<a href='https://www.ncbi.nlm.nih.gov/pmc/articles/11160713'>FOXP3+ Regulatory T Cells Require TBET to Regulate Activated CD8+ T Cells During Recovery from Influenza Infection.</a>,"<a href='https://pubmed.ncbi.nlm.nih.gov/?Db=pubmed&DbFrom=pubmed&Cmd=Link&LinkName=pubmed_pubmed&IdsFromResult=38853959&ordinalpos=1&itool=EntrezSystem2.PEntrez.Pubmed.Pubmed_ResultsPanel.Pubmed_DiscoveryPanel.Pubmed_Discovery_RA&log$=relatedarticles&logdbfrom=pubmed'>Related, PubMed</a>","<a href='https://scholar.google.com/scholar?q=related:https://pmc.ncbi.nlm.nih.gov/articles/PMC11160713/'>Related, Google Scholar</a>","<a href='https://pubmed.ncbi.nlm.nih.gov/?linkname=pubmed_pubmed_citedin&from_uid=38853959'>Cited By, PMID</a>","<a href='https://scholar.google.com/scholar?hl=en&lr=&cites=https://pmc.ncbi.nlm.nih.gov/articles/PMC11160713/'>Cited By, Google</a>", ,PMID(38853959) OR  ,2024,26928205,,,
P30DA027828,Massachusetts General Hospital.,2024,"Scanlon, Faith; Remch, Molly; Scheidell, Joy D; Brewer, Russell; Dyer, Typhanye V; Albis-Burdige, Blaise; Irvine, Natalia; Turpin, Rodman; Parker, Sharon; Cleland, Charles M; Hucks-Ortiz, Christopher; Gaydos, Charlotte A; Mayer, Kenneth H; Khan, Maria R",United States,1524-9220,1,<a href='https://pubmed.ncbi.nlm.nih.gov/38854997'>Psychology of men & masculinity</a>,Psychol Men Masc,25,eng,44-56,11156418,38854997,2024 Jan,"<a href='https://www.ncbi.nlm.nih.gov/pmc/articles/11156418'>Posttraumatic Stress Disorder Symptoms and Incarceration: The Impact on Sexual Risk-Taking, Sexually Transmitted Infections, and Depression Among Black Sexual Minority Men in HIV Prevention Trials Network (HPTN) 061.</a>","<a href='https://pubmed.ncbi.nlm.nih.gov/?Db=pubmed&DbFrom=pubmed&Cmd=Link&LinkName=pubmed_pubmed&IdsFromResult=38854997&ordinalpos=1&itool=EntrezSystem2.PEntrez.Pubmed.Pubmed_ResultsPanel.Pubmed_DiscoveryPanel.Pubmed_Discovery_RA&log$=relatedarticles&logdbfrom=pubmed'>Related, PubMed</a>","<a href='https://scholar.google.com/scholar?q=related:https://pmc.ncbi.nlm.nih.gov/articles/PMC11156418/'>Related, Google Scholar</a>","<a href='https://pubmed.ncbi.nlm.nih.gov/?linkname=pubmed_pubmed_citedin&from_uid=38854997'>Cited By, PMID</a>","<a href='https://scholar.google.com/scholar?hl=en&lr=&cites=https://pmc.ncbi.nlm.nih.gov/articles/PMC11156418/'>Cited By, Google</a>", ,PMID(38854997) OR  ,2024,15249220,,,
R01CA241532,"Department of Radiological Sciences, University of California Irvine Irvine, CA, USA.",2024,"Zhang, Zigeng; Yu, Guangbo; Eresen, Aydin; Hou, Qiaoming; Yaghmai, Vahid; Zhang, Zhuoli",United States,2156-6976,5,<a href='https://pubmed.ncbi.nlm.nih.gov/38859849'>American journal of cancer research</a>,Am J Cancer Res,14,eng,2216-2227,11162671,38859849,2024,<a href='https://www.ncbi.nlm.nih.gov/pmc/articles/11162671'>MRI monitoring of combined therapy with transcatheter arterial delivery of NK cells and systemic administration of sorafenib for the treatment of HCC.</a>,"<a href='https://pubmed.ncbi.nlm.nih.gov/?Db=pubmed&DbFrom=pubmed&Cmd=Link&LinkName=pubmed_pubmed&IdsFromResult=38859849&ordinalpos=1&itool=EntrezSystem2.PEntrez.Pubmed.Pubmed_ResultsPanel.Pubmed_DiscoveryPanel.Pubmed_Discovery_RA&log$=relatedarticles&logdbfrom=pubmed'>Related, PubMed</a>","<a href='https://scholar.google.com/scholar?q=related:https://pmc.ncbi.nlm.nih.gov/articles/PMC11162671/'>Related, Google Scholar</a>","<a href='https://pubmed.ncbi.nlm.nih.gov/?linkname=pubmed_pubmed_citedin&from_uid=38859849'>Cited By, PMID</a>","<a href='https://scholar.google.com/scholar?hl=en&lr=&cites=https://pmc.ncbi.nlm.nih.gov/articles/PMC11162671/'>Cited By, Google</a>", ,PMID(38859849) OR  ,2024,21566976,,,
K01MH125172,"Computer Science, University of Toronto, Toronto, Ontario, Canada.",2024,"Bhattacharjee, Ananya; Zeng, Yuchen; Xu, Sarah Yi; Kulzhabayeva, Dana; Ma, Minyi; Kornfield, Rachel; Ahmed, Syed Ishtiaque; Mariakakis, Alex; Czerwinski, Mary P; Kuzminykh, Anastasia; Liut, Michael; Williams, Joseph Jay",United States, , ,<a href='https://pubmed.ncbi.nlm.nih.gov/38863598'>Proceedings of the SIGCHI conference on human factors in computing systems. CHI Conference</a>,Proc SIGCHI Conf Hum Factor Comput Syst,2024,eng, ,11166253,38863598,2024 May,<a href='https://www.ncbi.nlm.nih.gov/pmc/articles/11166253'>Understanding the Role of Large Language Models in Personalizing and Scaffolding Strategies to Combat Academic Procrastination.</a>,"<a href='https://pubmed.ncbi.nlm.nih.gov/?Db=pubmed&DbFrom=pubmed&Cmd=Link&LinkName=pubmed_pubmed&IdsFromResult=38863598&ordinalpos=1&itool=EntrezSystem2.PEntrez.Pubmed.Pubmed_ResultsPanel.Pubmed_DiscoveryPanel.Pubmed_Discovery_RA&log$=relatedarticles&logdbfrom=pubmed'>Related, PubMed</a>","<a href='https://scholar.google.com/scholar?q=related:https://pmc.ncbi.nlm.nih.gov/articles/PMC11166253/'>Related, Google Scholar</a>","<a href='https://pubmed.ncbi.nlm.nih.gov/?linkname=pubmed_pubmed_citedin&from_uid=38863598'>Cited By, PMID</a>","<a href='https://scholar.google.com/scholar?hl=en&lr=&cites=https://pmc.ncbi.nlm.nih.gov/articles/PMC11166253/'>Cited By, Google</a>", ,PMID(38863598) OR  ,2024,,,,
R01AG067622,Washington University in St. Louis.,2024,"Willroth, Emily C; Pfund, Gabrielle N; Mroczek, Daniel K; Hill, Patrick L",England,0890-2070,3,<a href='https://pubmed.ncbi.nlm.nih.gov/38863836'>European journal of personality</a>,Eur J Pers,38,eng,405-425,11164556,38863836,2024,"<a href='https://www.ncbi.nlm.nih.gov/pmc/articles/11164556'>Perceptions of a good life: Associations with culture, age, wellbeing, and health.</a>","<a href='https://pubmed.ncbi.nlm.nih.gov/?Db=pubmed&DbFrom=pubmed&Cmd=Link&LinkName=pubmed_pubmed&IdsFromResult=38863836&ordinalpos=1&itool=EntrezSystem2.PEntrez.Pubmed.Pubmed_ResultsPanel.Pubmed_DiscoveryPanel.Pubmed_Discovery_RA&log$=relatedarticles&logdbfrom=pubmed'>Related, PubMed</a>","<a href='https://scholar.google.com/scholar?q=related:https://pmc.ncbi.nlm.nih.gov/articles/PMC11164556/'>Related, Google Scholar</a>","<a href='https://pubmed.ncbi.nlm.nih.gov/?linkname=pubmed_pubmed_citedin&from_uid=38863836'>Cited By, PMID</a>","<a href='https://scholar.google.com/scholar?hl=en&lr=&cites=https://pmc.ncbi.nlm.nih.gov/articles/PMC11164556/'>Cited By, Google</a>", ,PMID(38863836) OR  ,2024,08902070,,,
R01DK134629,"Department of Preventive Medicine, Northwestern University Feinberg School of Medicine, Chicago, Illinois.",2024,"Spring, Bonnie; Pfammatter, Angela F; Scanlan, Laura; Daly, Elyse; Reading, Jean; Battalio, Sam; McFadden, H Gene; Hedeker, Don; Siddique, Juned; Nahum-Shani, Inbal",United States,1538-3598,1,<a href='https://pubmed.ncbi.nlm.nih.gov/38744428'>JAMA</a>,JAMA,332,eng,21-30,11094642,38744428,2024 Jul 02,<a href='https://www.ncbi.nlm.nih.gov/pmc/articles/11094642'>An Adaptive Behavioral Intervention for Weight Loss Management: A Randomized Clinical Trial.</a>,"<a href='https://pubmed.ncbi.nlm.nih.gov/?Db=pubmed&DbFrom=pubmed&Cmd=Link&LinkName=pubmed_pubmed&IdsFromResult=38744428&ordinalpos=1&itool=EntrezSystem2.PEntrez.Pubmed.Pubmed_ResultsPanel.Pubmed_DiscoveryPanel.Pubmed_Discovery_RA&log$=relatedarticles&logdbfrom=pubmed'>Related, PubMed</a>","<a href='https://scholar.google.com/scholar?q=related:https://pmc.ncbi.nlm.nih.gov/articles/PMC11094642/'>Related, Google Scholar</a>","<a href='https://pubmed.ncbi.nlm.nih.gov/?linkname=pubmed_pubmed_citedin&from_uid=38744428'>Cited By, PMID</a>","<a href='https://scholar.google.com/scholar?hl=en&lr=&cites=https://pmc.ncbi.nlm.nih.gov/articles/PMC11094642/'>Cited By, Google</a>",5.3,PMID(38744428) OR  ,2024,15383598,,,
F31HL162555,"Department of Preventive Medicine, Northwestern University Feinberg School of Medicine, Chicago, Illinois.",2024,"Spring, Bonnie; Pfammatter, Angela F; Scanlan, Laura; Daly, Elyse; Reading, Jean; Battalio, Sam; McFadden, H Gene; Hedeker, Don; Siddique, Juned; Nahum-Shani, Inbal",United States,1538-3598,1,<a href='https://pubmed.ncbi.nlm.nih.gov/38744428'>JAMA</a>,JAMA,332,eng,21-30,11094642,38744428,2024 Jul 02,<a href='https://www.ncbi.nlm.nih.gov/pmc/articles/11094642'>An Adaptive Behavioral Intervention for Weight Loss Management: A Randomized Clinical Trial.</a>,"<a href='https://pubmed.ncbi.nlm.nih.gov/?Db=pubmed&DbFrom=pubmed&Cmd=Link&LinkName=pubmed_pubmed&IdsFromResult=38744428&ordinalpos=1&itool=EntrezSystem2.PEntrez.Pubmed.Pubmed_ResultsPanel.Pubmed_DiscoveryPanel.Pubmed_Discovery_RA&log$=relatedarticles&logdbfrom=pubmed'>Related, PubMed</a>","<a href='https://scholar.google.com/scholar?q=related:https://pmc.ncbi.nlm.nih.gov/articles/PMC11094642/'>Related, Google Scholar</a>","<a href='https://pubmed.ncbi.nlm.nih.gov/?linkname=pubmed_pubmed_citedin&from_uid=38744428'>Cited By, PMID</a>","<a href='https://scholar.google.com/scholar?hl=en&lr=&cites=https://pmc.ncbi.nlm.nih.gov/articles/PMC11094642/'>Cited By, Google</a>",5.3,PMID(38744428) OR  ,2024,15383598,,,
OT2OD026557,"Weill Cornell Medical College, New York, New York, USA.",2024,"Hill, Rachel C; Faria, Willian De; Gold, Jeremy A W; Lipner, Shari R",Germany,1439-0507,8,<a href='https://pubmed.ncbi.nlm.nih.gov/39079943'>Mycoses</a>,Mycoses,67,eng,e13775,11409176,39079943,2024 Aug,<a href='https://www.ncbi.nlm.nih.gov/pmc/articles/11409176'>Factors associated with pityriasis versicolor in a large national database.</a>,"<a href='https://pubmed.ncbi.nlm.nih.gov/?Db=pubmed&DbFrom=pubmed&Cmd=Link&LinkName=pubmed_pubmed&IdsFromResult=39079943&ordinalpos=1&itool=EntrezSystem2.PEntrez.Pubmed.Pubmed_ResultsPanel.Pubmed_DiscoveryPanel.Pubmed_Discovery_RA&log$=relatedarticles&logdbfrom=pubmed'>Related, PubMed</a>","<a href='https://scholar.google.com/scholar?q=related:https://pmc.ncbi.nlm.nih.gov/articles/PMC11409176/'>Related, Google Scholar</a>","<a href='https://pubmed.ncbi.nlm.nih.gov/?linkname=pubmed_pubmed_citedin&from_uid=39079943'>Cited By, PMID</a>","<a href='https://scholar.google.com/scholar?hl=en&lr=&cites=https://pmc.ncbi.nlm.nih.gov/articles/PMC11409176/'>Cited By, Google</a>", ,PMID(39079943) OR  ,2024,14390507,,,
R01EY029121,"Department of Biomedical Engineering, Northwestern University, Evanston, IL.",2024,"Kim, Daniel; Fang, Raymond; Zhang, Pengpeng; Sun, Cheng; Li, Guorong; Montgomery, Christa; John, Simon W M; Stamer, W Daniel; Zhang, Hao F; Ethier, C Ross",United States,2692-8205, ,<a href='https://pubmed.ncbi.nlm.nih.gov/39091756'>bioRxiv : the preprint server for biology</a>,bioRxiv, ,eng, ,11291131,39091756,2024 Jul 25,<a href='https://www.ncbi.nlm.nih.gov/pmc/articles/11291131'>In vivo quantification of anterior and posterior chamber volumes in mice: implications for aqueous humor dynamics.</a>,"<a href='https://pubmed.ncbi.nlm.nih.gov/?Db=pubmed&DbFrom=pubmed&Cmd=Link&LinkName=pubmed_pubmed&IdsFromResult=39091756&ordinalpos=1&itool=EntrezSystem2.PEntrez.Pubmed.Pubmed_ResultsPanel.Pubmed_DiscoveryPanel.Pubmed_Discovery_RA&log$=relatedarticles&logdbfrom=pubmed'>Related, PubMed</a>","<a href='https://scholar.google.com/scholar?q=related:https://pmc.ncbi.nlm.nih.gov/articles/PMC11291131/'>Related, Google Scholar</a>","<a href='https://pubmed.ncbi.nlm.nih.gov/?linkname=pubmed_pubmed_citedin&from_uid=39091756'>Cited By, PMID</a>","<a href='https://scholar.google.com/scholar?hl=en&lr=&cites=https://pmc.ncbi.nlm.nih.gov/articles/PMC11291131/'>Cited By, Google</a>", ,PMID(39091756) OR  ,2024,26928205,,,
UL1TR001422,NorthShore University HealthSystem.,2024,"Glaser, Alexander P; Smith, Abigail R; Maglaque, Dacey; Helfand, Brian T; Mohamed, Rowida; An, Hosanna; Marquez, Melissa; Talaty, Pooja; Carolan, Padraig; Geller, Aaron M; Farina, Francesca R; Jensen, Sally E; Griffith, James W",United States,2693-5015, ,<a href='https://pubmed.ncbi.nlm.nih.gov/38766034'>Research square</a>,Res Sq, ,eng, ,11100908,38766034,2024 May 06,<a href='https://www.ncbi.nlm.nih.gov/pmc/articles/11100908'>Enhanced Clinical Decisions for Management of Benign Prostatic Hyperplasia using Patient-Reported Outcomes: Protocol for a Prospective Observational Study.</a>,"<a href='https://pubmed.ncbi.nlm.nih.gov/?Db=pubmed&DbFrom=pubmed&Cmd=Link&LinkName=pubmed_pubmed&IdsFromResult=38766034&ordinalpos=1&itool=EntrezSystem2.PEntrez.Pubmed.Pubmed_ResultsPanel.Pubmed_DiscoveryPanel.Pubmed_Discovery_RA&log$=relatedarticles&logdbfrom=pubmed'>Related, PubMed</a>","<a href='https://scholar.google.com/scholar?q=related:https://pmc.ncbi.nlm.nih.gov/articles/PMC11100908/'>Related, Google Scholar</a>","<a href='https://pubmed.ncbi.nlm.nih.gov/?linkname=pubmed_pubmed_citedin&from_uid=38766034'>Cited By, PMID</a>","<a href='https://scholar.google.com/scholar?hl=en&lr=&cites=https://pmc.ncbi.nlm.nih.gov/articles/PMC11100908/'>Cited By, Google</a>", ,PMID(38766034) OR  ,2024,26935015,,,
R01HL147290,"Department of Medicine, Northwestern University Feinberg School of Medicine, Chicago, IL.",2024,"Grudzinski, Kevin M; Fenske, Samuel; Peltekian, Alec; Markov, Nikolay S; Pawlowski, Anna; Kang, Mengjia; Walter, James M; Pickens, Chiagozie I; Nadig, Nandita R; Agrawal, Ankit; Singer, Benjamin D; Wunderink, Richard G; Gao, Catherine A",United States, , ,<a href='https://pubmed.ncbi.nlm.nih.gov/38766045'>medRxiv : the preprint server for health sciences</a>,medRxiv, ,eng, ,11100846,38766045,2024 Nov 04,<a href='https://www.ncbi.nlm.nih.gov/pmc/articles/11100846'>Neutrophil percentages in bronchoalveolar lavage fluid: Implications for diagnosing bacterial pneumonia in patients with immunocompromise and neutropenia.</a>,"<a href='https://pubmed.ncbi.nlm.nih.gov/?Db=pubmed&DbFrom=pubmed&Cmd=Link&LinkName=pubmed_pubmed&IdsFromResult=38766045&ordinalpos=1&itool=EntrezSystem2.PEntrez.Pubmed.Pubmed_ResultsPanel.Pubmed_DiscoveryPanel.Pubmed_Discovery_RA&log$=relatedarticles&logdbfrom=pubmed'>Related, PubMed</a>","<a href='https://scholar.google.com/scholar?q=related:https://pmc.ncbi.nlm.nih.gov/articles/PMC11100846/'>Related, Google Scholar</a>","<a href='https://pubmed.ncbi.nlm.nih.gov/?linkname=pubmed_pubmed_citedin&from_uid=38766045'>Cited By, PMID</a>","<a href='https://scholar.google.com/scholar?hl=en&lr=&cites=https://pmc.ncbi.nlm.nih.gov/articles/PMC11100846/'>Cited By, Google</a>", ,PMID(38766045) OR  ,2024,,,,
U54EB027049,"Department of Environmental and Occupational Health Sciences, University of Washington, Seattle, Washington, United States of America.",2024,"Olson, Alaina M; Wood, Rachel C; Weigel, Kris M; Yan, Alexander J; Lochner, Katherine A; Dragovich, Rane B; Luabeya, Angelique K; Yager, Paul; Hatherill, Mark; Cangelosi, Gerard A",United States, , ,<a href='https://pubmed.ncbi.nlm.nih.gov/39108520'>medRxiv : the preprint server for health sciences</a>,medRxiv, ,eng, ,11302704,39108520,2024 Jul 27,<a href='https://www.ncbi.nlm.nih.gov/pmc/articles/11302704'>High-sensitivity detection of Mycobacterium tuberculosis DNA in tongue swab samples.</a>,"<a href='https://pubmed.ncbi.nlm.nih.gov/?Db=pubmed&DbFrom=pubmed&Cmd=Link&LinkName=pubmed_pubmed&IdsFromResult=39108520&ordinalpos=1&itool=EntrezSystem2.PEntrez.Pubmed.Pubmed_ResultsPanel.Pubmed_DiscoveryPanel.Pubmed_Discovery_RA&log$=relatedarticles&logdbfrom=pubmed'>Related, PubMed</a>","<a href='https://scholar.google.com/scholar?q=related:https://pmc.ncbi.nlm.nih.gov/articles/PMC11302704/'>Related, Google Scholar</a>","<a href='https://pubmed.ncbi.nlm.nih.gov/?linkname=pubmed_pubmed_citedin&from_uid=39108520'>Cited By, PMID</a>","<a href='https://scholar.google.com/scholar?hl=en&lr=&cites=https://pmc.ncbi.nlm.nih.gov/articles/PMC11302704/'>Cited By, Google</a>", ,PMID(39108520) OR  ,2024,,,,
R01DK131118,"Department of Pharmacology, Feinberg School of Medicine, Northwestern University, Chicago, Illinois, USA.",2024,"Larmore, Megan; Palomero, Orhi Esarte; Kamat, Neha P; DeCaen, Paul G",United States,2692-8205, ,<a href='https://pubmed.ncbi.nlm.nih.gov/38766162'>bioRxiv : the preprint server for biology</a>,bioRxiv, ,eng, ,11100589,38766162,2024 Aug 10,<a href='https://www.ncbi.nlm.nih.gov/pmc/articles/11100589'>A synthetic method to assay polycystin channel biophysics.</a>,"<a href='https://pubmed.ncbi.nlm.nih.gov/?Db=pubmed&DbFrom=pubmed&Cmd=Link&LinkName=pubmed_pubmed&IdsFromResult=38766162&ordinalpos=1&itool=EntrezSystem2.PEntrez.Pubmed.Pubmed_ResultsPanel.Pubmed_DiscoveryPanel.Pubmed_Discovery_RA&log$=relatedarticles&logdbfrom=pubmed'>Related, PubMed</a>","<a href='https://scholar.google.com/scholar?q=related:https://pmc.ncbi.nlm.nih.gov/articles/PMC11100589/'>Related, Google Scholar</a>","<a href='https://pubmed.ncbi.nlm.nih.gov/?linkname=pubmed_pubmed_citedin&from_uid=38766162'>Cited By, PMID</a>","<a href='https://scholar.google.com/scholar?hl=en&lr=&cites=https://pmc.ncbi.nlm.nih.gov/articles/PMC11100589/'>Cited By, Google</a>", ,PMID(38766162) OR  ,2024,26928205,,,
