R01MH107652,"Emotion and Development Branch, NIMH, Bethesda, Md. (Leibenluft, Brotman, Kircanski, Malone, Pine); Faculty of Brain Sciences, Division of Psychiatry and Division of Psychology and Language Sciences, University College London (Allen, Stringaris); Departments of Psychiatry, Pediatrics, and Psychological Science, University of Vermont, Burlington (Althoff); Department of Psychological Sciences, University of Connecticut, Storrs (Burke); Division of Child and Adolescent Psychiatry, Department of Psychiatry (Carlson), Department of Psychology (Klein, Silver), and Department of Psychiatry (Klein), Stony Brook University, Stony Brook, N.Y.; Division of Child and Adolescent Psychiatry, McLean Hospital, Harvard Medical School, Belmont, Mass. (Dickstein); Department of Psychology, University of Maryland, College Park (Dougherty); Department of Psychology, University of Miami, Coral Gables, Fla. (Evans); Departments of Psychiatry, Psychology, and Clinical and Translational Science, University of Pittsburgh, Pittsburgh (Mazefsky); Department of Psychiatry, Oregon Health and Science University, Portland (Nigg); Department of Psychology, Washington University at St. Louis, St. Louis (Perlman); Department of Psychology, Fordham University, New York (Roy); Child Mind Institute, New York (Salum); Division of Psychological Medicine and Clinical Neurosciences, Wolfson Centre for Young People's Mental Health, Centre for Neuropsychiatric Genetics and Genomics, Cardiff University, Cardiff, Wales, United Kingdom (Shakeshaft, Thapar); Division of Child and Adolescent Mental Health, Children's Hospital Colorado, University of Colorado School of Medicine, Denver (Stoddard); Yale Child Study Center, Yale School of Medicine, New Haven, Conn. (Tseng); Child and Adolescent Mental Health Research Group, Institut de Recerca Sant Joan de Déu, Esplugues de Llobregat, Barcelona, Spain (Vidal-Ribas); Department of Medical Social Sciences, Institute for Innovations in Developmental Sciences, and Institute for Policy Research, Northwestern University, Chicago (Wakschlag); First Department of Psychiatry, National and Kapodistrian University of Athens, and Aiginiteion Hospital, Athens, Greece (Stringaris).",2024,"Leibenluft, Ellen; Allen, Laura E; Althoff, Robert R; Brotman, Melissa A; Burke, Jeffrey D; Carlson, Gabrielle A; Dickstein, Daniel P; Dougherty, Lea R; Evans, Spencer C; Kircanski, Katharina; Klein, Daniel N; Malone, Eleanor P; Mazefsky, Carla A; Nigg, Joel; Perlman, Susan B; Pine, Daniel S; Roy, Amy Krain; Salum, Giovanni A; Shakeshaft, Amy; Silver, Jamilah; Stoddard, Joel; Thapar, Anita; Tseng, Wan-Ling; Vidal-Ribas, Pablo; Wakschlag, Lauren S; Stringaris, Argyris",United States,1535-7228,4,<a href='https://pubmed.ncbi.nlm.nih.gov/38419494'>The American journal of psychiatry</a>,Am J Psychiatry,181,eng,275-290,12010774,38419494,2024 Apr 01,<a href='https://www.ncbi.nlm.nih.gov/pmc/articles/12010774'>Irritability in Youths: A Critical Integrative Review.</a>,"<a href='https://pubmed.ncbi.nlm.nih.gov/?Db=pubmed&DbFrom=pubmed&Cmd=Link&LinkName=pubmed_pubmed&IdsFromResult=38419494&ordinalpos=1&itool=EntrezSystem2.PEntrez.Pubmed.Pubmed_ResultsPanel.Pubmed_DiscoveryPanel.Pubmed_Discovery_RA&log$=relatedarticles&logdbfrom=pubmed'>Related, PubMed</a>","<a href='https://scholar.google.com/scholar?q=related:https://pmc.ncbi.nlm.nih.gov/articles/PMC12010774/'>Related, Google Scholar</a>","<a href='https://pubmed.ncbi.nlm.nih.gov/?linkname=pubmed_pubmed_citedin&from_uid=38419494'>Cited By, PMID</a>","<a href='https://scholar.google.com/scholar?hl=en&lr=&cites=https://pmc.ncbi.nlm.nih.gov/articles/PMC12010774/'>Cited By, Google</a>",8.77,38419494,2024,15357228,am j psychiatry,,,,Am J Psychiatry,Unknown,,False,False,False,
F31NS131055,"The Ken and Ruth Davee Department of Neurology, Feinberg School of Medicine, Northwestern University, Chicago, IL, USA.",2024,"Zalon, Annie J; Quiriconi, Drew J; Pitcairn, Caleb; Mazzulli, Joseph R",United States,1089-4098,5,"<a href='https://pubmed.ncbi.nlm.nih.gov/38420922'>The Neuroscientist : a review journal bringing neurobiology, neurology and psychiatry</a>",Neuroscientist,30,eng,612-635,11358363,38420922,2024 Oct,α-Synuclein: Multiple pathogenic roles in trafficking and proteostasis pathways in Parkinson's disease.,"<a href='https://pubmed.ncbi.nlm.nih.gov/?Db=pubmed&DbFrom=pubmed&Cmd=Link&LinkName=pubmed_pubmed&IdsFromResult=38420922&ordinalpos=1&itool=EntrezSystem2.PEntrez.Pubmed.Pubmed_ResultsPanel.Pubmed_DiscoveryPanel.Pubmed_Discovery_RA&log$=relatedarticles&logdbfrom=pubmed'>Related, PubMed</a>","<a href='https://scholar.google.com/scholar?q=related:https://pmc.ncbi.nlm.nih.gov/articles/PMC11358363/'>Related, Google Scholar</a>","<a href='https://pubmed.ncbi.nlm.nih.gov/?linkname=pubmed_pubmed_citedin&from_uid=38420922'>Cited By, PMID</a>","<a href='https://scholar.google.com/scholar?hl=en&lr=&cites=https://pmc.ncbi.nlm.nih.gov/articles/PMC11358363/'>Cited By, Google</a>", ,38420922,2024,10894098,neuroscientist,,,,Neuroscientist,Unknown,,False,False,False,
R01GM140272, ,2024,"Kordon, Szymon P; Cechova, Kristina; Bandekar, Sumit J; Leon, Katherine; Dutka, Przemysław; Siffer, Gracie; Kossiakoff, Anthony A; Vafabakhsh, Reza; Araç, Demet",United States,2692-8205, ,<a href='https://pubmed.ncbi.nlm.nih.gov/38464178'>bioRxiv : the preprint server for biology</a>,bioRxiv, ,eng, ,10925191,38464178,2024 Feb 26,<a href='https://www.ncbi.nlm.nih.gov/pmc/articles/10925191'>Structural analysis and conformational dynamics of a holo-adhesion GPCR reveal interplay between extracellular and transmembrane domains.</a>,"<a href='https://pubmed.ncbi.nlm.nih.gov/?Db=pubmed&DbFrom=pubmed&Cmd=Link&LinkName=pubmed_pubmed&IdsFromResult=38464178&ordinalpos=1&itool=EntrezSystem2.PEntrez.Pubmed.Pubmed_ResultsPanel.Pubmed_DiscoveryPanel.Pubmed_Discovery_RA&log$=relatedarticles&logdbfrom=pubmed'>Related, PubMed</a>","<a href='https://scholar.google.com/scholar?q=related:https://pmc.ncbi.nlm.nih.gov/articles/PMC10925191/'>Related, Google Scholar</a>","<a href='https://pubmed.ncbi.nlm.nih.gov/?linkname=pubmed_pubmed_citedin&from_uid=38464178'>Cited By, PMID</a>","<a href='https://scholar.google.com/scholar?hl=en&lr=&cites=https://pmc.ncbi.nlm.nih.gov/articles/PMC10925191/'>Cited By, Google</a>", ,38464178,2024,26928205,biorxiv,,,,bioRxiv,Unknown,,False,False,False,
R00EB033857, ,2024,"Nguyen, Kim Truc; Rima, Xilal Y; Hisey, Colin L; Doon-Ralls, Jacob; Nagaraj, Chiranth K; Reátegui, Eduardo",United States,2692-8205, ,<a href='https://pubmed.ncbi.nlm.nih.gov/38464234'>bioRxiv : the preprint server for biology</a>,bioRxiv, ,eng, ,10925179,38464234,2024 Feb 27,<a href='https://www.ncbi.nlm.nih.gov/pmc/articles/10925179'>Limiting Brownian Motion to Enhance Immunogold Phenotyping and Superimpose Optical and Non-Optical Single-EP Analyses.</a>,"<a href='https://pubmed.ncbi.nlm.nih.gov/?Db=pubmed&DbFrom=pubmed&Cmd=Link&LinkName=pubmed_pubmed&IdsFromResult=38464234&ordinalpos=1&itool=EntrezSystem2.PEntrez.Pubmed.Pubmed_ResultsPanel.Pubmed_DiscoveryPanel.Pubmed_Discovery_RA&log$=relatedarticles&logdbfrom=pubmed'>Related, PubMed</a>","<a href='https://scholar.google.com/scholar?q=related:https://pmc.ncbi.nlm.nih.gov/articles/PMC10925179/'>Related, Google Scholar</a>","<a href='https://pubmed.ncbi.nlm.nih.gov/?linkname=pubmed_pubmed_citedin&from_uid=38464234'>Cited By, PMID</a>","<a href='https://scholar.google.com/scholar?hl=en&lr=&cites=https://pmc.ncbi.nlm.nih.gov/articles/PMC10925179/'>Cited By, Google</a>", ,38464234,2024,26928205,biorxiv,,,,bioRxiv,Unknown,,False,False,False,
T32EB025766,"Department of Medical Physics, Faculty of Mathematics and Natural Sciences, University of Greifswald, Greifswald, Germany.",2024,"Winter, Patrick; Berhane, Haben; Moore, Jackson E; Aristova, Maria; Reichl, Teresa; Wollenberg, Julian; Richter, Adam; Jarvis, Kelly B; Patel, Abhinav; Caprio, Fan Z; Abdalla, Ramez N; Ansari, Sameer A; Markl, Michael; Schnell, Susanne",Switzerland,2673-8740, ,<a href='https://pubmed.ncbi.nlm.nih.gov/38895589'>Frontiers in radiology</a>,Front Radiol,4,eng,1385424,11183785,38895589,2024,<a href='https://www.ncbi.nlm.nih.gov/pmc/articles/11183785'>Automated intracranial vessel segmentation of 4D flow MRI data in patients with atherosclerotic stenosis using a convolutional neural network.</a>,"<a href='https://pubmed.ncbi.nlm.nih.gov/?Db=pubmed&DbFrom=pubmed&Cmd=Link&LinkName=pubmed_pubmed&IdsFromResult=38895589&ordinalpos=1&itool=EntrezSystem2.PEntrez.Pubmed.Pubmed_ResultsPanel.Pubmed_DiscoveryPanel.Pubmed_Discovery_RA&log$=relatedarticles&logdbfrom=pubmed'>Related, PubMed</a>","<a href='https://scholar.google.com/scholar?q=related:https://pmc.ncbi.nlm.nih.gov/articles/PMC11183785/'>Related, Google Scholar</a>","<a href='https://pubmed.ncbi.nlm.nih.gov/?linkname=pubmed_pubmed_citedin&from_uid=38895589'>Cited By, PMID</a>","<a href='https://scholar.google.com/scholar?hl=en&lr=&cites=https://pmc.ncbi.nlm.nih.gov/articles/PMC11183785/'>Cited By, Google</a>", ,38895589,2024,26738740,front radiol,,,,Front Radiol,Unknown,,False,False,False,
R01DK104927,"Division of Gastroenterology and Hepatology, University of Illinois Chicago.",2024,"Yazici, Cemal; Priyadarshini, Medha; Boulay, Brian; Dai, Yang; Layden, Brian T",United States,1531-7056,5,<a href='https://pubmed.ncbi.nlm.nih.gov/38900442'>Current opinion in gastroenterology</a>,Curr Opin Gastroenterol,40,eng,413-421,11305980,38900442,2024 Sep 01,<a href='https://www.ncbi.nlm.nih.gov/pmc/articles/11305980'>Alterations in microbiome associated with acute pancreatitis.</a>,"<a href='https://pubmed.ncbi.nlm.nih.gov/?Db=pubmed&DbFrom=pubmed&Cmd=Link&LinkName=pubmed_pubmed&IdsFromResult=38900442&ordinalpos=1&itool=EntrezSystem2.PEntrez.Pubmed.Pubmed_ResultsPanel.Pubmed_DiscoveryPanel.Pubmed_Discovery_RA&log$=relatedarticles&logdbfrom=pubmed'>Related, PubMed</a>","<a href='https://scholar.google.com/scholar?q=related:https://pmc.ncbi.nlm.nih.gov/articles/PMC11305980/'>Related, Google Scholar</a>","<a href='https://pubmed.ncbi.nlm.nih.gov/?linkname=pubmed_pubmed_citedin&from_uid=38900442'>Cited By, PMID</a>","<a href='https://scholar.google.com/scholar?hl=en&lr=&cites=https://pmc.ncbi.nlm.nih.gov/articles/PMC11305980/'>Cited By, Google</a>", ,38900442,2024,15317056,curr opin gastroenterol,,,,Curr Opin Gastroenterol,Unknown,,False,False,False,
P30AG013854,"Vanderbilt Memory and Alzheimer's Center, Vanderbilt University School of Medicine, Nashville, TN.",2024,"Peterson, Amalia; Sathe, Aditi; Zaras, Dimitrios; Yang, Yisu; Durant, Alaina; Deters, Kacie D; Shashikumar, Niranjana; Pechman, Kimberly R; Kim, Michael E; Gao, Chenyu; Khairi, Nazirah Mohd; Li, Zhiyuan; Yao, Tianyuan; Huo, Yuankai; Dumitrescu, Logan; Gifford, Katherine A; Wilson, Jo Ellen; Cambronero, Francis; Risacher, Shannon L; Beason-Held, Lori L; An, Yang; Arfanakis, Konstantinos; Erus, Guray; Davatzikos, Christos; Tosun, Duygu; Toga, Arthur W; Thompson, Paul M; Mormino, Elizabeth C; Zhang, Panpan; Schilling, Kurt; Alzheimer’s Disease Neuroimaging Initiative (ADNI); BIOCARD Study Team; Alzheimer’s Disease Sequencing Project (ADSP); Albert, Marilyn; Kukull, Walter; Biber, Sarah A; Landman, Bennett A; Johnson, Sterling C; Schneider, Julie; Barnes, Lisa L; Bennett, David A; Jefferson, Angela L; Resnick, Susan M; Saykin, Andrew J; Hohman, Timothy J; Archer, Derek B",United States,2692-8205, ,<a href='https://pubmed.ncbi.nlm.nih.gov/38915636'>bioRxiv : the preprint server for biology</a>,bioRxiv, ,eng, ,11195046,38915636,2024 Jun 12,"<a href='https://www.ncbi.nlm.nih.gov/pmc/articles/11195046'>Sex, racial, and APOE-ε4 allele differences in longitudinal white matter microstructure in multiple cohorts of aging and Alzheimer's disease.</a>","<a href='https://pubmed.ncbi.nlm.nih.gov/?Db=pubmed&DbFrom=pubmed&Cmd=Link&LinkName=pubmed_pubmed&IdsFromResult=38915636&ordinalpos=1&itool=EntrezSystem2.PEntrez.Pubmed.Pubmed_ResultsPanel.Pubmed_DiscoveryPanel.Pubmed_Discovery_RA&log$=relatedarticles&logdbfrom=pubmed'>Related, PubMed</a>","<a href='https://scholar.google.com/scholar?q=related:https://pmc.ncbi.nlm.nih.gov/articles/PMC11195046/'>Related, Google Scholar</a>","<a href='https://pubmed.ncbi.nlm.nih.gov/?linkname=pubmed_pubmed_citedin&from_uid=38915636'>Cited By, PMID</a>","<a href='https://scholar.google.com/scholar?hl=en&lr=&cites=https://pmc.ncbi.nlm.nih.gov/articles/PMC11195046/'>Cited By, Google</a>", ,38915636,2024,26928205,biorxiv,,,,bioRxiv,Unknown,,False,False,False,
K99HD108424,"Department of Obstetrics and Gynecology, Washington University School of Medicine, St. Louis, MO, USA.",2024,"Pietroforte, Sara; Plough, Makenzie; Amargant, Farners",United States,2692-8205, ,<a href='https://pubmed.ncbi.nlm.nih.gov/38915651'>bioRxiv : the preprint server for biology</a>,bioRxiv, ,eng, ,11195110,38915651,2024 Jun 10,<a href='https://www.ncbi.nlm.nih.gov/pmc/articles/11195110'>Age-associated increased stiffness of the ovarian microenvironment impairs follicle development and oocyte quality and rapidly alters follicle gene expression.</a>,"<a href='https://pubmed.ncbi.nlm.nih.gov/?Db=pubmed&DbFrom=pubmed&Cmd=Link&LinkName=pubmed_pubmed&IdsFromResult=38915651&ordinalpos=1&itool=EntrezSystem2.PEntrez.Pubmed.Pubmed_ResultsPanel.Pubmed_DiscoveryPanel.Pubmed_Discovery_RA&log$=relatedarticles&logdbfrom=pubmed'>Related, PubMed</a>","<a href='https://scholar.google.com/scholar?q=related:https://pmc.ncbi.nlm.nih.gov/articles/PMC11195110/'>Related, Google Scholar</a>","<a href='https://pubmed.ncbi.nlm.nih.gov/?linkname=pubmed_pubmed_citedin&from_uid=38915651'>Cited By, PMID</a>","<a href='https://scholar.google.com/scholar?hl=en&lr=&cites=https://pmc.ncbi.nlm.nih.gov/articles/PMC11195110/'>Cited By, Google</a>", ,38915651,2024,26928205,biorxiv,,,,bioRxiv,Unknown,,False,False,False,
U01HL146240,"Faculty of Health Sciences, Simon Fraser University, Burnaby, British Columbia, Canada.",2024,"Shahid, Aniqa; Jones, Bradley R; Duncan, Maggie C; MacLennan, Signe; Dapp, Michael J; Kuniholm, Mark H; Aouizerat, Bradley; Archin, Nancie M; Gange, Stephen; Ofotokun, Igho; Fischl, Margaret A; Kassaye, Seble; Goldstein, Harris; Anastos, Kathryn; Joy, Jeffrey B; Brumme, Zabrina L",United States,2693-5015, ,<a href='https://pubmed.ncbi.nlm.nih.gov/38947061'>Research square</a>,Res Sq, ,eng, ,11213167,38947061,2024 Jun 13,<a href='https://www.ncbi.nlm.nih.gov/pmc/articles/11213167'>A simple phylogenetic approach to analyze hypermutated HIV proviruses reveals insights into their dynamics and persistence during antiretroviral therapy.</a>,"<a href='https://pubmed.ncbi.nlm.nih.gov/?Db=pubmed&DbFrom=pubmed&Cmd=Link&LinkName=pubmed_pubmed&IdsFromResult=38947061&ordinalpos=1&itool=EntrezSystem2.PEntrez.Pubmed.Pubmed_ResultsPanel.Pubmed_DiscoveryPanel.Pubmed_Discovery_RA&log$=relatedarticles&logdbfrom=pubmed'>Related, PubMed</a>","<a href='https://scholar.google.com/scholar?q=related:https://pmc.ncbi.nlm.nih.gov/articles/PMC11213167/'>Related, Google Scholar</a>","<a href='https://pubmed.ncbi.nlm.nih.gov/?linkname=pubmed_pubmed_citedin&from_uid=38947061'>Cited By, PMID</a>","<a href='https://scholar.google.com/scholar?hl=en&lr=&cites=https://pmc.ncbi.nlm.nih.gov/articles/PMC11213167/'>Cited By, Google</a>", ,38947061,2024,26935015,res sq,,,,Res Sq,Unknown,,False,False,False,
OT2OD026557,"Department of Anatomy and Cell Biology, Schulich School of Medicine and Dentistry, Western University, London, ON, Canada.",2024,"Thorpe, Hayley H A; Fontanillas, Pierre; Meredith, John J; Jennings, Mariela V; Cupertino, Renata B; Pakala, Shreya; 23andMe Research Team; Elson, Sarah L; Khokhar, Jibran Y; Davis, Lea K; Johnson, Emma C; Palmer, Abraham A; Sanchez-Roige, Sandra",United States, , ,<a href='https://pubmed.ncbi.nlm.nih.gov/38947071'>medRxiv : the preprint server for health sciences</a>,medRxiv, ,eng, ,11213095,38947071,2024 Jun 15,"<a href='https://www.ncbi.nlm.nih.gov/pmc/articles/11213095'>Genome-wide association studies of lifetime and frequency cannabis use in 131,895 individuals.</a>","<a href='https://pubmed.ncbi.nlm.nih.gov/?Db=pubmed&DbFrom=pubmed&Cmd=Link&LinkName=pubmed_pubmed&IdsFromResult=38947071&ordinalpos=1&itool=EntrezSystem2.PEntrez.Pubmed.Pubmed_ResultsPanel.Pubmed_DiscoveryPanel.Pubmed_Discovery_RA&log$=relatedarticles&logdbfrom=pubmed'>Related, PubMed</a>","<a href='https://scholar.google.com/scholar?q=related:https://pmc.ncbi.nlm.nih.gov/articles/PMC11213095/'>Related, Google Scholar</a>","<a href='https://pubmed.ncbi.nlm.nih.gov/?linkname=pubmed_pubmed_citedin&from_uid=38947071'>Cited By, PMID</a>","<a href='https://scholar.google.com/scholar?hl=en&lr=&cites=https://pmc.ncbi.nlm.nih.gov/articles/PMC11213095/'>Cited By, Google</a>", ,38947071,2024,,medrxiv,,,,medRxiv,Unknown,,False,False,False,
UL1TR001422,"Department of Biomedical Informatics, University of Colorado Anschutz Medical Campus, Aurora, CO, USA.",2024,"O'Neil, Shawn T; Madlock-Brown, Charisse; Wilkins, Kenneth J; McGrath, Brenda M; Davis, Hannah E; Assaf, Gina S; Wei, Hannah; Zareie, Parya; French, Evan T; Loomba, Johanna; McMurry, Julie A; Zhou, Andrea; Chute, Christopher G; Moffitt, Richard A; Pfaff, Emily R; Yoo, Yun Jae; Leese, Peter; Chew, Robert F; Lieberman, Michael; Haendel, Melissa A",United States, , ,<a href='https://pubmed.ncbi.nlm.nih.gov/38947087'>medRxiv : the preprint server for health sciences</a>,medRxiv, ,eng, ,11213052,38947087,2024 Jun 11,<a href='https://www.ncbi.nlm.nih.gov/pmc/articles/11213052'>Finding Long-COVID: Temporal Topic Modeling of Electronic Health Records from the N3C and RECOVER Programs.</a>,"<a href='https://pubmed.ncbi.nlm.nih.gov/?Db=pubmed&DbFrom=pubmed&Cmd=Link&LinkName=pubmed_pubmed&IdsFromResult=38947087&ordinalpos=1&itool=EntrezSystem2.PEntrez.Pubmed.Pubmed_ResultsPanel.Pubmed_DiscoveryPanel.Pubmed_Discovery_RA&log$=relatedarticles&logdbfrom=pubmed'>Related, PubMed</a>","<a href='https://scholar.google.com/scholar?q=related:https://pmc.ncbi.nlm.nih.gov/articles/PMC11213052/'>Related, Google Scholar</a>","<a href='https://pubmed.ncbi.nlm.nih.gov/?linkname=pubmed_pubmed_citedin&from_uid=38947087'>Cited By, PMID</a>","<a href='https://scholar.google.com/scholar?hl=en&lr=&cites=https://pmc.ncbi.nlm.nih.gov/articles/PMC11213052/'>Cited By, Google</a>", ,38947087,2024,,medrxiv,,,,medRxiv,Unknown,,False,False,False,
P30DA027828,"Center for Education in Health Sciences, Northwestern University Feinberg School of Medicine, Chicago, Illinois.",2024,"Danielson, Elizabeth C; Smith, Matthew J; Ross, Brittany; Sherwood, Kari; Smith, Justin D; Atkins, Marc; Jordan, Neil",United States,0162-6434,1,"<a href='https://pubmed.ncbi.nlm.nih.gov/38975255'>Journal of special education technology : a publication of Utah State University, the Association for Special Education Technology, and the Technology and Media Division of the Council for Exceptional Children</a>",J Spec Educ Technol,39,eng,27-40,11225931,38975255,2024 Mar,<a href='https://www.ncbi.nlm.nih.gov/pmc/articles/11225931'>Implementation Preparation Costs of Virtual Interview Training in Pre-Employment Transition Services: A Budget Impact Analysis.</a>,"<a href='https://pubmed.ncbi.nlm.nih.gov/?Db=pubmed&DbFrom=pubmed&Cmd=Link&LinkName=pubmed_pubmed&IdsFromResult=38975255&ordinalpos=1&itool=EntrezSystem2.PEntrez.Pubmed.Pubmed_ResultsPanel.Pubmed_DiscoveryPanel.Pubmed_Discovery_RA&log$=relatedarticles&logdbfrom=pubmed'>Related, PubMed</a>","<a href='https://scholar.google.com/scholar?q=related:https://pmc.ncbi.nlm.nih.gov/articles/PMC11225931/'>Related, Google Scholar</a>","<a href='https://pubmed.ncbi.nlm.nih.gov/?linkname=pubmed_pubmed_citedin&from_uid=38975255'>Cited By, PMID</a>","<a href='https://scholar.google.com/scholar?hl=en&lr=&cites=https://pmc.ncbi.nlm.nih.gov/articles/PMC11225931/'>Cited By, Google</a>", ,38975255,2024,01626434,j spec educ technol,,,,J Spec Educ Technol,Unknown,,False,False,False,
P30DA027828,"School of Social Work, University of Michigan, Ann Arbor, Michigan.",2024,"Smith, Matthew J; Ryzin, Mark Van; Jordan, Neil; Atkins, Marc; Bornheimer, Lindsay A; Sherwood, Kari; Smith, Justin D",United States,2165-1434,2,<a href='https://pubmed.ncbi.nlm.nih.gov/38988658'>Career development and transition for exceptional individuals</a>,Career Dev Transit Except Individ,47,eng,92-105,11232528,38988658,2024 May,<a href='https://www.ncbi.nlm.nih.gov/pmc/articles/11232528'>Virtual Job Interview Training: A Dose Response to Improve Employment for Transition-Age Youth With Disabilities.</a>,"<a href='https://pubmed.ncbi.nlm.nih.gov/?Db=pubmed&DbFrom=pubmed&Cmd=Link&LinkName=pubmed_pubmed&IdsFromResult=38988658&ordinalpos=1&itool=EntrezSystem2.PEntrez.Pubmed.Pubmed_ResultsPanel.Pubmed_DiscoveryPanel.Pubmed_Discovery_RA&log$=relatedarticles&logdbfrom=pubmed'>Related, PubMed</a>","<a href='https://scholar.google.com/scholar?q=related:https://pmc.ncbi.nlm.nih.gov/articles/PMC11232528/'>Related, Google Scholar</a>","<a href='https://pubmed.ncbi.nlm.nih.gov/?linkname=pubmed_pubmed_citedin&from_uid=38988658'>Cited By, PMID</a>","<a href='https://scholar.google.com/scholar?hl=en&lr=&cites=https://pmc.ncbi.nlm.nih.gov/articles/PMC11232528/'>Cited By, Google</a>", ,38988658,2024,21651434,career dev transit except individ,,,,Career Dev Transit Except Individ,Unknown,,False,False,False,
P30AG072977,"Department of Pathology and Laboratory Medicine, Penn Neurodegeneration Genomics Center, Perelman School of Medicine, University of Pennsylvania, Philadelphia, PA, United States.",2024,"Kuzma, Amanda; Valladares, Otto; Greenfest-Allen, Emily; Nicaretta, Heather; Kirsch, Maureen; Ren, Youli; Katanic, Zivadin; White, Heather; Wilk, Andrew; Bass, Lauren; Brettschneider, Jascha; Carter, Luke; Cifello, Jeffrey; Chuang, Wei-Hsuan; Clark, Kaylyn; Gangadharan, Prabhakaran; Haut, Jacob; Ho, Pei-Chuan; Horng, Wenhwai; Iqbal, Taha; Jin, Yumi; Keskinen, Peter; Rose, Alexis Lerro; Moon, Michelle K; Manuel, Joseph; Qu, Liming; Robbins, Flawless; Saravanan, Naveensri; Sha, Jin; Tate, Sam; Zhao, Yi; Alzheimer’s Disease Sequencing Project; Cantwell, Laura; Gardner, Jake; Chou, Shin-Yi; Tzeng, Jung-Ying; Bush, William; Naj, Adam; Kuksa, Pavel; Lee, Wan-Ping; Leung, Yuk Yee; Schellenberg, Gerard; Wang, Li-San",United States, , ,<a href='https://pubmed.ncbi.nlm.nih.gov/39417134'>medRxiv : the preprint server for health sciences</a>,medRxiv, ,eng, ,11483014,39417134,2024 Dec 07,<a href='https://www.ncbi.nlm.nih.gov/pmc/articles/11483014'>NIAGADS: A Comprehensive National Data Repository for Alzheimer's Disease and Related Dementia Genetics and Genomics Research.</a>,"<a href='https://pubmed.ncbi.nlm.nih.gov/?Db=pubmed&DbFrom=pubmed&Cmd=Link&LinkName=pubmed_pubmed&IdsFromResult=39417134&ordinalpos=1&itool=EntrezSystem2.PEntrez.Pubmed.Pubmed_ResultsPanel.Pubmed_DiscoveryPanel.Pubmed_Discovery_RA&log$=relatedarticles&logdbfrom=pubmed'>Related, PubMed</a>","<a href='https://scholar.google.com/scholar?q=related:https://pmc.ncbi.nlm.nih.gov/articles/PMC11483014/'>Related, Google Scholar</a>","<a href='https://pubmed.ncbi.nlm.nih.gov/?linkname=pubmed_pubmed_citedin&from_uid=39417134'>Cited By, PMID</a>","<a href='https://scholar.google.com/scholar?hl=en&lr=&cites=https://pmc.ncbi.nlm.nih.gov/articles/PMC11483014/'>Cited By, Google</a>", ,39417134,2024,,medrxiv,,,,medRxiv,Unknown,,False,False,False,
R01DC019434,"Department of Otolaryngology-Head and Neck Surgery, Feinberg School of Medicine, Northwestern University Chicago, Illinois 60611, USA.",2024,"Kessler, Lexie; Koo, Chail; Richter, Claus-Peter; Tan, Xiaodong",United States,2156-6976,9,<a href='https://pubmed.ncbi.nlm.nih.gov/39417180'>American journal of cancer research</a>,Am J Cancer Res,14,eng,4597-4632,11477841,39417180,2024,"<a href='https://www.ncbi.nlm.nih.gov/pmc/articles/11477841'>Hearing loss during chemotherapy: prevalence, mechanisms, and protection.</a>","<a href='https://pubmed.ncbi.nlm.nih.gov/?Db=pubmed&DbFrom=pubmed&Cmd=Link&LinkName=pubmed_pubmed&IdsFromResult=39417180&ordinalpos=1&itool=EntrezSystem2.PEntrez.Pubmed.Pubmed_ResultsPanel.Pubmed_DiscoveryPanel.Pubmed_Discovery_RA&log$=relatedarticles&logdbfrom=pubmed'>Related, PubMed</a>","<a href='https://scholar.google.com/scholar?q=related:https://pmc.ncbi.nlm.nih.gov/articles/PMC11477841/'>Related, Google Scholar</a>","<a href='https://pubmed.ncbi.nlm.nih.gov/?linkname=pubmed_pubmed_citedin&from_uid=39417180'>Cited By, PMID</a>","<a href='https://scholar.google.com/scholar?hl=en&lr=&cites=https://pmc.ncbi.nlm.nih.gov/articles/PMC11477841/'>Cited By, Google</a>", ,39417180,2024,21566976,am j cancer res,,,,Am J Cancer Res,Unknown,,False,False,False,
R38CA245095,"Department of Surgery, Northwestern University Feinberg School of Medicine, 420 East Superior Street, Suite 9-900, Chicago, IL 60611, USA.",2024,"Jacobs, Caitlin S; Vitello, Dominic J; Chawla, Akhil",United States,1558-3171,5,<a href='https://pubmed.ncbi.nlm.nih.gov/39237168'>The Surgical clinics of North America</a>,Surg Clin North Am,104,eng,1121-1135,11377866,39237168,2024 Oct,Surgical Palliation for Advanced Pancreas Cancer.,"<a href='https://pubmed.ncbi.nlm.nih.gov/?Db=pubmed&DbFrom=pubmed&Cmd=Link&LinkName=pubmed_pubmed&IdsFromResult=39237168&ordinalpos=1&itool=EntrezSystem2.PEntrez.Pubmed.Pubmed_ResultsPanel.Pubmed_DiscoveryPanel.Pubmed_Discovery_RA&log$=relatedarticles&logdbfrom=pubmed'>Related, PubMed</a>","<a href='https://scholar.google.com/scholar?q=related:https://pmc.ncbi.nlm.nih.gov/articles/PMC11377866/'>Related, Google Scholar</a>","<a href='https://pubmed.ncbi.nlm.nih.gov/?linkname=pubmed_pubmed_citedin&from_uid=39237168'>Cited By, PMID</a>","<a href='https://scholar.google.com/scholar?hl=en&lr=&cites=https://pmc.ncbi.nlm.nih.gov/articles/PMC11377866/'>Cited By, Google</a>", ,39237168,2024,15583171,surg clin north am,,,,Surg Clin North Am,Unknown,,False,False,False,
