Core Project Number,Affiliation,Pub Year,Authors,Country,ISSN,Journal Issue,Journal (Link to PubMed abstract),Journal Title ABBR,Journal Volume,Language,Page Number,PMC ID,PMID,PUB Date,Title (Link to full-text in PubMed Central),Related Publications in PubMed,Related Publications in Google Scholar,Articles Citing from PubMed Central,Articles Citing from Google Scholar,Relative Citation Ratio,_pmid_norm,_year_int,_issn_norm,_title_norm,APC 2025 (USD),Publisher,Journal,_journal_label,_publisher,apc_original,_waived_by_issn,_waived_by_title,_is_waived,apc_effective
UL1TR001422,"Feinberg School of Medicine, Northwestern University, Chicago, Illinois, USA.",2024,"Hosseini, Mohammad; Senabre Hidalgo, Enric; Horbach, Serge P J M; Güttinger, Stephan; Penders, Bart",United States,1545-5815,5,<a href='https://pubmed.ncbi.nlm.nih.gov/36303330'>Accountability in research</a>,Account Res,31,eng,428-455,10163171,36303330,2024 Jul,<a href='https://www.ncbi.nlm.nih.gov/pmc/articles/10163171'>Messing with Merton: The intersection between open science practices and Mertonian values.</a>,"<a href='https://pubmed.ncbi.nlm.nih.gov/?Db=pubmed&DbFrom=pubmed&Cmd=Link&LinkName=pubmed_pubmed&IdsFromResult=36303330&ordinalpos=1&itool=EntrezSystem2.PEntrez.Pubmed.Pubmed_ResultsPanel.Pubmed_DiscoveryPanel.Pubmed_Discovery_RA&log$=relatedarticles&logdbfrom=pubmed'>Related, PubMed</a>","<a href='https://scholar.google.com/scholar?q=related:https://pmc.ncbi.nlm.nih.gov/articles/PMC10163171/'>Related, Google Scholar</a>","<a href='https://pubmed.ncbi.nlm.nih.gov/?linkname=pubmed_pubmed_citedin&from_uid=36303330'>Cited By, PMID</a>","<a href='https://scholar.google.com/scholar?hl=en&lr=&cites=https://pmc.ncbi.nlm.nih.gov/articles/PMC10163171/'>Cited By, Google</a>",2.94,36303330,2024,15455815,account res,,,,Account Res,Unknown,,False,False,False,
R35GM142441,"Department of Urology, Northwestern University, Feinberg School of Medicine, Chicago, IL, USA.",2024,"Li, Yangyang; Yang, Rendong",United States,2692-8205, ,<a href='https://pubmed.ncbi.nlm.nih.gov/37577677'>bioRxiv : the preprint server for biology</a>,bioRxiv, ,eng, ,10418261,37577677,2024 Feb 05,<a href='https://www.ncbi.nlm.nih.gov/pmc/articles/10418261'>PxBLAT: An efficient python binding library for BLAT.</a>,"<a href='https://pubmed.ncbi.nlm.nih.gov/?Db=pubmed&DbFrom=pubmed&Cmd=Link&LinkName=pubmed_pubmed&IdsFromResult=37577677&ordinalpos=1&itool=EntrezSystem2.PEntrez.Pubmed.Pubmed_ResultsPanel.Pubmed_DiscoveryPanel.Pubmed_Discovery_RA&log$=relatedarticles&logdbfrom=pubmed'>Related, PubMed</a>","<a href='https://scholar.google.com/scholar?q=related:https://pmc.ncbi.nlm.nih.gov/articles/PMC10418261/'>Related, Google Scholar</a>","<a href='https://pubmed.ncbi.nlm.nih.gov/?linkname=pubmed_pubmed_citedin&from_uid=37577677'>Cited By, PMID</a>","<a href='https://scholar.google.com/scholar?hl=en&lr=&cites=https://pmc.ncbi.nlm.nih.gov/articles/PMC10418261/'>Cited By, Google</a>", ,37577677,2024,26928205,biorxiv,,,,bioRxiv,Unknown,,False,False,False,
F32HD104408,"Department of Psychology, Northwestern University.",2024,"Luchkina, Elena; Waxman, Sandra",United States,1745-6924,6,<a href='https://pubmed.ncbi.nlm.nih.gov/37603076'>Perspectives on psychological science : a journal of the Association for Psychological Science</a>,Perspect Psychol Sci,19,eng,978-992,10879458,37603076,2024 Nov,<a href='https://www.ncbi.nlm.nih.gov/pmc/articles/10879458'>Talking About the Absent and the Abstract: Referential Communication in Language and Gesture.</a>,"<a href='https://pubmed.ncbi.nlm.nih.gov/?Db=pubmed&DbFrom=pubmed&Cmd=Link&LinkName=pubmed_pubmed&IdsFromResult=37603076&ordinalpos=1&itool=EntrezSystem2.PEntrez.Pubmed.Pubmed_ResultsPanel.Pubmed_DiscoveryPanel.Pubmed_Discovery_RA&log$=relatedarticles&logdbfrom=pubmed'>Related, PubMed</a>","<a href='https://scholar.google.com/scholar?q=related:https://pmc.ncbi.nlm.nih.gov/articles/PMC10879458/'>Related, Google Scholar</a>","<a href='https://pubmed.ncbi.nlm.nih.gov/?linkname=pubmed_pubmed_citedin&from_uid=37603076'>Cited By, PMID</a>","<a href='https://scholar.google.com/scholar?hl=en&lr=&cites=https://pmc.ncbi.nlm.nih.gov/articles/PMC10879458/'>Cited By, Google</a>", ,37603076,2024,17456924,perspect psychol sci,,,,Perspect Psychol Sci,Unknown,,False,False,False,
K12HS026385,"Department of Dermatology, Feinberg School of Medicine at Northwestern University, Chicago, IL, USA.",2024,"Fakhraie, Sheiva; Chovatiya, Raj",United States,2162-5220,3,"<a href='https://pubmed.ncbi.nlm.nih.gov/37615603'>Dermatitis : contact, atopic, occupational, drug</a>",Dermatitis,35,eng,299-300, ,37615603,2024,Janus Kinase Inhibition in the Treatment of Prurigo Nodularis.,"<a href='https://pubmed.ncbi.nlm.nih.gov/?Db=pubmed&DbFrom=pubmed&Cmd=Link&LinkName=pubmed_pubmed&IdsFromResult=37615603&ordinalpos=1&itool=EntrezSystem2.PEntrez.Pubmed.Pubmed_ResultsPanel.Pubmed_DiscoveryPanel.Pubmed_Discovery_RA&log$=relatedarticles&logdbfrom=pubmed'>Related, PubMed</a>","<a href='https://scholar.google.com/scholar?hl=en&q=Janus Kinase Inhibition in the Treatment of Prurigo Nodularis.'>Related, Google Scholar</a>","<a href='https://pubmed.ncbi.nlm.nih.gov/?linkname=pubmed_pubmed_citedin&from_uid=37615603'>Cited By, PMID</a>", , ,37615603,2024,21625220,dermatitis,,,,Dermatitis,Unknown,,False,False,False,
R01DK125577,"Division of Nephrology and Hypertension, Northwestern University Feinberg School of Medicine, Chicago, Illinois.",2024,"Chung, Eunah; Deacon, Patrick; Hu, Yueh-Chiang; Lim, Hee-Woong; Park, Joo-Seop",United States,2692-8205, ,<a href='https://pubmed.ncbi.nlm.nih.gov/37645929'>bioRxiv : the preprint server for biology</a>,bioRxiv, ,eng, ,10461989,37645929,2024 May 05,<a href='https://www.ncbi.nlm.nih.gov/pmc/articles/10461989'>Hedgehog signaling is required for the maintenance of mesenchymal nephron progenitors.</a>,"<a href='https://pubmed.ncbi.nlm.nih.gov/?Db=pubmed&DbFrom=pubmed&Cmd=Link&LinkName=pubmed_pubmed&IdsFromResult=37645929&ordinalpos=1&itool=EntrezSystem2.PEntrez.Pubmed.Pubmed_ResultsPanel.Pubmed_DiscoveryPanel.Pubmed_Discovery_RA&log$=relatedarticles&logdbfrom=pubmed'>Related, PubMed</a>","<a href='https://scholar.google.com/scholar?q=related:https://pmc.ncbi.nlm.nih.gov/articles/PMC10461989/'>Related, Google Scholar</a>","<a href='https://pubmed.ncbi.nlm.nih.gov/?linkname=pubmed_pubmed_citedin&from_uid=37645929'>Cited By, PMID</a>","<a href='https://scholar.google.com/scholar?hl=en&lr=&cites=https://pmc.ncbi.nlm.nih.gov/articles/PMC10461989/'>Cited By, Google</a>", ,37645929,2024,26928205,biorxiv,,,,bioRxiv,Unknown,,False,False,False,
R01HL134800,"Molecular Biology and Biochemistry, Simon Fraser University, Vancouver, British Columbia, Canada. everheye@sfu.ca.",2024,"Verheyen, Esther M; Gottardi, Cara J",England,1471-0080,8,<a href='https://pubmed.ncbi.nlm.nih.gov/38760457'>Nature reviews. Molecular cell biology</a>,Nat Rev Mol Cell Biol,25,eng,597, ,38760457,2024 Aug,Solving the Wnt nuclear puzzle.,"<a href='https://pubmed.ncbi.nlm.nih.gov/?Db=pubmed&DbFrom=pubmed&Cmd=Link&LinkName=pubmed_pubmed&IdsFromResult=38760457&ordinalpos=1&itool=EntrezSystem2.PEntrez.Pubmed.Pubmed_ResultsPanel.Pubmed_DiscoveryPanel.Pubmed_Discovery_RA&log$=relatedarticles&logdbfrom=pubmed'>Related, PubMed</a>","<a href='https://scholar.google.com/scholar?hl=en&q=Solving the Wnt nuclear puzzle.'>Related, Google Scholar</a>","<a href='https://pubmed.ncbi.nlm.nih.gov/?linkname=pubmed_pubmed_citedin&from_uid=38760457'>Cited By, PMID</a>", , ,38760457,2024,14710080,nat rev mol cell biol,,,,Nat Rev Mol Cell Biol,Unknown,,False,False,False,
K23HL169815,"Department of Medicine, Northwestern University Feinberg School of Medicine, Chicago, IL.",2024,"Grudzinski, Kevin M; Fenske, Samuel; Peltekian, Alec; Markov, Nikolay S; Pawlowski, Anna; Kang, Mengjia; Walter, James M; Pickens, Chiagozie I; Nadig, Nandita R; Agrawal, Ankit; Singer, Benjamin D; Wunderink, Richard G; Gao, Catherine A",United States, , ,<a href='https://pubmed.ncbi.nlm.nih.gov/38766045'>medRxiv : the preprint server for health sciences</a>,medRxiv, ,eng, ,11100846,38766045,2024 Nov 04,<a href='https://www.ncbi.nlm.nih.gov/pmc/articles/11100846'>Neutrophil percentages in bronchoalveolar lavage fluid: Implications for diagnosing bacterial pneumonia in patients with immunocompromise and neutropenia.</a>,"<a href='https://pubmed.ncbi.nlm.nih.gov/?Db=pubmed&DbFrom=pubmed&Cmd=Link&LinkName=pubmed_pubmed&IdsFromResult=38766045&ordinalpos=1&itool=EntrezSystem2.PEntrez.Pubmed.Pubmed_ResultsPanel.Pubmed_DiscoveryPanel.Pubmed_Discovery_RA&log$=relatedarticles&logdbfrom=pubmed'>Related, PubMed</a>","<a href='https://scholar.google.com/scholar?q=related:https://pmc.ncbi.nlm.nih.gov/articles/PMC11100846/'>Related, Google Scholar</a>","<a href='https://pubmed.ncbi.nlm.nih.gov/?linkname=pubmed_pubmed_citedin&from_uid=38766045'>Cited By, PMID</a>","<a href='https://scholar.google.com/scholar?hl=en&lr=&cites=https://pmc.ncbi.nlm.nih.gov/articles/PMC11100846/'>Cited By, Google</a>", ,38766045,2024,,medrxiv,,,,medRxiv,Unknown,,False,False,False,
T32CA193193,Tulane University.,2024,"Peyser, Tristen; Perry, Laura M; Mossman, Brenna; Xu, Kenneth; Kim, Seowoo; Moran, James B; Hoerger, Michael",United States,2693-5015, ,<a href='https://pubmed.ncbi.nlm.nih.gov/38766124'>Research square</a>,Res Sq, ,eng, ,11100910,38766124,2024 May 07,<a href='https://www.ncbi.nlm.nih.gov/pmc/articles/11100910'>Personality and Self-efficacy for Illness Management in Cancer.</a>,"<a href='https://pubmed.ncbi.nlm.nih.gov/?Db=pubmed&DbFrom=pubmed&Cmd=Link&LinkName=pubmed_pubmed&IdsFromResult=38766124&ordinalpos=1&itool=EntrezSystem2.PEntrez.Pubmed.Pubmed_ResultsPanel.Pubmed_DiscoveryPanel.Pubmed_Discovery_RA&log$=relatedarticles&logdbfrom=pubmed'>Related, PubMed</a>","<a href='https://scholar.google.com/scholar?q=related:https://pmc.ncbi.nlm.nih.gov/articles/PMC11100910/'>Related, Google Scholar</a>","<a href='https://pubmed.ncbi.nlm.nih.gov/?linkname=pubmed_pubmed_citedin&from_uid=38766124'>Cited By, PMID</a>","<a href='https://scholar.google.com/scholar?hl=en&lr=&cites=https://pmc.ncbi.nlm.nih.gov/articles/PMC11100910/'>Cited By, Google</a>", ,38766124,2024,26935015,res sq,,,,Res Sq,Unknown,,False,False,False,
UL1TR001422,"Department of Surgery, Division of Urology, Endeavor Health (Formerly NorthShore University HealthSystem), Evanston, IL, USA.",2024,"Glaser, Alexander P; Smith, Abigail R; Maglaque, Dacey; Helfand, Brian T; Mohamed, Rowida; An, Hosanna; Marquez, Melissa; Talaty, Pooja; Carolan, Padraig; Geller, Aaron M; Farina, Francesca R; Jensen, Sally E; Griffith, James W",England,1471-2490,1,<a href='https://pubmed.ncbi.nlm.nih.gov/38773430'>BMC urology</a>,BMC Urol,24,eng,110,11107033,38773430,2024 May 21,<a href='https://www.ncbi.nlm.nih.gov/pmc/articles/11107033'>Enhanced clinical decisions for management of benign prostatic hyperplasia using patient-reported outcomes: protocol for a prospective observational study.</a>,"<a href='https://pubmed.ncbi.nlm.nih.gov/?Db=pubmed&DbFrom=pubmed&Cmd=Link&LinkName=pubmed_pubmed&IdsFromResult=38773430&ordinalpos=1&itool=EntrezSystem2.PEntrez.Pubmed.Pubmed_ResultsPanel.Pubmed_DiscoveryPanel.Pubmed_Discovery_RA&log$=relatedarticles&logdbfrom=pubmed'>Related, PubMed</a>","<a href='https://scholar.google.com/scholar?q=related:https://pmc.ncbi.nlm.nih.gov/articles/PMC11107033/'>Related, Google Scholar</a>","<a href='https://pubmed.ncbi.nlm.nih.gov/?linkname=pubmed_pubmed_citedin&from_uid=38773430'>Cited By, PMID</a>","<a href='https://scholar.google.com/scholar?hl=en&lr=&cites=https://pmc.ncbi.nlm.nih.gov/articles/PMC11107033/'>Cited By, Google</a>", ,38773430,2024,14712490,bmc urol,,,,BMC Urol,Unknown,,False,False,False,
R01HD105752,"Department of Anatomy, Biochemistry & Physiology, Institute for Biogenesis Research, John A. Burns School of Medicine, University of Hawaii at Manoa, Honolulu, HI, USA.",2024,"Wu, Hongwen; Nguyen, Hieu; Hashim, Prianka H; Fogelgren, Ben; Duncan, Francesca E; Ward, W Steven",England,1460-2407,8,<a href='https://pubmed.ncbi.nlm.nih.gov/39037927'>Molecular human reproduction</a>,Mol Hum Reprod,30,eng, ,11299862,39037927,2024 Aug 05,<a href='https://www.ncbi.nlm.nih.gov/pmc/articles/11299862'>Oocyte-specific EXOC5 expression is required for mouse oogenesis and folliculogenesis.</a>,"<a href='https://pubmed.ncbi.nlm.nih.gov/?Db=pubmed&DbFrom=pubmed&Cmd=Link&LinkName=pubmed_pubmed&IdsFromResult=39037927&ordinalpos=1&itool=EntrezSystem2.PEntrez.Pubmed.Pubmed_ResultsPanel.Pubmed_DiscoveryPanel.Pubmed_Discovery_RA&log$=relatedarticles&logdbfrom=pubmed'>Related, PubMed</a>","<a href='https://scholar.google.com/scholar?q=related:https://pmc.ncbi.nlm.nih.gov/articles/PMC11299862/'>Related, Google Scholar</a>","<a href='https://pubmed.ncbi.nlm.nih.gov/?linkname=pubmed_pubmed_citedin&from_uid=39037927'>Cited By, PMID</a>","<a href='https://scholar.google.com/scholar?hl=en&lr=&cites=https://pmc.ncbi.nlm.nih.gov/articles/PMC11299862/'>Cited By, Google</a>", ,39037927,2024,14602407,mol hum reprod,,,,Mol Hum Reprod,Unknown,,False,False,False,
D43TW010946,Africa Academy for Public Health (AAPH).,2024,"Yusufu, Innocent; Nagu, Tumaini; Ottaru, Theresia A; Sando, Mary Mmwanyika; Kaaya, Sylvia; Mbugi, Erasto; Hirschhorn, Lisa R; Hawkins, Claudia",United States,2693-5015, ,<a href='https://pubmed.ncbi.nlm.nih.gov/38798337'>Research square</a>,Res Sq, ,eng, ,11118687,38798337,2024 May 15,"<a href='https://www.ncbi.nlm.nih.gov/pmc/articles/11118687'>The prevalence of metabolic syndrome and associated factors among adults on antiretroviral therapy in Dar es Salaam, Tanzania.</a>","<a href='https://pubmed.ncbi.nlm.nih.gov/?Db=pubmed&DbFrom=pubmed&Cmd=Link&LinkName=pubmed_pubmed&IdsFromResult=38798337&ordinalpos=1&itool=EntrezSystem2.PEntrez.Pubmed.Pubmed_ResultsPanel.Pubmed_DiscoveryPanel.Pubmed_Discovery_RA&log$=relatedarticles&logdbfrom=pubmed'>Related, PubMed</a>","<a href='https://scholar.google.com/scholar?q=related:https://pmc.ncbi.nlm.nih.gov/articles/PMC11118687/'>Related, Google Scholar</a>","<a href='https://pubmed.ncbi.nlm.nih.gov/?linkname=pubmed_pubmed_citedin&from_uid=38798337'>Cited By, PMID</a>","<a href='https://scholar.google.com/scholar?hl=en&lr=&cites=https://pmc.ncbi.nlm.nih.gov/articles/PMC11118687/'>Cited By, Google</a>", ,38798337,2024,26935015,res sq,,,,Res Sq,Unknown,,False,False,False,
R01HL153122,"Division of Pulmonary and Critical Care Medicine, Northwestern University Feinberg School of Medicine, Chicago, IL 60611 USA.",2024,"Mambetsariev, Nurbek; Torres Acosta, Manuel A; Liu, Qianli; Flores, Carla P Reyes; Joudi, Anthony M; Helmin, Kathryn A; Gurkan, Jonathan K; Steinert, Elizabeth M; Morales-Nebreda, Luisa; Singer, Benjamin D",United States,2692-8205, ,<a href='https://pubmed.ncbi.nlm.nih.gov/38853959'>bioRxiv : the preprint server for biology</a>,bioRxiv, ,eng, ,11160713,38853959,2024 Jun 02,<a href='https://www.ncbi.nlm.nih.gov/pmc/articles/11160713'>FOXP3+ Regulatory T Cells Require TBET to Regulate Activated CD8+ T Cells During Recovery from Influenza Infection.</a>,"<a href='https://pubmed.ncbi.nlm.nih.gov/?Db=pubmed&DbFrom=pubmed&Cmd=Link&LinkName=pubmed_pubmed&IdsFromResult=38853959&ordinalpos=1&itool=EntrezSystem2.PEntrez.Pubmed.Pubmed_ResultsPanel.Pubmed_DiscoveryPanel.Pubmed_Discovery_RA&log$=relatedarticles&logdbfrom=pubmed'>Related, PubMed</a>","<a href='https://scholar.google.com/scholar?q=related:https://pmc.ncbi.nlm.nih.gov/articles/PMC11160713/'>Related, Google Scholar</a>","<a href='https://pubmed.ncbi.nlm.nih.gov/?linkname=pubmed_pubmed_citedin&from_uid=38853959'>Cited By, PMID</a>","<a href='https://scholar.google.com/scholar?hl=en&lr=&cites=https://pmc.ncbi.nlm.nih.gov/articles/PMC11160713/'>Cited By, Google</a>", ,38853959,2024,26928205,biorxiv,,,,bioRxiv,Unknown,,False,False,False,
R01AG018436,Washington University in St. Louis.,2024,"Willroth, Emily C; Pfund, Gabrielle N; Mroczek, Daniel K; Hill, Patrick L",England,0890-2070,3,<a href='https://pubmed.ncbi.nlm.nih.gov/38863836'>European journal of personality</a>,Eur J Pers,38,eng,405-425,11164556,38863836,2024,"<a href='https://www.ncbi.nlm.nih.gov/pmc/articles/11164556'>Perceptions of a good life: Associations with culture, age, wellbeing, and health.</a>","<a href='https://pubmed.ncbi.nlm.nih.gov/?Db=pubmed&DbFrom=pubmed&Cmd=Link&LinkName=pubmed_pubmed&IdsFromResult=38863836&ordinalpos=1&itool=EntrezSystem2.PEntrez.Pubmed.Pubmed_ResultsPanel.Pubmed_DiscoveryPanel.Pubmed_Discovery_RA&log$=relatedarticles&logdbfrom=pubmed'>Related, PubMed</a>","<a href='https://scholar.google.com/scholar?q=related:https://pmc.ncbi.nlm.nih.gov/articles/PMC11164556/'>Related, Google Scholar</a>","<a href='https://pubmed.ncbi.nlm.nih.gov/?linkname=pubmed_pubmed_citedin&from_uid=38863836'>Cited By, PMID</a>","<a href='https://scholar.google.com/scholar?hl=en&lr=&cites=https://pmc.ncbi.nlm.nih.gov/articles/PMC11164556/'>Cited By, Google</a>", ,38863836,2024,08902070,eur j pers,,,,Eur J Pers,Unknown,,False,False,False,
R01CA241532,"Department of Radiological Sciences, University of California Irvine, Irvine, CA, USA.",2024,"Zhang, Zigeng; Yu, Guangbo; Eresen, Aydin; Chen, Zhilin; Yu, Zeyang; Yaghmai, Vahid; Zhang, Zhuoli",China,2305-5839,4,<a href='https://pubmed.ncbi.nlm.nih.gov/39118942'>Annals of translational medicine</a>,Ann Transl Med,12,eng,77,11304422,39118942,2024 Aug 01,<a href='https://www.ncbi.nlm.nih.gov/pmc/articles/11304422'>Dendritic cell vaccination combined with irreversible electroporation for treating pancreatic cancer-a narrative review.</a>,"<a href='https://pubmed.ncbi.nlm.nih.gov/?Db=pubmed&DbFrom=pubmed&Cmd=Link&LinkName=pubmed_pubmed&IdsFromResult=39118942&ordinalpos=1&itool=EntrezSystem2.PEntrez.Pubmed.Pubmed_ResultsPanel.Pubmed_DiscoveryPanel.Pubmed_Discovery_RA&log$=relatedarticles&logdbfrom=pubmed'>Related, PubMed</a>","<a href='https://scholar.google.com/scholar?q=related:https://pmc.ncbi.nlm.nih.gov/articles/PMC11304422/'>Related, Google Scholar</a>","<a href='https://pubmed.ncbi.nlm.nih.gov/?linkname=pubmed_pubmed_citedin&from_uid=39118942'>Cited By, PMID</a>","<a href='https://scholar.google.com/scholar?hl=en&lr=&cites=https://pmc.ncbi.nlm.nih.gov/articles/PMC11304422/'>Cited By, Google</a>", ,39118942,2024,23055839,ann transl med,,,,Ann Transl Med,Unknown,,False,False,False,
T32HD094699,"Department of Molecular Biosciences, Northwestern University, Evanston, IL 60208.",2024,"Narula, Juhi G; Wignall, Sarah M",United States,2692-8205, ,<a href='https://pubmed.ncbi.nlm.nih.gov/39131294'>bioRxiv : the preprint server for biology</a>,bioRxiv, ,eng, ,11312516,39131294,2024 Aug 04,<a href='https://www.ncbi.nlm.nih.gov/pmc/articles/11312516'>Polo-like kinase 1 prevents excess microtubule polymerization in C. elegans oocytes to ensure faithful meiosis.</a>,"<a href='https://pubmed.ncbi.nlm.nih.gov/?Db=pubmed&DbFrom=pubmed&Cmd=Link&LinkName=pubmed_pubmed&IdsFromResult=39131294&ordinalpos=1&itool=EntrezSystem2.PEntrez.Pubmed.Pubmed_ResultsPanel.Pubmed_DiscoveryPanel.Pubmed_Discovery_RA&log$=relatedarticles&logdbfrom=pubmed'>Related, PubMed</a>","<a href='https://scholar.google.com/scholar?q=related:https://pmc.ncbi.nlm.nih.gov/articles/PMC11312516/'>Related, Google Scholar</a>","<a href='https://pubmed.ncbi.nlm.nih.gov/?linkname=pubmed_pubmed_citedin&from_uid=39131294'>Cited By, PMID</a>","<a href='https://scholar.google.com/scholar?hl=en&lr=&cites=https://pmc.ncbi.nlm.nih.gov/articles/PMC11312516/'>Cited By, Google</a>", ,39131294,2024,26928205,biorxiv,,,,bioRxiv,Unknown,,False,False,False,
U01MD011281,"Feinberg School of Medicine, Northwestern University, Chicago, Illinois.",2024,"Gordon, Jacob; Wongsomboon, Val; Alvarado Avila, Andrés; Lorenzo, Julianna; Mustanski, Brian; Macapagal, Kathryn",United States,1943-2755,1,<a href='https://pubmed.ncbi.nlm.nih.gov/38349349'>AIDS education and prevention : official publication of the International Society for AIDS Education</a>,AIDS Educ Prev,36,eng,15-Jan,11376320,38349349,2024 Feb,<a href='https://www.ncbi.nlm.nih.gov/pmc/articles/11376320'>Experiences of Successful PrEP Uptake Among Adolescent Sexual Minority Men in the United States: A Qualitative Exploration.</a>,"<a href='https://pubmed.ncbi.nlm.nih.gov/?Db=pubmed&DbFrom=pubmed&Cmd=Link&LinkName=pubmed_pubmed&IdsFromResult=38349349&ordinalpos=1&itool=EntrezSystem2.PEntrez.Pubmed.Pubmed_ResultsPanel.Pubmed_DiscoveryPanel.Pubmed_Discovery_RA&log$=relatedarticles&logdbfrom=pubmed'>Related, PubMed</a>","<a href='https://scholar.google.com/scholar?q=related:https://pmc.ncbi.nlm.nih.gov/articles/PMC11376320/'>Related, Google Scholar</a>","<a href='https://pubmed.ncbi.nlm.nih.gov/?linkname=pubmed_pubmed_citedin&from_uid=38349349'>Cited By, PMID</a>","<a href='https://scholar.google.com/scholar?hl=en&lr=&cites=https://pmc.ncbi.nlm.nih.gov/articles/PMC11376320/'>Cited By, Google</a>", ,38349349,2024,19432755,aids educ prev,,,,AIDS Educ Prev,Unknown,,False,False,False,
R21DC015880,"Department of Radiology, Northwestern University, Chicago, IL, USA.",2024,"Leaver, Amber M",United States, , ,<a href='https://pubmed.ncbi.nlm.nih.gov/38352362'>medRxiv : the preprint server for health sciences</a>,medRxiv, ,eng, ,10863023,38352362,2024 Feb 01,<a href='https://www.ncbi.nlm.nih.gov/pmc/articles/10863023'>Perceptual and cognitive effects of focal tDCS of auditory cortex in tinnitus.</a>,"<a href='https://pubmed.ncbi.nlm.nih.gov/?Db=pubmed&DbFrom=pubmed&Cmd=Link&LinkName=pubmed_pubmed&IdsFromResult=38352362&ordinalpos=1&itool=EntrezSystem2.PEntrez.Pubmed.Pubmed_ResultsPanel.Pubmed_DiscoveryPanel.Pubmed_Discovery_RA&log$=relatedarticles&logdbfrom=pubmed'>Related, PubMed</a>","<a href='https://scholar.google.com/scholar?q=related:https://pmc.ncbi.nlm.nih.gov/articles/PMC10863023/'>Related, Google Scholar</a>","<a href='https://pubmed.ncbi.nlm.nih.gov/?linkname=pubmed_pubmed_citedin&from_uid=38352362'>Cited By, PMID</a>","<a href='https://scholar.google.com/scholar?hl=en&lr=&cites=https://pmc.ncbi.nlm.nih.gov/articles/PMC10863023/'>Cited By, Google</a>", ,38352362,2024,,medrxiv,,,,medRxiv,Unknown,,False,False,False,
OT2OD026557,"Mary S. Easton Center for Alzheimer's Research and Care, Department of Neurology, David Geffen School of Medicine, University of California, Los Angeles, CA 90095, USA.",2024,"Fu, Mingzhou; Tran, Thai; Eskin, Eleazar; Lajonchere, Clara; Pasaniuc, Bogdan; Geschwind, Daniel H; Vossel, Keith; Chang, Timothy S",United States, , ,<a href='https://pubmed.ncbi.nlm.nih.gov/38370677'>medRxiv : the preprint server for health sciences</a>,medRxiv, ,eng, ,10871371,38370677,2024 Feb 06,<a href='https://www.ncbi.nlm.nih.gov/pmc/articles/10871371'>Multi-class Modeling Identifies Shared Genetic Risk for Late-onset Epilepsy and Alzheimer's Disease.</a>,"<a href='https://pubmed.ncbi.nlm.nih.gov/?Db=pubmed&DbFrom=pubmed&Cmd=Link&LinkName=pubmed_pubmed&IdsFromResult=38370677&ordinalpos=1&itool=EntrezSystem2.PEntrez.Pubmed.Pubmed_ResultsPanel.Pubmed_DiscoveryPanel.Pubmed_Discovery_RA&log$=relatedarticles&logdbfrom=pubmed'>Related, PubMed</a>","<a href='https://scholar.google.com/scholar?q=related:https://pmc.ncbi.nlm.nih.gov/articles/PMC10871371/'>Related, Google Scholar</a>","<a href='https://pubmed.ncbi.nlm.nih.gov/?linkname=pubmed_pubmed_citedin&from_uid=38370677'>Cited By, PMID</a>","<a href='https://scholar.google.com/scholar?hl=en&lr=&cites=https://pmc.ncbi.nlm.nih.gov/articles/PMC10871371/'>Cited By, Google</a>", ,38370677,2024,,medrxiv,,,,medRxiv,Unknown,,False,False,False,
K08NS118107,"F.M. Kirby Neurobiology Center, Department of Neurology, Boston Children's Hospital, Boston, MA, USA.",2024,"LaCoursiere, Christopher Mark; Ullmann, Jeremy F P; Koh, Hyun Yong; Turner, Laura; Baker, Cristina M; Robens, Barbara; Shao, Wanqing; Rotenberg, Alexander; McGraw, Christopher M; Poduri, Annapurna",United States,2692-8205, ,<a href='https://pubmed.ncbi.nlm.nih.gov/38370728'>bioRxiv : the preprint server for biology</a>,bioRxiv, ,eng, ,10871320,38370728,2024 Feb 08,<a href='https://www.ncbi.nlm.nih.gov/pmc/articles/10871320'>Zebrafish models of candidate human epilepsy-associated genes provide evidence of hyperexcitability.</a>,"<a href='https://pubmed.ncbi.nlm.nih.gov/?Db=pubmed&DbFrom=pubmed&Cmd=Link&LinkName=pubmed_pubmed&IdsFromResult=38370728&ordinalpos=1&itool=EntrezSystem2.PEntrez.Pubmed.Pubmed_ResultsPanel.Pubmed_DiscoveryPanel.Pubmed_Discovery_RA&log$=relatedarticles&logdbfrom=pubmed'>Related, PubMed</a>","<a href='https://scholar.google.com/scholar?q=related:https://pmc.ncbi.nlm.nih.gov/articles/PMC10871320/'>Related, Google Scholar</a>","<a href='https://pubmed.ncbi.nlm.nih.gov/?linkname=pubmed_pubmed_citedin&from_uid=38370728'>Cited By, PMID</a>","<a href='https://scholar.google.com/scholar?hl=en&lr=&cites=https://pmc.ncbi.nlm.nih.gov/articles/PMC10871320/'>Cited By, Google</a>", ,38370728,2024,26928205,biorxiv,,,,bioRxiv,Unknown,,False,False,False,
