OT2OD026557,"Department of Biostatistics, Johns Hopkins Bloomberg School of Public Health, Baltimore, MD, USA.",2024,"Zhang, Jingning; Zhan, Jianan; Jin, Jin; Ma, Cheng; Zhao, Ruzhang; O'Connell, Jared; Jiang, Yunxuan; 23andMe Research Team; Koelsch, Bertram L; Zhang, Haoyu; Chatterjee, Nilanjan",United States, , ,<a href='https://pubmed.ncbi.nlm.nih.gov/36993331'>bioRxiv : the preprint server for biology</a>,bioRxiv, ,eng, ,10055041,36993331,2024 Apr 10,<a href='https://www.ncbi.nlm.nih.gov/pmc/articles/10055041'>An Ensemble Penalized Regression Method for Multi-ancestry Polygenic Risk Prediction.</a>,"<a href='https://pubmed.ncbi.nlm.nih.gov/?Db=pubmed&DbFrom=pubmed&Cmd=Link&LinkName=pubmed_pubmed&IdsFromResult=36993331&ordinalpos=1&itool=EntrezSystem2.PEntrez.Pubmed.Pubmed_ResultsPanel.Pubmed_DiscoveryPanel.Pubmed_Discovery_RA&log$=relatedarticles&logdbfrom=pubmed'>Related, PubMed</a>","<a href='https://scholar.google.com/scholar?q=related:https://pmc.ncbi.nlm.nih.gov/articles/PMC10055041/'>Related, Google Scholar</a>","<a href='https://pubmed.ncbi.nlm.nih.gov/?linkname=pubmed_pubmed_citedin&from_uid=36993331'>Cited By, PMID</a>","<a href='https://scholar.google.com/scholar?hl=en&lr=&cites=https://pmc.ncbi.nlm.nih.gov/articles/PMC10055041/'>Cited By, Google</a>", ,36993331,2024,,biorxiv,,,,bioRxiv,Unknown,,False,False,False,
R01DK095662,"Division of Gastroenterology and Hepatology, Department of Medicine and the Mucosal Inflammation Program, University of Colorado School of Medicine, Aurora, CO, USA.",2024,"Haque, Parsa S; Kapur, Neeraj; Barrett, Terrence A; Theiss, Arianne L",England,1759-5053,8,<a href='https://pubmed.ncbi.nlm.nih.gov/38740978'>Nature reviews. Gastroenterology & hepatology</a>,Nat Rev Gastroenterol Hepatol,21,eng,537-555,12036329,38740978,2024 Aug,<a href='https://www.ncbi.nlm.nih.gov/pmc/articles/12036329'>Mitochondrial function and gastrointestinal diseases.</a>,"<a href='https://pubmed.ncbi.nlm.nih.gov/?Db=pubmed&DbFrom=pubmed&Cmd=Link&LinkName=pubmed_pubmed&IdsFromResult=38740978&ordinalpos=1&itool=EntrezSystem2.PEntrez.Pubmed.Pubmed_ResultsPanel.Pubmed_DiscoveryPanel.Pubmed_Discovery_RA&log$=relatedarticles&logdbfrom=pubmed'>Related, PubMed</a>","<a href='https://scholar.google.com/scholar?q=related:https://pmc.ncbi.nlm.nih.gov/articles/PMC12036329/'>Related, Google Scholar</a>","<a href='https://pubmed.ncbi.nlm.nih.gov/?linkname=pubmed_pubmed_citedin&from_uid=38740978'>Cited By, PMID</a>","<a href='https://scholar.google.com/scholar?hl=en&lr=&cites=https://pmc.ncbi.nlm.nih.gov/articles/PMC12036329/'>Cited By, Google</a>",6.47,38740978,2024,17595053,nat rev gastroenterol hepatol,,,,Nat Rev Gastroenterol Hepatol,Unknown,,False,False,False,
R01AI150998,"Department of Microbial Pathogens & Immunity, Rush University Medical Center, Chicago, IL, USA.",2024,"Gambut, Stephanie; Hope, Thomas J; Mamede, João I",United States,1940-6029, ,"<a href='https://pubmed.ncbi.nlm.nih.gov/38743217'>Methods in molecular biology (Clifton, N.J.)</a>",Methods Mol Biol,2807,eng,14-Mar, ,38743217,2024,Infectious Virus Tracking by Fluorescent Live Cell Imaging in Primary Cells.,"<a href='https://pubmed.ncbi.nlm.nih.gov/?Db=pubmed&DbFrom=pubmed&Cmd=Link&LinkName=pubmed_pubmed&IdsFromResult=38743217&ordinalpos=1&itool=EntrezSystem2.PEntrez.Pubmed.Pubmed_ResultsPanel.Pubmed_DiscoveryPanel.Pubmed_Discovery_RA&log$=relatedarticles&logdbfrom=pubmed'>Related, PubMed</a>","<a href='https://scholar.google.com/scholar?hl=en&q=Infectious Virus Tracking by Fluorescent Live Cell Imaging in Primary Cells.'>Related, Google Scholar</a>","<a href='https://pubmed.ncbi.nlm.nih.gov/?linkname=pubmed_pubmed_citedin&from_uid=38743217'>Cited By, PMID</a>", , ,38743217,2024,19406029,methods mol biol,,,,Methods Mol Biol,Unknown,,False,False,False,
K01AG080070,"Physical Therapy and Human Movement Sciences, Feinberg School of Medicine, Northwestern University, Chicago, IL, USA.",2024,"Zvolanek, Kristina M; Moore, Jackson E; Jarvis, Kelly; Moum, Sarah J; Bright, Molly G",United States,2692-8205, ,<a href='https://pubmed.ncbi.nlm.nih.gov/38746187'>bioRxiv : the preprint server for biology</a>,bioRxiv, ,eng, ,11092525,38746187,2024 Oct 04,<a href='https://www.ncbi.nlm.nih.gov/pmc/articles/11092525'>Macrovascular blood flow and microvascular cerebrovascular reactivity are regionally coupled in adolescence.</a>,"<a href='https://pubmed.ncbi.nlm.nih.gov/?Db=pubmed&DbFrom=pubmed&Cmd=Link&LinkName=pubmed_pubmed&IdsFromResult=38746187&ordinalpos=1&itool=EntrezSystem2.PEntrez.Pubmed.Pubmed_ResultsPanel.Pubmed_DiscoveryPanel.Pubmed_Discovery_RA&log$=relatedarticles&logdbfrom=pubmed'>Related, PubMed</a>","<a href='https://scholar.google.com/scholar?q=related:https://pmc.ncbi.nlm.nih.gov/articles/PMC11092525/'>Related, Google Scholar</a>","<a href='https://pubmed.ncbi.nlm.nih.gov/?linkname=pubmed_pubmed_citedin&from_uid=38746187'>Cited By, PMID</a>","<a href='https://scholar.google.com/scholar?hl=en&lr=&cites=https://pmc.ncbi.nlm.nih.gov/articles/PMC11092525/'>Cited By, Google</a>", ,38746187,2024,26928205,biorxiv,,,,bioRxiv,Unknown,,False,False,False,
P30CA060553,"Department of Biomedical Engineering, Northwestern University, Evanston, IL 60208, USA.",2024,"Du, Fanfan; Yuk, Simseok A; Qian, Yuan; Vincent, Michael P; Bobbala, Sharan; Abbott, Tirzah M; Kim, Hyeohn; Li, Yang; Li, Haoyu; Yi, Sijia; Qiao, Baofu; Scott, Evan A",United States,2693-5015, ,<a href='https://pubmed.ncbi.nlm.nih.gov/38746232'>Research square</a>,Res Sq, ,eng, ,11092859,38746232,2024 Apr 25,<a href='https://www.ncbi.nlm.nih.gov/pmc/articles/11092859'>A Biomimetic Multi-Component Subunit Vaccine via Ratiometric Loading of Hierarchical Hydrogels.</a>,"<a href='https://pubmed.ncbi.nlm.nih.gov/?Db=pubmed&DbFrom=pubmed&Cmd=Link&LinkName=pubmed_pubmed&IdsFromResult=38746232&ordinalpos=1&itool=EntrezSystem2.PEntrez.Pubmed.Pubmed_ResultsPanel.Pubmed_DiscoveryPanel.Pubmed_Discovery_RA&log$=relatedarticles&logdbfrom=pubmed'>Related, PubMed</a>","<a href='https://scholar.google.com/scholar?q=related:https://pmc.ncbi.nlm.nih.gov/articles/PMC11092859/'>Related, Google Scholar</a>","<a href='https://pubmed.ncbi.nlm.nih.gov/?linkname=pubmed_pubmed_citedin&from_uid=38746232'>Cited By, PMID</a>","<a href='https://scholar.google.com/scholar?hl=en&lr=&cites=https://pmc.ncbi.nlm.nih.gov/articles/PMC11092859/'>Cited By, Google</a>", ,38746232,2024,26935015,res sq,,,,Res Sq,Unknown,,False,False,False,
UL1TR001422,New York University Grossman School of Medicine.,2024,"Mandel, Hannah; Yoo, Yun; Allen, Andrea; Abedian, Sajjad; Verzani, Zoe; Karlson, Elizabeth; Kleinman, Lawrence; Mudumbi, Praveen; Oliveira, Carlos; Muszynski, Jennifer; Gross, Rachel; Carton, Thomas; Kim, C; Taylor, Emily; Park, Heekyong; Divers, Jasmin; Kelly, J; Arnold, Jonathan; Geary, Carol; Zang, Chengxi; Tantisira, Kelan; Rhee, Kyung; Koropsak, Michael; Mohandas, Sindhu; Vasey, Andrew; Weiner, Mark; Mosa, Abu; Haendel, Melissa; Chute, Christopher; Murphy, Shawn; O'Brien, Lisa; Szmuszkovicz, Jacqueline; Güthe, Nicholas; Santana, Jorge; De, Aliva; Bogie, Amanda; Halabi, Katia; Mohanraj, Lathika; Kinser, Patricia; Packard, Samuel; Tuttle, Katherine; Thorpe, Lorna; Moffitt, Richard",United States,2693-5015, ,<a href='https://pubmed.ncbi.nlm.nih.gov/38746290'>Research square</a>,Res Sq, ,eng, ,11092818,38746290,2024 Apr 26,<a href='https://www.ncbi.nlm.nih.gov/pmc/articles/11092818'>Long COVID incidence in adults and children between 2020 and 2023: a real-world data study from the RECOVER Initiative.</a>,"<a href='https://pubmed.ncbi.nlm.nih.gov/?Db=pubmed&DbFrom=pubmed&Cmd=Link&LinkName=pubmed_pubmed&IdsFromResult=38746290&ordinalpos=1&itool=EntrezSystem2.PEntrez.Pubmed.Pubmed_ResultsPanel.Pubmed_DiscoveryPanel.Pubmed_Discovery_RA&log$=relatedarticles&logdbfrom=pubmed'>Related, PubMed</a>","<a href='https://scholar.google.com/scholar?q=related:https://pmc.ncbi.nlm.nih.gov/articles/PMC11092818/'>Related, Google Scholar</a>","<a href='https://pubmed.ncbi.nlm.nih.gov/?linkname=pubmed_pubmed_citedin&from_uid=38746290'>Cited By, PMID</a>","<a href='https://scholar.google.com/scholar?hl=en&lr=&cites=https://pmc.ncbi.nlm.nih.gov/articles/PMC11092818/'>Cited By, Google</a>", ,38746290,2024,26935015,res sq,,,,Res Sq,Unknown,,False,False,False,
UG1CA233320,Vanderbilt University Medical Center.,2024,"Mezzanotte-Sharpe, Jessica; ONeill, Anne; Mayer, Ingrid A; Arteaga, Carlos L; Yang, Ximing J; Wagner, Lynne I; Cella, David; Meropol, Neal J; Alpaugh, R Katherine; Saphner, Thomas J; Swaney, Robert E; Hoelzer, Karen L; Gradishar, William J; Abramson, Vandana G; Sundaram, P Kothai; Jilani, Shamim Z; Perez, Edith A; Lin, Nancy U; Jahanzeb, Mohammad; Wolff, Antonio C; Sledge, George W; Reid, Sonya A",United States,2693-5015, ,<a href='https://pubmed.ncbi.nlm.nih.gov/38746356'>Research square</a>,Res Sq, ,eng, ,11092826,38746356,2024 Apr 29,<a href='https://www.ncbi.nlm.nih.gov/pmc/articles/11092826'>A randomized phase III double-blind placebo-controlled trial of first line chemotherapy and trastuzumab with or without bevacizumab for patients with HER2/neu-positive metastatic breast cancer: a trial of the ECOG-ACRIN Cancer Research Group (E1105).</a>,"<a href='https://pubmed.ncbi.nlm.nih.gov/?Db=pubmed&DbFrom=pubmed&Cmd=Link&LinkName=pubmed_pubmed&IdsFromResult=38746356&ordinalpos=1&itool=EntrezSystem2.PEntrez.Pubmed.Pubmed_ResultsPanel.Pubmed_DiscoveryPanel.Pubmed_Discovery_RA&log$=relatedarticles&logdbfrom=pubmed'>Related, PubMed</a>","<a href='https://scholar.google.com/scholar?q=related:https://pmc.ncbi.nlm.nih.gov/articles/PMC11092826/'>Related, Google Scholar</a>","<a href='https://pubmed.ncbi.nlm.nih.gov/?linkname=pubmed_pubmed_citedin&from_uid=38746356'>Cited By, PMID</a>","<a href='https://scholar.google.com/scholar?hl=en&lr=&cites=https://pmc.ncbi.nlm.nih.gov/articles/PMC11092826/'>Cited By, Google</a>", ,38746356,2024,26935015,res sq,,,,Res Sq,Unknown,,False,False,False,
R21AI148033,"Department of Microbiology, Icahn School of Medicine at Mount Sinai, New York, NY 10029.",2024,"Stevens, Christian S; Carmichael, Jillian; Watkinson, Ruth; Kowdle, Shreyas; Reis, Rebecca A; Hamane, Kory; Jang, Jason; Park, Arnold; Pernet, Olivier; Khamaikawin, Wannisa; Hong, Patrick; Thibault, Patricia; Gowlikar, Aditya; An, Dong Sung; Lee, Benhur",United States,2692-8205, ,<a href='https://pubmed.ncbi.nlm.nih.gov/38746439'>bioRxiv : the preprint server for biology</a>,bioRxiv, ,eng, ,11092779,38746439,2024 May 05,<a href='https://www.ncbi.nlm.nih.gov/pmc/articles/11092779'>A temperature-sensitive and interferon-silent Sendai virus vector for CRISPR-Cas9 delivery and gene editing in primary human cells.</a>,"<a href='https://pubmed.ncbi.nlm.nih.gov/?Db=pubmed&DbFrom=pubmed&Cmd=Link&LinkName=pubmed_pubmed&IdsFromResult=38746439&ordinalpos=1&itool=EntrezSystem2.PEntrez.Pubmed.Pubmed_ResultsPanel.Pubmed_DiscoveryPanel.Pubmed_Discovery_RA&log$=relatedarticles&logdbfrom=pubmed'>Related, PubMed</a>","<a href='https://scholar.google.com/scholar?q=related:https://pmc.ncbi.nlm.nih.gov/articles/PMC11092779/'>Related, Google Scholar</a>","<a href='https://pubmed.ncbi.nlm.nih.gov/?linkname=pubmed_pubmed_citedin&from_uid=38746439'>Cited By, PMID</a>","<a href='https://scholar.google.com/scholar?hl=en&lr=&cites=https://pmc.ncbi.nlm.nih.gov/articles/PMC11092779/'>Cited By, Google</a>", ,38746439,2024,26928205,biorxiv,,,,bioRxiv,Unknown,,False,False,False,
UF1NS107697,"Department of Chemical and Biological Engineering, Northwestern University, Evanston, IL, USA.",2024,"Callisto, Alec; Strutz, Jonathan; Leeper, Kathleen; Kalhor, Reza; Church, George; Tyo, Keith E J; Bhan, Namita",United States,2692-8205, ,<a href='https://pubmed.ncbi.nlm.nih.gov/38765976'>bioRxiv : the preprint server for biology</a>,bioRxiv, ,eng, ,11100781,38765976,2024 Dec 09,<a href='https://www.ncbi.nlm.nih.gov/pmc/articles/11100781'>Post-translational digital data encoding into the genomes of mammalian cell populations.</a>,"<a href='https://pubmed.ncbi.nlm.nih.gov/?Db=pubmed&DbFrom=pubmed&Cmd=Link&LinkName=pubmed_pubmed&IdsFromResult=38765976&ordinalpos=1&itool=EntrezSystem2.PEntrez.Pubmed.Pubmed_ResultsPanel.Pubmed_DiscoveryPanel.Pubmed_Discovery_RA&log$=relatedarticles&logdbfrom=pubmed'>Related, PubMed</a>","<a href='https://scholar.google.com/scholar?q=related:https://pmc.ncbi.nlm.nih.gov/articles/PMC11100781/'>Related, Google Scholar</a>","<a href='https://pubmed.ncbi.nlm.nih.gov/?linkname=pubmed_pubmed_citedin&from_uid=38765976'>Cited By, PMID</a>","<a href='https://scholar.google.com/scholar?hl=en&lr=&cites=https://pmc.ncbi.nlm.nih.gov/articles/PMC11100781/'>Cited By, Google</a>", ,38765976,2024,26928205,biorxiv,,,,bioRxiv,Unknown,,False,False,False,
R25GM121231,"Department of Neurobiology, Northwestern University, Evanston, IL.",2024,"Contreras, E; Liang, C; Mahoney, H L; Javier, J L; Luce, M L; Labastida Medina, K; Bozza, T; Schmidt, T M",United States,2692-8205, ,<a href='https://pubmed.ncbi.nlm.nih.gov/38766000'>bioRxiv : the preprint server for biology</a>,bioRxiv, ,eng, ,11100754,38766000,2024 May 08,<a href='https://www.ncbi.nlm.nih.gov/pmc/articles/11100754'>Flp-recombinase mouse line for genetic manipulation of ipRGCs.</a>,"<a href='https://pubmed.ncbi.nlm.nih.gov/?Db=pubmed&DbFrom=pubmed&Cmd=Link&LinkName=pubmed_pubmed&IdsFromResult=38766000&ordinalpos=1&itool=EntrezSystem2.PEntrez.Pubmed.Pubmed_ResultsPanel.Pubmed_DiscoveryPanel.Pubmed_Discovery_RA&log$=relatedarticles&logdbfrom=pubmed'>Related, PubMed</a>","<a href='https://scholar.google.com/scholar?q=related:https://pmc.ncbi.nlm.nih.gov/articles/PMC11100754/'>Related, Google Scholar</a>","<a href='https://pubmed.ncbi.nlm.nih.gov/?linkname=pubmed_pubmed_citedin&from_uid=38766000'>Cited By, PMID</a>","<a href='https://scholar.google.com/scholar?hl=en&lr=&cites=https://pmc.ncbi.nlm.nih.gov/articles/PMC11100754/'>Cited By, Google</a>", ,38766000,2024,26928205,biorxiv,,,,bioRxiv,Unknown,,False,False,False,
TL1DK132769,"Department of Pharmacology, Feinberg School of Medicine, Northwestern University, Chicago, Illinois, USA.",2024,"Larmore, Megan; Palomero, Orhi Esarte; Kamat, Neha P; DeCaen, Paul G",United States,2692-8205, ,<a href='https://pubmed.ncbi.nlm.nih.gov/38766162'>bioRxiv : the preprint server for biology</a>,bioRxiv, ,eng, ,11100589,38766162,2024 Aug 10,<a href='https://www.ncbi.nlm.nih.gov/pmc/articles/11100589'>A synthetic method to assay polycystin channel biophysics.</a>,"<a href='https://pubmed.ncbi.nlm.nih.gov/?Db=pubmed&DbFrom=pubmed&Cmd=Link&LinkName=pubmed_pubmed&IdsFromResult=38766162&ordinalpos=1&itool=EntrezSystem2.PEntrez.Pubmed.Pubmed_ResultsPanel.Pubmed_DiscoveryPanel.Pubmed_Discovery_RA&log$=relatedarticles&logdbfrom=pubmed'>Related, PubMed</a>","<a href='https://scholar.google.com/scholar?q=related:https://pmc.ncbi.nlm.nih.gov/articles/PMC11100589/'>Related, Google Scholar</a>","<a href='https://pubmed.ncbi.nlm.nih.gov/?linkname=pubmed_pubmed_citedin&from_uid=38766162'>Cited By, PMID</a>","<a href='https://scholar.google.com/scholar?hl=en&lr=&cites=https://pmc.ncbi.nlm.nih.gov/articles/PMC11100589/'>Cited By, Google</a>", ,38766162,2024,26928205,biorxiv,,,,bioRxiv,Unknown,,False,False,False,
R01HL144708,"Johns Hopkins School of Nursing, Baltimore, MD, USA. oogungb3@jh.edu.",2024,"Ogungbe, Oluwabunmi; Abasilim, Chibuzor; Huffman, Mark D; Ojji, Dike; Hypertension Treatment in Nigeria Program Team",England,2397-0642,1,<a href='https://pubmed.ncbi.nlm.nih.gov/39010244'>Global health research and policy</a>,Glob Health Res Policy,9,eng,26,11247806,39010244,2024 Jul 15,<a href='https://www.ncbi.nlm.nih.gov/pmc/articles/11247806'>Improving hypertension control in Nigeria: early policy implications from the Hypertension Treatment in Nigeria program.</a>,"<a href='https://pubmed.ncbi.nlm.nih.gov/?Db=pubmed&DbFrom=pubmed&Cmd=Link&LinkName=pubmed_pubmed&IdsFromResult=39010244&ordinalpos=1&itool=EntrezSystem2.PEntrez.Pubmed.Pubmed_ResultsPanel.Pubmed_DiscoveryPanel.Pubmed_Discovery_RA&log$=relatedarticles&logdbfrom=pubmed'>Related, PubMed</a>","<a href='https://scholar.google.com/scholar?q=related:https://pmc.ncbi.nlm.nih.gov/articles/PMC11247806/'>Related, Google Scholar</a>","<a href='https://pubmed.ncbi.nlm.nih.gov/?linkname=pubmed_pubmed_citedin&from_uid=39010244'>Cited By, PMID</a>","<a href='https://scholar.google.com/scholar?hl=en&lr=&cites=https://pmc.ncbi.nlm.nih.gov/articles/PMC11247806/'>Cited By, Google</a>", ,39010244,2024,23970642,glob health res policy,,,,Glob Health Res Policy,Unknown,,False,False,False,
U01TR003528,"Department of Surgery, Northwestern University, Chicago, postcode, USA.",2024,"Kline, Adrienne; Luo, Yuan",United States,2693-5015, ,<a href='https://pubmed.ncbi.nlm.nih.gov/39011102'>Research square</a>,Res Sq, ,eng, ,11247932,39011102,2024 Jul 02,<a href='https://www.ncbi.nlm.nih.gov/pmc/articles/11247932'>IRTCI: Item Response Theory for Categorical Imputation.</a>,"<a href='https://pubmed.ncbi.nlm.nih.gov/?Db=pubmed&DbFrom=pubmed&Cmd=Link&LinkName=pubmed_pubmed&IdsFromResult=39011102&ordinalpos=1&itool=EntrezSystem2.PEntrez.Pubmed.Pubmed_ResultsPanel.Pubmed_DiscoveryPanel.Pubmed_Discovery_RA&log$=relatedarticles&logdbfrom=pubmed'>Related, PubMed</a>","<a href='https://scholar.google.com/scholar?q=related:https://pmc.ncbi.nlm.nih.gov/articles/PMC11247932/'>Related, Google Scholar</a>","<a href='https://pubmed.ncbi.nlm.nih.gov/?linkname=pubmed_pubmed_citedin&from_uid=39011102'>Cited By, PMID</a>","<a href='https://scholar.google.com/scholar?hl=en&lr=&cites=https://pmc.ncbi.nlm.nih.gov/articles/PMC11247932/'>Cited By, Google</a>", ,39011102,2024,26935015,res sq,,,,Res Sq,Unknown,,False,False,False,
U01DK126045,"Division of Public Health Sciences, Washington University in St. Louis School of Medicine, St. Louis, MO.",2024,"James, Aimee S; Nodora, Jesse; Maki, Julia; Harlow, Bernard L; Low, Lisa Kane; Coyne-Beasley, Tamera; Cunningham, Shayna D; El-Fahmawi, Ayah; Klusaritz, Heather; Lipman, Terri H; Simon, Melissa; Hebert-Beirne, Jeni",United States,1944-1207,2,<a href='https://pubmed.ncbi.nlm.nih.gov/39055611'>Journal of community engagement and scholarship</a>,J Community Engagem Scholarsh,16,eng, ,11271685,39055611,2024,<a href='https://www.ncbi.nlm.nih.gov/pmc/articles/11271685'>Building Community Engagement Capacity in a Transdisciplinary Population Health Research Consortium.</a>,"<a href='https://pubmed.ncbi.nlm.nih.gov/?Db=pubmed&DbFrom=pubmed&Cmd=Link&LinkName=pubmed_pubmed&IdsFromResult=39055611&ordinalpos=1&itool=EntrezSystem2.PEntrez.Pubmed.Pubmed_ResultsPanel.Pubmed_DiscoveryPanel.Pubmed_Discovery_RA&log$=relatedarticles&logdbfrom=pubmed'>Related, PubMed</a>","<a href='https://scholar.google.com/scholar?q=related:https://pmc.ncbi.nlm.nih.gov/articles/PMC11271685/'>Related, Google Scholar</a>","<a href='https://pubmed.ncbi.nlm.nih.gov/?linkname=pubmed_pubmed_citedin&from_uid=39055611'>Cited By, PMID</a>","<a href='https://scholar.google.com/scholar?hl=en&lr=&cites=https://pmc.ncbi.nlm.nih.gov/articles/PMC11271685/'>Cited By, Google</a>", ,39055611,2024,19441207,j community engagem scholarsh,,,,J Community Engagem Scholarsh,Unknown,,False,False,False,
F30EY034033, ,2024,"Fang, Raymond; Zhang, Pengpeng; Zhang, Tingwei; Kim, Daniel; Sun, Edison; Kuranov, Roman; Kweon, Junghun; Huang, Alex; Zhang, Hao F",United States,2692-8205, ,<a href='https://pubmed.ncbi.nlm.nih.gov/38826217'>bioRxiv : the preprint server for biology</a>,bioRxiv, ,eng, ,11142137,38826217,2024 May 23,<a href='https://www.ncbi.nlm.nih.gov/pmc/articles/11142137'>Freeform robotic optical coherence tomography beyond the optical field-of-view limit.</a>,"<a href='https://pubmed.ncbi.nlm.nih.gov/?Db=pubmed&DbFrom=pubmed&Cmd=Link&LinkName=pubmed_pubmed&IdsFromResult=38826217&ordinalpos=1&itool=EntrezSystem2.PEntrez.Pubmed.Pubmed_ResultsPanel.Pubmed_DiscoveryPanel.Pubmed_Discovery_RA&log$=relatedarticles&logdbfrom=pubmed'>Related, PubMed</a>","<a href='https://scholar.google.com/scholar?q=related:https://pmc.ncbi.nlm.nih.gov/articles/PMC11142137/'>Related, Google Scholar</a>","<a href='https://pubmed.ncbi.nlm.nih.gov/?linkname=pubmed_pubmed_citedin&from_uid=38826217'>Cited By, PMID</a>","<a href='https://scholar.google.com/scholar?hl=en&lr=&cites=https://pmc.ncbi.nlm.nih.gov/articles/PMC11142137/'>Cited By, Google</a>", ,38826217,2024,26928205,biorxiv,,,,bioRxiv,Unknown,,False,False,False,
U01HG008673,"Genomics and Computational Biology Group, University of Pennsylvania, Philadelphia, PA.",2024,"Moore, Anni; Ritchie, Marylyn D",United States,2153-4063, ,<a href='https://pubmed.ncbi.nlm.nih.gov/38827078'>AMIA Joint Summits on Translational Science proceedings. AMIA Joint Summits on Translational Science</a>,AMIA Jt Summits Transl Sci Proc,2024,eng,623-631,11141840,38827078,2024,<a href='https://www.ncbi.nlm.nih.gov/pmc/articles/11141840'>Cross-phenotype associations between Alzheimer's Disease and its comorbidities may provide clues to progression.</a>,"<a href='https://pubmed.ncbi.nlm.nih.gov/?Db=pubmed&DbFrom=pubmed&Cmd=Link&LinkName=pubmed_pubmed&IdsFromResult=38827078&ordinalpos=1&itool=EntrezSystem2.PEntrez.Pubmed.Pubmed_ResultsPanel.Pubmed_DiscoveryPanel.Pubmed_Discovery_RA&log$=relatedarticles&logdbfrom=pubmed'>Related, PubMed</a>","<a href='https://scholar.google.com/scholar?q=related:https://pmc.ncbi.nlm.nih.gov/articles/PMC11141840/'>Related, Google Scholar</a>","<a href='https://pubmed.ncbi.nlm.nih.gov/?linkname=pubmed_pubmed_citedin&from_uid=38827078'>Cited By, PMID</a>","<a href='https://scholar.google.com/scholar?hl=en&lr=&cites=https://pmc.ncbi.nlm.nih.gov/articles/PMC11141840/'>Cited By, Google</a>", ,38827078,2024,21534063,amia jt summits transl sci proc,,,,AMIA Jt Summits Transl Sci Proc,Unknown,,False,False,False,
P41GM108569,Northwestern University.,2024,"Parker, Benjamin; Weiss, Eric",United States,2692-8205, ,<a href='https://pubmed.ncbi.nlm.nih.gov/38853981'>bioRxiv : the preprint server for biology</a>,bioRxiv, ,eng, ,11160668,38853981,2024 May 29,"<a href='https://www.ncbi.nlm.nih.gov/pmc/articles/11160668'>LiF-MS+, a revised technique for mapping peptide-protein interactions.</a>","<a href='https://pubmed.ncbi.nlm.nih.gov/?Db=pubmed&DbFrom=pubmed&Cmd=Link&LinkName=pubmed_pubmed&IdsFromResult=38853981&ordinalpos=1&itool=EntrezSystem2.PEntrez.Pubmed.Pubmed_ResultsPanel.Pubmed_DiscoveryPanel.Pubmed_Discovery_RA&log$=relatedarticles&logdbfrom=pubmed'>Related, PubMed</a>","<a href='https://scholar.google.com/scholar?q=related:https://pmc.ncbi.nlm.nih.gov/articles/PMC11160668/'>Related, Google Scholar</a>","<a href='https://pubmed.ncbi.nlm.nih.gov/?linkname=pubmed_pubmed_citedin&from_uid=38853981'>Cited By, PMID</a>","<a href='https://scholar.google.com/scholar?hl=en&lr=&cites=https://pmc.ncbi.nlm.nih.gov/articles/PMC11160668/'>Cited By, Google</a>", ,38853981,2024,26928205,biorxiv,,,,bioRxiv,Unknown,,False,False,False,
R56HG012360,"Department of Biochemistry and Molecular Genetics, Feinberg School of Medicine, Northwestern University, Chicago, IL 60611.",2024,"Li, James Wenhan; Bandaru, Ravi; Liu, Yaping",United States,2692-8205, ,<a href='https://pubmed.ncbi.nlm.nih.gov/38854007'>bioRxiv : the preprint server for biology</a>,bioRxiv, ,eng, ,11160763,38854007,2024 Dec 31,<a href='https://www.ncbi.nlm.nih.gov/pmc/articles/11160763'>FinaleToolkit: Accelerating Cell-Free DNA Fragmentation Analysis with a High-Speed Computational Toolkit.</a>,"<a href='https://pubmed.ncbi.nlm.nih.gov/?Db=pubmed&DbFrom=pubmed&Cmd=Link&LinkName=pubmed_pubmed&IdsFromResult=38854007&ordinalpos=1&itool=EntrezSystem2.PEntrez.Pubmed.Pubmed_ResultsPanel.Pubmed_DiscoveryPanel.Pubmed_Discovery_RA&log$=relatedarticles&logdbfrom=pubmed'>Related, PubMed</a>","<a href='https://scholar.google.com/scholar?q=related:https://pmc.ncbi.nlm.nih.gov/articles/PMC11160763/'>Related, Google Scholar</a>","<a href='https://pubmed.ncbi.nlm.nih.gov/?linkname=pubmed_pubmed_citedin&from_uid=38854007'>Cited By, PMID</a>","<a href='https://scholar.google.com/scholar?hl=en&lr=&cites=https://pmc.ncbi.nlm.nih.gov/articles/PMC11160763/'>Cited By, Google</a>", ,38854007,2024,26928205,biorxiv,,,,bioRxiv,Unknown,,False,False,False,
T32EB031527,"UCL Centre for Nerve Engineering, University College London, London WC1N 1AX, UK; Department of Pharmacology, UCL School of Pharmacy, University College London, London WC1N 1AX, UK.",2024,"Trueman, Ryan P; Guillemot-Legris, Owein; Lancashire, Henry T; Mehta, Abijeet S; Tropp, Joshua; Daso, Rachel E; Rivnay, Jonathan; Tabor, Alethea B; Phillips, James B; Schroeder, Bob C",Germany,1438-1656,6,<a href='https://pubmed.ncbi.nlm.nih.gov/39100393'>Advanced engineering materials</a>,Adv Eng Mater,26,eng, ,11296654,39100393,2024 Mar,<a href='https://www.ncbi.nlm.nih.gov/pmc/articles/11296654'>Aligned Bioelectronic Polypyrrole/Collagen Constructs for Peripheral Nerve Interfacing.</a>,"<a href='https://pubmed.ncbi.nlm.nih.gov/?Db=pubmed&DbFrom=pubmed&Cmd=Link&LinkName=pubmed_pubmed&IdsFromResult=39100393&ordinalpos=1&itool=EntrezSystem2.PEntrez.Pubmed.Pubmed_ResultsPanel.Pubmed_DiscoveryPanel.Pubmed_Discovery_RA&log$=relatedarticles&logdbfrom=pubmed'>Related, PubMed</a>","<a href='https://scholar.google.com/scholar?q=related:https://pmc.ncbi.nlm.nih.gov/articles/PMC11296654/'>Related, Google Scholar</a>","<a href='https://pubmed.ncbi.nlm.nih.gov/?linkname=pubmed_pubmed_citedin&from_uid=39100393'>Cited By, PMID</a>","<a href='https://scholar.google.com/scholar?hl=en&lr=&cites=https://pmc.ncbi.nlm.nih.gov/articles/PMC11296654/'>Cited By, Google</a>",2.33,39100393,2024,14381656,adv eng mater,,,,Adv Eng Mater,Unknown,,False,False,False,
