K23RR016067,"Fred Hutchinson Cancer Center, Division of Public Health Sciences, Seattle, WA, 98109, USA.",2024,"Navarro, Sandi L; Pinto, Navin; Hawkins, Douglas S; Park, Julie R; Dilmaghani, Saam; Rimorin, Christine; Wurscher, Michelle; McCune, Jeannine S",Germany,1432-0843,4,<a href='https://pubmed.ncbi.nlm.nih.gov/39080017'>Cancer chemotherapy and pharmacology</a>,Cancer Chemother Pharmacol,94,eng,627-633,11438565,39080017,2024 Oct,Pharmacogenomic associations of cyclophosphamide pharmacokinetic candidate genes with 4hydroxycyclophosphamide formation in children with Cancer.,"<a href='https://pubmed.ncbi.nlm.nih.gov/?Db=pubmed&DbFrom=pubmed&Cmd=Link&LinkName=pubmed_pubmed&IdsFromResult=39080017&ordinalpos=1&itool=EntrezSystem2.PEntrez.Pubmed.Pubmed_ResultsPanel.Pubmed_DiscoveryPanel.Pubmed_Discovery_RA&log$=relatedarticles&logdbfrom=pubmed'>Related, PubMed</a>","<a href='https://scholar.google.com/scholar?q=related:https://pmc.ncbi.nlm.nih.gov/articles/PMC11438565/'>Related, Google Scholar</a>","<a href='https://pubmed.ncbi.nlm.nih.gov/?linkname=pubmed_pubmed_citedin&from_uid=39080017'>Cited By, PMID</a>","<a href='https://scholar.google.com/scholar?hl=en&lr=&cites=https://pmc.ncbi.nlm.nih.gov/articles/PMC11438565/'>Cited By, Google</a>", ,PMID(39080017) OR  ,2024,14320843,,,
T32EB031527,"UCL Centre for Nerve Engineering, University College London, London WC1N 1AX, UK; Department of Pharmacology, UCL School of Pharmacy, University College London, London WC1N 1AX, UK.",2024,"Trueman, Ryan P; Guillemot-Legris, Owein; Lancashire, Henry T; Mehta, Abijeet S; Tropp, Joshua; Daso, Rachel E; Rivnay, Jonathan; Tabor, Alethea B; Phillips, James B; Schroeder, Bob C",Germany,1438-1656,6,<a href='https://pubmed.ncbi.nlm.nih.gov/39100393'>Advanced engineering materials</a>,Adv Eng Mater,26,eng, ,11296654,39100393,2024 Mar,<a href='https://www.ncbi.nlm.nih.gov/pmc/articles/11296654'>Aligned Bioelectronic Polypyrrole/Collagen Constructs for Peripheral Nerve Interfacing.</a>,"<a href='https://pubmed.ncbi.nlm.nih.gov/?Db=pubmed&DbFrom=pubmed&Cmd=Link&LinkName=pubmed_pubmed&IdsFromResult=39100393&ordinalpos=1&itool=EntrezSystem2.PEntrez.Pubmed.Pubmed_ResultsPanel.Pubmed_DiscoveryPanel.Pubmed_Discovery_RA&log$=relatedarticles&logdbfrom=pubmed'>Related, PubMed</a>","<a href='https://scholar.google.com/scholar?q=related:https://pmc.ncbi.nlm.nih.gov/articles/PMC11296654/'>Related, Google Scholar</a>","<a href='https://pubmed.ncbi.nlm.nih.gov/?linkname=pubmed_pubmed_citedin&from_uid=39100393'>Cited By, PMID</a>","<a href='https://scholar.google.com/scholar?hl=en&lr=&cites=https://pmc.ncbi.nlm.nih.gov/articles/PMC11296654/'>Cited By, Google</a>",2.33,PMID(39100393) OR  ,2024,14381656,,,
R01NS084959,"Department of Pharmacology, Northwestern University Feinberg School of Medicine, 320 East Superior St., Searle 8-510, Chicago, IL, 60611, USA.",2024,"Hawkins, Nicole A; Speakes, Nathan; Kearney, Jennifer A",United States,1432-1777,3,<a href='https://pubmed.ncbi.nlm.nih.gov/38862622'>Mammalian genome : official journal of the International Mammalian Genome Society</a>,Mamm Genome,35,eng,334-345,11329421,38862622,2024 Sep,<a href='https://www.ncbi.nlm.nih.gov/pmc/articles/11329421'>Fine mapping and candidate gene analysis of Dravet syndrome modifier loci on mouse chromosomes 7 and 8.</a>,"<a href='https://pubmed.ncbi.nlm.nih.gov/?Db=pubmed&DbFrom=pubmed&Cmd=Link&LinkName=pubmed_pubmed&IdsFromResult=38862622&ordinalpos=1&itool=EntrezSystem2.PEntrez.Pubmed.Pubmed_ResultsPanel.Pubmed_DiscoveryPanel.Pubmed_Discovery_RA&log$=relatedarticles&logdbfrom=pubmed'>Related, PubMed</a>","<a href='https://scholar.google.com/scholar?q=related:https://pmc.ncbi.nlm.nih.gov/articles/PMC11329421/'>Related, Google Scholar</a>","<a href='https://pubmed.ncbi.nlm.nih.gov/?linkname=pubmed_pubmed_citedin&from_uid=38862622'>Cited By, PMID</a>","<a href='https://scholar.google.com/scholar?hl=en&lr=&cites=https://pmc.ncbi.nlm.nih.gov/articles/PMC11329421/'>Cited By, Google</a>", ,PMID(38862622) OR  ,2024,14321777,,,
R01AG018436,Washington University in St. Louis.,2024,"Willroth, Emily C; Pfund, Gabrielle N; Mroczek, Daniel K; Hill, Patrick L",England,0890-2070,3,<a href='https://pubmed.ncbi.nlm.nih.gov/38863836'>European journal of personality</a>,Eur J Pers,38,eng,405-425,11164556,38863836,2024,"<a href='https://www.ncbi.nlm.nih.gov/pmc/articles/11164556'>Perceptions of a good life: Associations with culture, age, wellbeing, and health.</a>","<a href='https://pubmed.ncbi.nlm.nih.gov/?Db=pubmed&DbFrom=pubmed&Cmd=Link&LinkName=pubmed_pubmed&IdsFromResult=38863836&ordinalpos=1&itool=EntrezSystem2.PEntrez.Pubmed.Pubmed_ResultsPanel.Pubmed_DiscoveryPanel.Pubmed_Discovery_RA&log$=relatedarticles&logdbfrom=pubmed'>Related, PubMed</a>","<a href='https://scholar.google.com/scholar?q=related:https://pmc.ncbi.nlm.nih.gov/articles/PMC11164556/'>Related, Google Scholar</a>","<a href='https://pubmed.ncbi.nlm.nih.gov/?linkname=pubmed_pubmed_citedin&from_uid=38863836'>Cited By, PMID</a>","<a href='https://scholar.google.com/scholar?hl=en&lr=&cites=https://pmc.ncbi.nlm.nih.gov/articles/PMC11164556/'>Cited By, Google</a>", ,PMID(38863836) OR  ,2024,08902070,,,
P50CA221747,"Department of Laboratory Medicine and Pathobiology, University of Toronto, Toronto, Canada.",2024,"Ghorbani, Atefeh; Chatanaka, Miyo K; Avery, Lisa M; Wang, Mingyue; Brown, Jermaine; Cohen, Rachel; Gorham, Taron; Misaghian, Salvia; Padmanabhan, Nikhil; Romero, Daniel; Stengelin, Martin; Mathew, Anu; Sigal, George; Wohlstadter, Jacob; Horbinski, Craig; McCortney, Katy; Xu, Wei; Zadeh, Gelareh; Mansouri, Alireza; Yousef, George M; Diamandis, Eleftherios P; Prassas, Ioannis",England,1542-6416,1,<a href='https://pubmed.ncbi.nlm.nih.gov/38879494'>Clinical proteomics</a>,Clin Proteomics,21,eng,41,11179213,38879494,2024 Jun 15,"<a href='https://www.ncbi.nlm.nih.gov/pmc/articles/11179213'>Glial fibrillary acidic protein, neurofilament light, matrix metalloprotease 3 and fatty acid binding protein 4 as non-invasive brain tumor biomarkers.</a>","<a href='https://pubmed.ncbi.nlm.nih.gov/?Db=pubmed&DbFrom=pubmed&Cmd=Link&LinkName=pubmed_pubmed&IdsFromResult=38879494&ordinalpos=1&itool=EntrezSystem2.PEntrez.Pubmed.Pubmed_ResultsPanel.Pubmed_DiscoveryPanel.Pubmed_Discovery_RA&log$=relatedarticles&logdbfrom=pubmed'>Related, PubMed</a>","<a href='https://scholar.google.com/scholar?q=related:https://pmc.ncbi.nlm.nih.gov/articles/PMC11179213/'>Related, Google Scholar</a>","<a href='https://pubmed.ncbi.nlm.nih.gov/?linkname=pubmed_pubmed_citedin&from_uid=38879494'>Cited By, PMID</a>","<a href='https://scholar.google.com/scholar?hl=en&lr=&cites=https://pmc.ncbi.nlm.nih.gov/articles/PMC11179213/'>Cited By, Google</a>", ,PMID(38879494) OR  ,2024,15426416,,,
K24AR080840,"Division of Rheumatology, Department of Medicine, Northwestern University Feinberg School of Medicine, 633 N. St. Clair Street, 18th Floor, Chicago, IL, 60611, USA. burcu.aydemir@northwestern.edu.",2024,"Aydemir, Burcu; Muhammad, Lutfiyya N; Song, Jing; Reid, Kathryn J; Grimaldi, Daniela; Isaacs, Ariel; Carns, Mary; Dennis-Aren, Kathleen; Dunlop, Dorothy D; Chang, Rowland W; Zee, Phyllis C; Lee, Yvonne C",England,2520-1026,1,<a href='https://pubmed.ncbi.nlm.nih.gov/39135142'>BMC rheumatology</a>,BMC Rheumatol,8,eng,33,11318281,39135142,2024 Aug 12,<a href='https://www.ncbi.nlm.nih.gov/pmc/articles/11318281'>Characterization of sleep disturbance in established rheumatoid arthritis patients: exploring the relationship with central nervous system pain regulation.</a>,"<a href='https://pubmed.ncbi.nlm.nih.gov/?Db=pubmed&DbFrom=pubmed&Cmd=Link&LinkName=pubmed_pubmed&IdsFromResult=39135142&ordinalpos=1&itool=EntrezSystem2.PEntrez.Pubmed.Pubmed_ResultsPanel.Pubmed_DiscoveryPanel.Pubmed_Discovery_RA&log$=relatedarticles&logdbfrom=pubmed'>Related, PubMed</a>","<a href='https://scholar.google.com/scholar?q=related:https://pmc.ncbi.nlm.nih.gov/articles/PMC11318281/'>Related, Google Scholar</a>","<a href='https://pubmed.ncbi.nlm.nih.gov/?linkname=pubmed_pubmed_citedin&from_uid=39135142'>Cited By, PMID</a>","<a href='https://scholar.google.com/scholar?hl=en&lr=&cites=https://pmc.ncbi.nlm.nih.gov/articles/PMC11318281/'>Cited By, Google</a>", ,PMID(39135142) OR  ,2024,25201026,,,
P30AR072579,"Division of Rheumatology, Department of Medicine, Northwestern University Feinberg School of Medicine, 633 N. St. Clair Street, 18th Floor, Chicago, IL, 60611, USA. burcu.aydemir@northwestern.edu.",2024,"Aydemir, Burcu; Muhammad, Lutfiyya N; Song, Jing; Reid, Kathryn J; Grimaldi, Daniela; Isaacs, Ariel; Carns, Mary; Dennis-Aren, Kathleen; Dunlop, Dorothy D; Chang, Rowland W; Zee, Phyllis C; Lee, Yvonne C",England,2520-1026,1,<a href='https://pubmed.ncbi.nlm.nih.gov/39135142'>BMC rheumatology</a>,BMC Rheumatol,8,eng,33,11318281,39135142,2024 Aug 12,<a href='https://www.ncbi.nlm.nih.gov/pmc/articles/11318281'>Characterization of sleep disturbance in established rheumatoid arthritis patients: exploring the relationship with central nervous system pain regulation.</a>,"<a href='https://pubmed.ncbi.nlm.nih.gov/?Db=pubmed&DbFrom=pubmed&Cmd=Link&LinkName=pubmed_pubmed&IdsFromResult=39135142&ordinalpos=1&itool=EntrezSystem2.PEntrez.Pubmed.Pubmed_ResultsPanel.Pubmed_DiscoveryPanel.Pubmed_Discovery_RA&log$=relatedarticles&logdbfrom=pubmed'>Related, PubMed</a>","<a href='https://scholar.google.com/scholar?q=related:https://pmc.ncbi.nlm.nih.gov/articles/PMC11318281/'>Related, Google Scholar</a>","<a href='https://pubmed.ncbi.nlm.nih.gov/?linkname=pubmed_pubmed_citedin&from_uid=39135142'>Cited By, PMID</a>","<a href='https://scholar.google.com/scholar?hl=en&lr=&cites=https://pmc.ncbi.nlm.nih.gov/articles/PMC11318281/'>Cited By, Google</a>", ,PMID(39135142) OR  ,2024,25201026,,,
R01NS127204,"Department of Cell Biology and Physiology, University of North Carolina at Chapel Hill.",2024,"Phillips, Cassandra L; Faridounnia, Maryam; Battaglia, Rachel A; Evangelista, Baggio A; Cohen, Todd J; Opal, Puneet; Bouldin, Thomas W; Armao, Diane; Snider, Natasha T",United States,2692-8205, ,<a href='https://pubmed.ncbi.nlm.nih.gov/39282431'>bioRxiv : the preprint server for biology</a>,bioRxiv, ,eng, ,11398400,39282431,2024 Sep 05,"<a href='https://www.ncbi.nlm.nih.gov/pmc/articles/11398400'>Gigaxonin, mutated in Giant Axonal Neuropathy, interacts with TDP-43 and other RNA binding proteins.</a>","<a href='https://pubmed.ncbi.nlm.nih.gov/?Db=pubmed&DbFrom=pubmed&Cmd=Link&LinkName=pubmed_pubmed&IdsFromResult=39282431&ordinalpos=1&itool=EntrezSystem2.PEntrez.Pubmed.Pubmed_ResultsPanel.Pubmed_DiscoveryPanel.Pubmed_Discovery_RA&log$=relatedarticles&logdbfrom=pubmed'>Related, PubMed</a>","<a href='https://scholar.google.com/scholar?q=related:https://pmc.ncbi.nlm.nih.gov/articles/PMC11398400/'>Related, Google Scholar</a>","<a href='https://pubmed.ncbi.nlm.nih.gov/?linkname=pubmed_pubmed_citedin&from_uid=39282431'>Cited By, PMID</a>","<a href='https://scholar.google.com/scholar?hl=en&lr=&cites=https://pmc.ncbi.nlm.nih.gov/articles/PMC11398400/'>Cited By, Google</a>", ,PMID(39282431) OR  ,2024,26928205,,,
F32HD102152,"School of Public Health, University of NV, Reno, NV, USA.",2024,"Koning, Stephanie M; Aronoff, Jacob; Chen, Shanting; Hargrove, Taylor; Polos, Jessica; McDade, Thomas W",England,1464-5033,1,<a href='https://pubmed.ncbi.nlm.nih.gov/39301955'>Annals of human biology</a>,Ann Hum Biol,51,eng,2390834,11463841,39301955,2024 Feb,Violence victimisation and young adult cardiometabolic health: the role of timing and social identity.,"<a href='https://pubmed.ncbi.nlm.nih.gov/?Db=pubmed&DbFrom=pubmed&Cmd=Link&LinkName=pubmed_pubmed&IdsFromResult=39301955&ordinalpos=1&itool=EntrezSystem2.PEntrez.Pubmed.Pubmed_ResultsPanel.Pubmed_DiscoveryPanel.Pubmed_Discovery_RA&log$=relatedarticles&logdbfrom=pubmed'>Related, PubMed</a>","<a href='https://scholar.google.com/scholar?q=related:https://pmc.ncbi.nlm.nih.gov/articles/PMC11463841/'>Related, Google Scholar</a>","<a href='https://pubmed.ncbi.nlm.nih.gov/?linkname=pubmed_pubmed_citedin&from_uid=39301955'>Cited By, PMID</a>","<a href='https://scholar.google.com/scholar?hl=en&lr=&cites=https://pmc.ncbi.nlm.nih.gov/articles/PMC11463841/'>Cited By, Google</a>", ,PMID(39301955) OR  ,2024,14645033,,,
P30CA060553,"Department of Microbiology-Immunology, Feinberg School of Medicine, Northwestern University, Chicago, Illinois, 60611, USA.",2024,"Chen, Jiexi; Goerdeler, Felix; Jaroentomeechai, Thapakorn; Hernandez, Francisco X S; Wang, Xiaozhong; Clausen, Henrik; Narimatsu, Yoshiki; Satchell, Karla J F",United States,2692-8205, ,<a href='https://pubmed.ncbi.nlm.nih.gov/39314294'>bioRxiv : the preprint server for biology</a>,bioRxiv, ,eng, ,11418979,39314294,2024 Sep 12,<a href='https://www.ncbi.nlm.nih.gov/pmc/articles/11418979'>Biantennary N-glycans As Receptors for MARTX Toxins in Vibrio Pathogenesis.</a>,"<a href='https://pubmed.ncbi.nlm.nih.gov/?Db=pubmed&DbFrom=pubmed&Cmd=Link&LinkName=pubmed_pubmed&IdsFromResult=39314294&ordinalpos=1&itool=EntrezSystem2.PEntrez.Pubmed.Pubmed_ResultsPanel.Pubmed_DiscoveryPanel.Pubmed_Discovery_RA&log$=relatedarticles&logdbfrom=pubmed'>Related, PubMed</a>","<a href='https://scholar.google.com/scholar?q=related:https://pmc.ncbi.nlm.nih.gov/articles/PMC11418979/'>Related, Google Scholar</a>","<a href='https://pubmed.ncbi.nlm.nih.gov/?linkname=pubmed_pubmed_citedin&from_uid=39314294'>Cited By, PMID</a>","<a href='https://scholar.google.com/scholar?hl=en&lr=&cites=https://pmc.ncbi.nlm.nih.gov/articles/PMC11418979/'>Cited By, Google</a>", ,PMID(39314294) OR  ,2024,26928205,,,
R37AI092825,"Department of Microbiology-Immunology, Feinberg School of Medicine, Northwestern University, Chicago, Illinois, 60611, USA.",2024,"Chen, Jiexi; Goerdeler, Felix; Jaroentomeechai, Thapakorn; Hernandez, Francisco X S; Wang, Xiaozhong; Clausen, Henrik; Narimatsu, Yoshiki; Satchell, Karla J F",United States,2692-8205, ,<a href='https://pubmed.ncbi.nlm.nih.gov/39314294'>bioRxiv : the preprint server for biology</a>,bioRxiv, ,eng, ,11418979,39314294,2024 Sep 12,<a href='https://www.ncbi.nlm.nih.gov/pmc/articles/11418979'>Biantennary N-glycans As Receptors for MARTX Toxins in Vibrio Pathogenesis.</a>,"<a href='https://pubmed.ncbi.nlm.nih.gov/?Db=pubmed&DbFrom=pubmed&Cmd=Link&LinkName=pubmed_pubmed&IdsFromResult=39314294&ordinalpos=1&itool=EntrezSystem2.PEntrez.Pubmed.Pubmed_ResultsPanel.Pubmed_DiscoveryPanel.Pubmed_Discovery_RA&log$=relatedarticles&logdbfrom=pubmed'>Related, PubMed</a>","<a href='https://scholar.google.com/scholar?q=related:https://pmc.ncbi.nlm.nih.gov/articles/PMC11418979/'>Related, Google Scholar</a>","<a href='https://pubmed.ncbi.nlm.nih.gov/?linkname=pubmed_pubmed_citedin&from_uid=39314294'>Cited By, PMID</a>","<a href='https://scholar.google.com/scholar?hl=en&lr=&cites=https://pmc.ncbi.nlm.nih.gov/articles/PMC11418979/'>Cited By, Google</a>", ,PMID(39314294) OR  ,2024,26928205,,,
S10OD032464,"Department of Neurology, Northwestern University School of Medicine, Chicago, IL, United States.",2024,"Guo, Xueshui; Prajapati, Ravindra; Chun, Jiyeon; Byun, Insuk; Gebis, Kamil K; Wang, Yi-Zhi; Ling, Karen; Dalton, Casey; Blair, Jeff A; Hamidianjahromi, Anahid; Bachmann, Gemma; Rigo, Frank; Jafar-Nejad, Paymaan; Savas, Jeffrey N; Lee, Min Jae; Sreedharan, Jemeen; Kalb, Robert G",United States,2692-8205, ,<a href='https://pubmed.ncbi.nlm.nih.gov/39314471'>bioRxiv : the preprint server for biology</a>,bioRxiv, ,eng, ,11419047,39314471,2024 Sep 14,<a href='https://www.ncbi.nlm.nih.gov/pmc/articles/11419047'>Reduction of RAD23A extends lifespan and mitigates pathology in TDP-43 mice.</a>,"<a href='https://pubmed.ncbi.nlm.nih.gov/?Db=pubmed&DbFrom=pubmed&Cmd=Link&LinkName=pubmed_pubmed&IdsFromResult=39314471&ordinalpos=1&itool=EntrezSystem2.PEntrez.Pubmed.Pubmed_ResultsPanel.Pubmed_DiscoveryPanel.Pubmed_Discovery_RA&log$=relatedarticles&logdbfrom=pubmed'>Related, PubMed</a>","<a href='https://scholar.google.com/scholar?q=related:https://pmc.ncbi.nlm.nih.gov/articles/PMC11419047/'>Related, Google Scholar</a>","<a href='https://pubmed.ncbi.nlm.nih.gov/?linkname=pubmed_pubmed_citedin&from_uid=39314471'>Cited By, PMID</a>","<a href='https://scholar.google.com/scholar?hl=en&lr=&cites=https://pmc.ncbi.nlm.nih.gov/articles/PMC11419047/'>Cited By, Google</a>", ,PMID(39314471) OR  ,2024,26928205,,,
R01LM013337,"Department of Medicine, Northwestern University Feinberg School of Medicine, Chicago, IL.",2024,"Zhu, Mengou; Pickens, Chiagozie I; Markov, Nikolay S; Pawlowski, Anna; Kang, Mengjia; Rasmussen, Luke V; Walter, James M; Nadig, Nandita R; Singer, Benjamin D; Wunderink, Richard G; Gao, Catherine A; NU SCRIPT Study Investigators",United States, , ,<a href='https://pubmed.ncbi.nlm.nih.gov/39314979'>medRxiv : the preprint server for health sciences</a>,medRxiv, ,eng, ,11419224,39314979,2024 Sep 10,<a href='https://www.ncbi.nlm.nih.gov/pmc/articles/11419224'>Antibiotic De-escalation Patterns and Outcomes in Critically Ill Patients with Suspected Pneumonia as Informed by Bronchoalveolar Lavage Results.</a>,"<a href='https://pubmed.ncbi.nlm.nih.gov/?Db=pubmed&DbFrom=pubmed&Cmd=Link&LinkName=pubmed_pubmed&IdsFromResult=39314979&ordinalpos=1&itool=EntrezSystem2.PEntrez.Pubmed.Pubmed_ResultsPanel.Pubmed_DiscoveryPanel.Pubmed_Discovery_RA&log$=relatedarticles&logdbfrom=pubmed'>Related, PubMed</a>","<a href='https://scholar.google.com/scholar?q=related:https://pmc.ncbi.nlm.nih.gov/articles/PMC11419224/'>Related, Google Scholar</a>","<a href='https://pubmed.ncbi.nlm.nih.gov/?linkname=pubmed_pubmed_citedin&from_uid=39314979'>Cited By, PMID</a>","<a href='https://scholar.google.com/scholar?hl=en&lr=&cites=https://pmc.ncbi.nlm.nih.gov/articles/PMC11419224/'>Cited By, Google</a>", ,PMID(39314979) OR  ,2024,,,,
K12TR005104,"Department of Medicine, Northwestern University Feinberg School of Medicine, Chicago, IL.",2024,"Zhu, Mengou; Pickens, Chiagozie I; Markov, Nikolay S; Pawlowski, Anna; Kang, Mengjia; Rasmussen, Luke V; Walter, James M; Nadig, Nandita R; Singer, Benjamin D; Wunderink, Richard G; Gao, Catherine A; NU SCRIPT Study Investigators",United States, , ,<a href='https://pubmed.ncbi.nlm.nih.gov/39314979'>medRxiv : the preprint server for health sciences</a>,medRxiv, ,eng, ,11419224,39314979,2024 Sep 10,<a href='https://www.ncbi.nlm.nih.gov/pmc/articles/11419224'>Antibiotic De-escalation Patterns and Outcomes in Critically Ill Patients with Suspected Pneumonia as Informed by Bronchoalveolar Lavage Results.</a>,"<a href='https://pubmed.ncbi.nlm.nih.gov/?Db=pubmed&DbFrom=pubmed&Cmd=Link&LinkName=pubmed_pubmed&IdsFromResult=39314979&ordinalpos=1&itool=EntrezSystem2.PEntrez.Pubmed.Pubmed_ResultsPanel.Pubmed_DiscoveryPanel.Pubmed_Discovery_RA&log$=relatedarticles&logdbfrom=pubmed'>Related, PubMed</a>","<a href='https://scholar.google.com/scholar?q=related:https://pmc.ncbi.nlm.nih.gov/articles/PMC11419224/'>Related, Google Scholar</a>","<a href='https://pubmed.ncbi.nlm.nih.gov/?linkname=pubmed_pubmed_citedin&from_uid=39314979'>Cited By, PMID</a>","<a href='https://scholar.google.com/scholar?hl=en&lr=&cites=https://pmc.ncbi.nlm.nih.gov/articles/PMC11419224/'>Cited By, Google</a>", ,PMID(39314979) OR  ,2024,,,,
R01HL153122,"Department of Medicine, Northwestern University Feinberg School of Medicine, Chicago, IL.",2024,"Zhu, Mengou; Pickens, Chiagozie I; Markov, Nikolay S; Pawlowski, Anna; Kang, Mengjia; Rasmussen, Luke V; Walter, James M; Nadig, Nandita R; Singer, Benjamin D; Wunderink, Richard G; Gao, Catherine A; NU SCRIPT Study Investigators",United States, , ,<a href='https://pubmed.ncbi.nlm.nih.gov/39314979'>medRxiv : the preprint server for health sciences</a>,medRxiv, ,eng, ,11419224,39314979,2024 Sep 10,<a href='https://www.ncbi.nlm.nih.gov/pmc/articles/11419224'>Antibiotic De-escalation Patterns and Outcomes in Critically Ill Patients with Suspected Pneumonia as Informed by Bronchoalveolar Lavage Results.</a>,"<a href='https://pubmed.ncbi.nlm.nih.gov/?Db=pubmed&DbFrom=pubmed&Cmd=Link&LinkName=pubmed_pubmed&IdsFromResult=39314979&ordinalpos=1&itool=EntrezSystem2.PEntrez.Pubmed.Pubmed_ResultsPanel.Pubmed_DiscoveryPanel.Pubmed_Discovery_RA&log$=relatedarticles&logdbfrom=pubmed'>Related, PubMed</a>","<a href='https://scholar.google.com/scholar?q=related:https://pmc.ncbi.nlm.nih.gov/articles/PMC11419224/'>Related, Google Scholar</a>","<a href='https://pubmed.ncbi.nlm.nih.gov/?linkname=pubmed_pubmed_citedin&from_uid=39314979'>Cited By, PMID</a>","<a href='https://scholar.google.com/scholar?hl=en&lr=&cites=https://pmc.ncbi.nlm.nih.gov/articles/PMC11419224/'>Cited By, Google</a>", ,PMID(39314979) OR  ,2024,,,,
R01HL060190,"Center for Translational Science, Florida International University, Port St. Lucie, FL, 34987, USA; Departments of Environmental Health Sciences, Robert Stempel College of Public Health and Social Work, Florida International University, Miami, FL, 33174, USA.",2024,"Sun, Xutong; Moreno Caceres, Santiago; Yegambaram, Manivannan; Lu, Qing; Pokharel, Marissa D; Boehme, Jason T; Datar, Sanjeev A; Aggarwal, Saurabh; Wang, Ting; Fineman, Jeffrey R; Black, Stephen M",United States,1089-8611, ,<a href='https://pubmed.ncbi.nlm.nih.gov/39332480'>Nitric oxide : biology and chemistry</a>,Nitric Oxide,152,eng,90-100,12068231,39332480,2024 Nov 01,The mitochondrial redistribution of ENOS is regulated by AKT1 and dimer status.,"<a href='https://pubmed.ncbi.nlm.nih.gov/?Db=pubmed&DbFrom=pubmed&Cmd=Link&LinkName=pubmed_pubmed&IdsFromResult=39332480&ordinalpos=1&itool=EntrezSystem2.PEntrez.Pubmed.Pubmed_ResultsPanel.Pubmed_DiscoveryPanel.Pubmed_Discovery_RA&log$=relatedarticles&logdbfrom=pubmed'>Related, PubMed</a>","<a href='https://scholar.google.com/scholar?q=related:https://pmc.ncbi.nlm.nih.gov/articles/PMC12068231/'>Related, Google Scholar</a>","<a href='https://pubmed.ncbi.nlm.nih.gov/?linkname=pubmed_pubmed_citedin&from_uid=39332480'>Cited By, PMID</a>","<a href='https://scholar.google.com/scholar?hl=en&lr=&cites=https://pmc.ncbi.nlm.nih.gov/articles/PMC12068231/'>Cited By, Google</a>", ,PMID(39332480) OR  ,2024,10898611,,,
T32HD007418, ,2024,"Sahani, Ridhi; Reyna, William E; Royston, Thomas; Perreault, Eric J; Ludvig, Daniel",United States,2692-8205, ,<a href='https://pubmed.ncbi.nlm.nih.gov/39211265'>bioRxiv : the preprint server for biology</a>,bioRxiv, ,eng, ,11360966,39211265,2024 Aug 03,<a href='https://www.ncbi.nlm.nih.gov/pmc/articles/11360966'>Along- and cross-muscle fiber shear moduli in skeletal muscle.</a>,"<a href='https://pubmed.ncbi.nlm.nih.gov/?Db=pubmed&DbFrom=pubmed&Cmd=Link&LinkName=pubmed_pubmed&IdsFromResult=39211265&ordinalpos=1&itool=EntrezSystem2.PEntrez.Pubmed.Pubmed_ResultsPanel.Pubmed_DiscoveryPanel.Pubmed_Discovery_RA&log$=relatedarticles&logdbfrom=pubmed'>Related, PubMed</a>","<a href='https://scholar.google.com/scholar?q=related:https://pmc.ncbi.nlm.nih.gov/articles/PMC11360966/'>Related, Google Scholar</a>","<a href='https://pubmed.ncbi.nlm.nih.gov/?linkname=pubmed_pubmed_citedin&from_uid=39211265'>Cited By, PMID</a>","<a href='https://scholar.google.com/scholar?hl=en&lr=&cites=https://pmc.ncbi.nlm.nih.gov/articles/PMC11360966/'>Cited By, Google</a>", ,PMID(39211265) OR  ,2024,26928205,,,
T32GM008061,"Department of Pathology, Northwestern University, USA; Center for Human Immunobiology, Northwestern University, USA.",2024,"Mani, Nikita L; Weinberg, Samuel E; Chaudhuri, Shuvam; Montauti, Elena; Tang, Amy; Iyer, Radhika; Fang, Deyu",England,1872-9142, ,<a href='https://pubmed.ncbi.nlm.nih.gov/39213947'>Molecular immunology</a>,Mol Immunol,174,eng,57-68,11681611,39213947,2024 Oct,<a href='https://www.ncbi.nlm.nih.gov/pmc/articles/11681611'>Acidity induces durable enhancement of Treg cell suppressive functions for tumor immune evasion.</a>,"<a href='https://pubmed.ncbi.nlm.nih.gov/?Db=pubmed&DbFrom=pubmed&Cmd=Link&LinkName=pubmed_pubmed&IdsFromResult=39213947&ordinalpos=1&itool=EntrezSystem2.PEntrez.Pubmed.Pubmed_ResultsPanel.Pubmed_DiscoveryPanel.Pubmed_Discovery_RA&log$=relatedarticles&logdbfrom=pubmed'>Related, PubMed</a>","<a href='https://scholar.google.com/scholar?q=related:https://pmc.ncbi.nlm.nih.gov/articles/PMC11681611/'>Related, Google Scholar</a>","<a href='https://pubmed.ncbi.nlm.nih.gov/?linkname=pubmed_pubmed_citedin&from_uid=39213947'>Cited By, PMID</a>","<a href='https://scholar.google.com/scholar?hl=en&lr=&cites=https://pmc.ncbi.nlm.nih.gov/articles/PMC11681611/'>Cited By, Google</a>", ,PMID(39213947) OR  ,2024,18729142,,,
T32GM149439,"Department of Pathology, Northwestern University, USA; Center for Human Immunobiology, Northwestern University, USA.",2024,"Mani, Nikita L; Weinberg, Samuel E; Chaudhuri, Shuvam; Montauti, Elena; Tang, Amy; Iyer, Radhika; Fang, Deyu",England,1872-9142, ,<a href='https://pubmed.ncbi.nlm.nih.gov/39213947'>Molecular immunology</a>,Mol Immunol,174,eng,57-68,11681611,39213947,2024 Oct,<a href='https://www.ncbi.nlm.nih.gov/pmc/articles/11681611'>Acidity induces durable enhancement of Treg cell suppressive functions for tumor immune evasion.</a>,"<a href='https://pubmed.ncbi.nlm.nih.gov/?Db=pubmed&DbFrom=pubmed&Cmd=Link&LinkName=pubmed_pubmed&IdsFromResult=39213947&ordinalpos=1&itool=EntrezSystem2.PEntrez.Pubmed.Pubmed_ResultsPanel.Pubmed_DiscoveryPanel.Pubmed_Discovery_RA&log$=relatedarticles&logdbfrom=pubmed'>Related, PubMed</a>","<a href='https://scholar.google.com/scholar?q=related:https://pmc.ncbi.nlm.nih.gov/articles/PMC11681611/'>Related, Google Scholar</a>","<a href='https://pubmed.ncbi.nlm.nih.gov/?linkname=pubmed_pubmed_citedin&from_uid=39213947'>Cited By, PMID</a>","<a href='https://scholar.google.com/scholar?hl=en&lr=&cites=https://pmc.ncbi.nlm.nih.gov/articles/PMC11681611/'>Cited By, Google</a>", ,PMID(39213947) OR  ,2024,18729142,,,
