Pub Year,_journal_label,_publisher,_issn_norm,PMID,Authors,_waived_by_issn,_waived_by_title,apc_original,apc_effective,would_uncovered_if_no_waiver_cap_0,would_uncovered_if_no_waiver_cap_2000,would_uncovered_if_no_waiver_cap_3000,would_uncovered_if_no_waiver_cap_6000,avoided_usd_known
2024,JCPP Adv,Wiley,26929384,38486952,"Zheng, Shuting; Mansolf, Maxwell; McGrath, Monica; Churchill, Marie L; Bekelman, Traci A; Brennan, Patricia A; Margolis, Amy E; Nozadi, Sara S; Bastain, Theresa M; Elliott, Amy J; LeWinn, Kaja Z; Hofheimer, Julie A; Leve, Leslie D; Rennie, Brandon; Zimmerman, Emily; Marable, Carmen A; McEvoy, Cindy T; Liu, Chang; Sullivan, Alexis; Woodruff, Tracey J; Ghosh, Samiran; Leventhal, Bennett; Ferrara, Assiamira; Lewis, Johnnye; Bishop, Somer; Environmental influences on Child Health Outcomes",True,False,2705.0,0.0,2705.0,705.0,0.0,0.0,2705.0
2024,AIDS Behav,Springer Nature,15733254,38489139,"Smith, Madison Shea; Sarno, Elissa L; Price, Cole; Sajwani, Afiya; Mustanski, Brian; Newcomb, Michael E",True,False,4590.0,0.0,4590.0,2590.0,1590.0,0.0,4590.0
2024,Neurourol Urodyn,Wiley,15206777,38501372,"Gupta, Priyanka; Doherty, Lindsay; Temprosa, Marinella; Pop-Busui, Rodica; Gadde, Kishore M; Singh, Prachi; Owora, Arthur H; Wessells, Hunter; Sarma, Aruna V; Diabetes Prevention Program Research Group",True,False,3860.0,0.0,3860.0,1860.0,860.0,0.0,3860.0
2024,Med J Aust,Unknown,13265377,38613175,"O'Dean, Siobhan; Sunderland, Matthew; Newton, Nicola; Gardner, Lauren; Teesson, Maree; Chapman, Cath; Thornton, Louise; Slade, Tim; Hides, Leanne; McBride, Nyanda; Kay-Lambkin, Frances J; Allsop, Steve J; Lubans, David; Parmenter, Belinda; Mills, Katherine; Spring, Bonnie; Osman, Bridie; Ellem, Rhiannon; Smout, Scarlett; McCann, Karrah; Hunter, Emily; Catakovic, Amra; Champion, Katrina",True,False,,0.0,,,,,
2024,Acta Neuropathol,Springer Nature,14320533,38520489,"Maldonado-Díaz, Carolina; Hiya, Satomi; Yokoda, Raquel T; Farrell, Kurt; Marx, Gabriel A; Kauffman, Justin; Daoud, Elena V; Gonzales, Mitzi M; Parker, Alicia S; Canbeldek, Leyla; Kulumani Mahadevan, Lakshmi Shree; Crary, John F; White 3rd, Charles L; Walker, Jamie M; Richardson, Timothy E",True,False,4990.0,0.0,4990.0,2990.0,1990.0,0.0,4990.0
2024,Neuroinformatics,Springer Nature,15590089,38526701,"Kanakaraj, Praitayini; Yao, Tianyuan; Cai, Leon Y; Lee, Ho Hin; Newlin, Nancy R; Kim, Michael E; Gao, Chenyu; Pechman, Kimberly R; Archer, Derek; Hohman, Timothy; Jefferson, Angela; Beason-Held, Lori L; Resnick, Susan M; Alzheimer’s Disease Neuroimaging Initiative (ADNI); BIOCARD Study Team; Garyfallidis, Eleftherios; Anderson, Adam; Schilling, Kurt G; Landman, Bennett A; Moyer, Daniel",True,False,4890.0,0.0,4890.0,2890.0,1890.0,0.0,4890.0
2024,Arch Sex Behav,Springer Nature,15732800,38528296,"Owens, Christopher; Hurtado Jr, Manuel; Moskowitz, David A; Mustanski, Brian; Macapagal, Kathryn",True,False,3090.0,0.0,3090.0,1090.0,90.0,0.0,3090.0
2024,J Am Heart Assoc,Wolters Kluwer,20479980,38639350,"Ren, Kaixi; Hou, Songwang; Johnson, Steven E; Lomasney, Jon; Haney, Chad R; Lee, Jungwha; Ge, Zhi-Dong; Lee, Daniel C; Goldberger, Jeffrey J; Arora, Rishi; Zhao, Ming",True,False,3810.0,0.0,3810.0,1810.0,810.0,0.0,3810.0
2024,Hum Brain Mapp,Wiley,10970193,38339904,"Rasmussen, Jerod M; Wang, Yun; Graham, Alice M; Fair, Damien A; Posner, Jonathan; O'Connor, Thomas G; Simhan, Hyagriv N; Yen, Elizabeth; Madan, Neel; Entringer, Sonja; Wadhwa, Pathik D; Buss, Claudia; program collaborators for Environmental influences on Child Health Outcomes",True,False,3520.0,0.0,3520.0,1520.0,520.0,0.0,3520.0
2024,Am J Hum Biol,Wiley,15206300,38353326,"Aronoff, Jacob E; Koning, Stephanie M; Adair, Linda S; Lee, Nanette R; Carba, Delia B; Kuzawa, Christopher W; McDade, Thomas W",True,False,4550.0,0.0,4550.0,2550.0,1550.0,0.0,4550.0
2024,Alzheimers Dement,Wiley,15525279,38353367,"Pillai, Jagan A; Bena, James; Tousi, Babak; Rothenberg, Kasia; Keene, C Dirk; Leverenz, James B",True,False,4200.0,0.0,4200.0,2200.0,1200.0,0.0,4200.0
2024,AIDS Behav,Springer Nature,15733254,38564136,"Merle, James L; Benbow, Nanette; Li, Dennis H; Zapata, Juan P; Queiroz, Artur; Zamantakis, Alithia; McKay, Virginia; Keiser, Brennan; Villamar, Juan A; Mustanski, Brian; Smith, Justin D",True,False,4590.0,0.0,4590.0,2590.0,1590.0,0.0,4590.0
2024,Ann N Y Acad Sci,Wiley,17496632,38594916,"Sadino, Julie M; Donaldson, Zoe R",True,False,5080.0,0.0,5080.0,3080.0,2080.0,0.0,5080.0
2024,Clin Exp Neuroimmunol,Unknown,17591961,38595690,"Siddiqui, Amna; Ross, Dylan; Jani, Ronak H; Prabhu, Vikram C; Lo, Shelly; Wainwright, Derek A; Rouse, Stasia; Refaat, Tamer; Zhu, Yirong; Thakkar, Jigisha P",True,False,,0.0,,,,,
2024,Oncogene,Springer Nature,14765594,38409550,"Dalhat, Mahmood H; Narayan, Sharath; Serio, Hannah; Arango, Daniel",True,False,5990.0,0.0,5990.0,3990.0,2990.0,0.0,5990.0
2024,Pediatr Res,Springer Nature,15300447,38438554,"Mulkey, Sarah B; Williams, Meagan E; Peyton, Colleen; Arroyave-Wessel, Margarita; Berl, Madison M; Cure, Carlos; Msall, Michael E",True,False,4390.0,0.0,4390.0,2390.0,1390.0,0.0,4390.0
2024,Pigment Cell Melanoma Res,Wiley,1755148X,38439216,"Touni, Ahmed Ahmed; Sohn, Rachel; Cosgrove, Cormac; Shivde, Rohan S; Dellacecca, Emilia R; Abdel-Aziz, Rasha T A; Cedercreutz, Kettil; Green, Stefan J; Abdel-Wahab, Hossam; Le Poole, I Caroline",True,False,5000.0,0.0,5000.0,3000.0,2000.0,0.0,5000.0
2024,Neurourol Urodyn,Wiley,15206777,38451032,"Williams, Beverly R; Brady, Sonya S; Levin, Elise C; Brown, Oluwateniola; Lipman, Terri H; Klusaritz, Heather; Nodora, Jesse; Coyne-Beasley, Tamera; Putnam, Sara; Gahagan, Sheila; Burgio, Kathryn L; Prevention of Lower Urinary Tract Symptoms (PLUS) Research Consortium",True,False,3860.0,0.0,3860.0,1860.0,860.0,0.0,3860.0
2024,Adv Sci (Weinh),Wiley,21983844,39206932,"Zeng, Lidan; Zhu, Yueming; Cui, Xin; Chi, Junlong; Uddin, Amad; Zhou, Zhuan; Song, Xinxin; Dai, Mingji; Cristofanilli, Massimo; Kalinsky, Kevin; Wan, Yong",True,False,6730.0,0.0,6730.0,4730.0,3730.0,730.0,6730.0
2024,AIDS Behav,Springer Nature,15733254,39387999,"Zamantakis, Alithia; Zapata, Juan Pablo; Greenawalt, Isaac; Knapp, Ashley A; Benbow, Nanette; Mustanski, Brian",True,False,4590.0,0.0,4590.0,2590.0,1590.0,0.0,4590.0
2024,Hum Brain Mapp,Wiley,10970193,39540247,"Kirschen, Robert M; Leaver, Amber M",True,False,3520.0,0.0,3520.0,1520.0,520.0,0.0,3520.0
2024,Clin Transplant,Wiley,13990012,39624929,"Rogers, James L; Gacki-Smith, Jessica; Yacat, Rochell; Wicklund, Catherine; Duquette, Debra; Friedewald, John; Cooper, Matthew; Gilbert, Alexander; Agrawal, Akansha; Gordon, Elisa J",True,False,4550.0,0.0,4550.0,2550.0,1550.0,0.0,4550.0
2024,Curr HIV/AIDS Rep,Springer Nature,15483576,39666149,"Islam, S M Shamsul; Singh, Shalini; Keshavarzian, Ali; Abdel-Mohsen, Mohamed",True,False,4190.0,0.0,4190.0,2190.0,1190.0,0.0,4190.0
2024,J Racial Ethn Health Disparities,Springer Nature,21968837,37347407,"Zapata, Juan Pablo; Zamantakis, Alithia; Queiroz, Artur Acelino Francisco Luz Nunes",True,False,5190.0,0.0,5190.0,3190.0,2190.0,0.0,5190.0
2024,J Midwifery Womens Health,Wiley,15422011,37394901,"Badreldin, Nevert; DiTosto, Julia D; Leziak, Karolina; Niznik, Charlotte M; Yee, Lynn M",True,False,3750.0,0.0,3750.0,1750.0,750.0,0.0,3750.0
2024,Mol Nutr Food Res,Unknown,16134133,36708219,"Leibold, Noah; Bain, James R; Despa, Florin",True,False,,0.0,,,,,
2024,J Pers,Unknown,14676494,36807053,"Pearlstein, Jennifer G; Johnson, Sheri L; Timpano, Kiara R; Stamatis, Caitlin A; Robison, Morgan; Carver, Charles S",True,False,,0.0,,,,,
2024,Bioessays,Wiley,15211878,37926700,"Borden, Katherine L B",True,False,5330.0,0.0,5330.0,3330.0,2330.0,0.0,5330.0
2024,J Am Heart Assoc,Wolters Kluwer,20479980,37930082,"Rottmann, Markus; Yoo, Shin; Pfenniger, Anna; Mikhailov, Aleksei; Benefield, Brandon; Johnson, David A; Zhang, Wenwei; Ghosh, Asish K; Kim, Daniel; Passman, Rod; Knight, Bradley P; Lee, Daniel C; Arora, Rishi",True,False,3810.0,0.0,3810.0,1810.0,810.0,0.0,3810.0
2024,Alzheimers Dement,Wiley,15525279,37578203,"Tejeda, Marlene; Farrell, John; Zhu, Congcong; Wetzler, Lee; Lunetta, Kathryn L; Bush, William S; Martin, Eden R; Wang, Li-San; Schellenberg, Gerard D; Pericak-Vance, Margaret A; Haines, Jonathan L; Farrer, Lindsay A; Sherva, Richard",True,False,4200.0,0.0,4200.0,2200.0,1200.0,0.0,4200.0
2024,Neurourol Urodyn,Wiley,15206777,37787539,"Markland, Alayne; Bavendam, Tamara; Cain, Charles; Neill Epperson, C; Fitzgerald, Colleen M; Yvette LaCoursiere, D; Shoham, David A; Smith, Ariana L; Sutcliffe, Siobhan; Rudser, Kyle; Prevention of Lower Urinary Tract Symptoms Research Consortium",True,False,3860.0,0.0,3860.0,1860.0,860.0,0.0,3860.0
2024,Cancer,Wiley,10970142,37795845,"Walter, Angela Wangari; Lee, Ju-Whei; Streck, Joanna M; Gareen, Ilana F; Herman, Benjamin A; Kircher, Sheetal M; Carlos, Ruth C; Kumar, Shaji K; Mayer, Ingrid A; Saba, Nabil F; Fenske, Timothy S; Neal, Joel W; Atkins, Michael B; Hodi, Frank S; Kyriakopoulos, Christos E; Tempany-Afdhal, Clare M; Shanafelt, Tait D; Wagner, Lynne I; Land, Stephanie R; Ostroff, Jamie S; Park, Elyse R",True,False,4790.0,0.0,4790.0,2790.0,1790.0,0.0,4790.0
2024,J Am Heart Assoc,Wolters Kluwer,20479980,38497480,"Mathew, Daniel T; Peigh, Graham; Lima, Joao A C; Bielinski, Suzette J; Larson, Nicholas B; Allison, Matthew A; Shah, Sanjiv J; Patel, Ravi B",True,False,3810.0,0.0,3810.0,1810.0,810.0,0.0,3810.0
2024,J Am Geriatr Soc,Wiley,15325415,38553838,"Trammell, Antoine R; Goldstein, Felicia C; Parker, Monica W; Hajjar, Ihab M",True,False,4760.0,0.0,4760.0,2760.0,1760.0,0.0,4760.0
2024,Diabet Med,Wiley,14645491,38561918,"Akyirem, Samuel; Ekpor, Emmanuel; Abwoye, Diana Namumbejja; Wang, Katie",True,False,4870.0,0.0,4870.0,2870.0,1870.0,0.0,4870.0
2024,Mov Disord,Wiley,15318257,38576116,"Keller Sarmiento, Ignacio J; Bustos, Bernabe I; Blackburn, Joanna; Hac, Nicholas E F; Ruzhnikov, Maura; Monroe, Matthea; Levy, Rebecca J; Kinsley, Lisa; Li, Megan; Silani, Vincenzo; Lubbe, Steven J; Krainc, Dimitri; Mencacci, Niccolò E",True,False,4480.0,0.0,4480.0,2480.0,1480.0,0.0,4480.0
2024,J Physiol,Wiley,14697793,37029630,"Courjaret, Raphael; Prakriya, Murali; Machaca, Khaled",True,False,5400.0,0.0,5400.0,3400.0,2400.0,0.0,5400.0
2024,Adv Mater,Wiley,15214095,37680065,"Tropp, Joshua; Collins, Caralyn P; Xie, Xinran; Daso, Rachel E; Mehta, Abijeet Singh; Patel, Shiv P; Reddy, Manideep M; Levin, Sophia E; Sun, Cheng; Rivnay, Jonathan",True,False,6070.0,0.0,6070.0,4070.0,3070.0,70.0,6070.0
2024,Clin Transl Sci,Wiley,17528062,38129972,"Turner, Amy J; Haidar, Cyrine E; Yang, Wenjian; Boone, Erin C; Offer, Steven M; Empey, Philip E; Haddad, Andrew; Tahir, Saba; Scharer, Gunter; Broeckel, Ulrich; Gaedigk, Andrea",True,False,3630.0,0.0,3630.0,1630.0,630.0,0.0,3630.0
2024,Cancer,Wiley,10970142,38140735,"Janczewski, Lauren M; Browner, Amanda; Cotler, Joseph; Nelson, Heidi; Ballman, Karla V; LeBlanc, Michael; Gollub, Marc J; Eng, Cathy; Brierley, James D; Palefsky, Joel M; Goldberg, Richard M; Goodman, Karyn A; Washington, M Kay; Asare, Elliot A; Palis, Bryan",True,False,4790.0,0.0,4790.0,2790.0,1790.0,0.0,4790.0
2024,Pediatr Transplant,Wiley,13993046,38063266,"Watanabe, Kae; Arva, Nicoleta C; Robinson, Joshua D; Rigsby, Cynthia; Markl, Michael; Sojka, Melanie; Tannous, Paul; Arzu, Jennifer; Husain, Nazia",True,False,3730.0,0.0,3730.0,1730.0,730.0,0.0,3730.0
2024,Alzheimers Dement,Wiley,15525279,38184787,"Wang, Ping; Lynn, Audrey; Miskimen, Kristy; Song, Yeunjoo E; Wisniewski, Thomas; Cohen, Mark; Appleby, Brian S; Safar, Jiri G; Haines, Jonathan L",True,False,4200.0,0.0,4200.0,2200.0,1200.0,0.0,4200.0
2024,Alzheimers Dement (N Y),Wiley,23528737,38188606,"Ashford, Miriam T; Jin, Chengshi; Neuhaus, John; Diaz, Adam; Aaronson, Anna; Tank, Rachana; Eichenbaum, Joseph; Camacho, Monica R; Fockler, Juliet; Ulbricht, Aaron; Flenniken, Derek; Truran, Diana; Mackin, Robert Scott; Weiner, Michael W; Mindt, Monica Rivera; Nosheny, Rachel L",True,False,2540.0,0.0,2540.0,540.0,0.0,0.0,2540.0
2024,Ann N Y Acad Sci,Wiley,17496632,38194291,"Tighe, Lauren A; Sommer, Teresa Eckrich; Sabol, Terri J; Chase-Lansdale, P Lindsay",True,False,5080.0,0.0,5080.0,3080.0,2080.0,0.0,5080.0
2024,Dev Growth Differ,Unknown,1440169X,38197329,"Mann, Elizabeth A; Mogle, Melissa S; Park, Joo-Seop; Reddy, Pramod",True,False,,0.0,,,,,
2024,Geroscience,Springer Nature,25092723,38198027,"Hameed, Sanaa; Muhammad, Fauziyya; Haynes, Grace; Smith, Lonnie; Khan, Ali F; Smith, Zachary A",True,False,4490.0,0.0,4490.0,2490.0,1490.0,0.0,4490.0
2024,Int J Dermatol,Unknown,13654632,38204174,"Joel, Marina Z; Wride, Anthony M; Cohen, Jeffrey M",True,False,,0.0,,,,,
2024,J Child Psychol Psychiatry,Wiley,14697610,38124618,"Thompson, Khalil I; Schneider, Clayton J; Lopez-Roque, Justin A; Wakschlag, Lauren S; Karim, Helmet T; Perlman, Susan B",True,False,4530.0,0.0,4530.0,2530.0,1530.0,0.0,4530.0
2024,Clin Transl Sci,Wiley,17528062,38156426,"Llewellyn, Nicole; Nehl, Eric J; Dave, Gaurav; DiazGranados, Deborah; Flynn, David; Fournier, Deborah; Hoyo, Verónica; Pelfrey, Clara; Casey, Shannon",True,False,3630.0,0.0,3630.0,1630.0,630.0,0.0,3630.0
2024,Fam Process,Wiley,15455300,37277975,"Vázquez, Alejandro L; Chou, Tommy; Helseth, Sarah A; Gudiño, Omar G; Domenech Rodríguez, Melanie M",True,False,3400.0,0.0,3400.0,1400.0,400.0,0.0,3400.0
2024,J Thromb Thrombolysis,Unknown,1573742X,37945938,"Magod, Benjamin; Chokshi, Anuj K; Martin, Karlyn A; Schimmel, Daniel R; Khan, Sadiya S; Shah, Nilay S",True,False,,0.0,,,,,
2024,Surg Endosc,Springer Nature,14322218,38997455,"Valukas, Catherine S; Vitello, Dominic; Sanchez, Joseph; Soetikno, Alan; Prinz, Joanne; Hungness, Eric S; Teitelbaum, Ezra N",True,False,4390.0,0.0,4390.0,2390.0,1390.0,0.0,4390.0
2024,Allergy,Wiley,13989995,39003573,"Czarnowicki, Tali; David, Eden; Yamamura, Kazuhiko; Han, Joseph; He, Helen; Pavel, Ana B; Glickman, Jacob; Erickson, Taylor; Estrada, Yeriel; Krueger, James G; Rangel, Stephanie M; Paller, Amy S; Guttman-Yassky, Emma",True,False,5300.0,0.0,5300.0,3300.0,2300.0,0.0,5300.0
2024,Oncogene,Springer Nature,14765594,39068216,"Li, Siting; Tang, Mengfan; Xiong, Yun; Feng, Xu; Wang, Chao; Nie, Litong; Huang, Min; Zhang, Huimin; Yin, Ling; Zhu, Dandan; Yang, Chang; Ma, Tiantian; Chen, Junjie",True,False,5990.0,0.0,5990.0,3990.0,2990.0,0.0,5990.0
2024,Child Dev,Wiley,14678624,39080971,"Trevino, Cindy O; Lai, Jin-Shei; Tang, Xiaodan; LeWinn, Kaja Z; Nozadi, Sara S; Wosu, Adaeze; Leve, Leslie D; Towe-Goodman, Nissa R; Ni, Yu; Graff, Joyce Carolyn; Karr, Catherine J; Collett, Brent R; program collaborators for Environmental influences on Child Health Outcomes",True,False,4320.0,0.0,4320.0,2320.0,1320.0,0.0,4320.0
2024,PM R,Wiley,19341563,38874321,"Fram, Julia; Boss, Kathleen; Villaflor, Victoria; Jayabalan, Prakash",True,False,3470.0,0.0,3470.0,1470.0,470.0,0.0,3470.0
2024,Clin Child Fam Psychol Rev,Unknown,15732827,38884838,"Cohen, Katherine A; Ito, Sakura; Ahuvia, Isaac L; Yang, Yuanyuan; Zhang, Yanchen; Renshaw, Tyler L; Larson, Madeline; Cook, Clayton; Hill, Shannon; Liao, Jessica; Rapoport, Andy; Smock, Amanda; Yang, Michelle; Schleider, Jessica L",True,False,,0.0,,,,,
2024,AIDS Behav,Springer Nature,15733254,38231362,"Rubtsova, Anna A; Taylor, Tonya N; Wingood, Gina; Ofotokun, Ighovwerha; Gustafson, Deborah; Vance, David E; Holstad, Marcia",True,False,4590.0,0.0,4590.0,2590.0,1590.0,0.0,4590.0
2024,Cancer,Wiley,10970142,38236702,"Smith, Karen L; Zhao, Fengmin; Mayer, Ingrid A; Tevaarwerk, Amye J; Garcia, Sofia F; Arteaga, Carlos L; Symmans, William F; Park, Ben H; Burnette, Brian L; Makower, Della F; Block, Margaret; Morley, Kimberly A; Jani, Chirag R; Mescher, Craig; Dewani, Shabana J; Brown-Glaberman, Ursa; Flaum, Lisa E; Mayer, Erica L; Sikov, William M; Rodler, Eve T; DeMichele, Angela M; Sparano, Joseph A; Wolff, Antonio C; Miller, Kathy D; Wagner, Lynne I",True,False,4790.0,0.0,4790.0,2790.0,1790.0,0.0,4790.0
2024,Neurourol Urodyn,Wiley,15206777,38247366,"Erickson, Bradley A; Griffith, James W; Wensheng, Guo; Mengying, You; Herman, Ted; Bradley, Catherine S; Quentin Clemens, J; Farrar, John T; Gupta, Priyanka; Kreder, Karl J; Henry Lai, H; Naliboff, Bruce D; Newman, Diane K; Rodriguez, Larissa V; Spitznagle, Theresa; Sutcliffe, Siobhan; Sutherland, Suzette E; Taple, Bayley J; Richard Landis, J",True,False,3860.0,0.0,3860.0,1860.0,860.0,0.0,3860.0
2024,Adv Sci (Weinh),Wiley,21983844,38263873,"Wang, Yinu; Calvert, Andrea E; Cardenas, Horacio; Rink, Jonathon S; Nahotko, Dominik; Qiang, Wenan; Ndukwe, C Estelle; Chen, Fukai; Keathley, Russell; Zhang, Yaqi; Cheng, Ji-Xin; Thaxton, C Shad; Matei, Daniela",True,False,6730.0,0.0,6730.0,4730.0,3730.0,730.0,6730.0
2024,Curr Neurol Neurosci Rep,Springer Nature,15346293,38270820,"Lin, Chi-Ying R; Kuo, Sheng-Han; Opal, Puneet",True,False,5590.0,0.0,5590.0,3590.0,2590.0,0.0,5590.0
2024,BJOG,Wiley,14710528,38272844,"Pingeton, Blaire C; Goodman, Sherryl H; Lavner, Justin A; LaFever, Kat; Marchuck, Noah",True,False,5190.0,0.0,5190.0,3190.0,2190.0,0.0,5190.0
2024,Neurogastroenterol Motil,Wiley,13652982,39223932,"Graham, Kahla; Reedy, Erin L; Lee, Jungwha Julia; Norton, Elizabeth Spencer; Arunachalam, Ambalavanan; Tomic, Rade; Martin-Harris, Bonnie",True,False,4640.0,0.0,4640.0,2640.0,1640.0,0.0,4640.0
2024,Support Care Cancer,Springer Nature,14337339,38600364,"Vega, Brenda; Desai, Ria; Solk, Payton; McKoy, June M; Flores, Ann Marie; Phillips, Siobhan M; Barber, Emma L",True,False,4690.0,0.0,4690.0,2690.0,1690.0,0.0,4690.0
2024,J Res Adolesc,Wiley,15327795,38616300,"Caba, Antonia E; Christophe, N Keita; Renley, Benton M; Simon, Kay A; Feinstein, Brian A; Eaton, Lisa A; Watson, Ryan J",True,False,3400.0,0.0,3400.0,1400.0,400.0,0.0,3400.0
2024,Dev Med Child Neurol,Wiley,14698749,38616771,"Sukal-Moulton, Theresa; Barbosa, Vanessa Maziero; Sargent, Barbara; Boswell, Lynn; de Regnier, Raye-Ann; Bos, Arend F; Peyton, Colleen",True,False,5300.0,0.0,5300.0,3300.0,2300.0,0.0,5300.0
2024,Dev Med Child Neurol,Wiley,14698749,38627997,"Barbosa, Vanessa Maziero; Peyton, Colleen; Sukal-Moulton, Theresa",True,False,5300.0,0.0,5300.0,3300.0,2300.0,0.0,5300.0
2024,Dev Med Child Neurol,Wiley,14698749,38629475,"Peyton, Colleen; Aaby, David; Barbosa, Vanessa Maziero; Boswell, Lynn; de Regnier, Raye-Ann; Bos, Arend F; Sukal Moulton, Theresa",True,False,5300.0,0.0,5300.0,3300.0,2300.0,0.0,5300.0
2024,Pediatr Blood Cancer,Wiley,15455017,38679864,"Reiter, Audra J; Huang, Lynn; Craig, Brian T; Davidoff, Andrew M; Talbot, Lindsay J; Coggins, Jordan; Smith, Jasmine; Aldrink, Jennifer H; Bergus, Katherine C; MacArthur, Taleen A; Polites, Stephanie F; Boehmer, Chloe; Brungardt, Joseph; Malek, Marcus M; Rinehardt, Hannah N; Kastenberg, Zachary J; Arkin, Cameron M; Gourmel, Antoine; Piche, Nelson; Wallace, Marshall; Liang, Jiancong; Lovvorn 3rd, Harold N; Petroze, Robin T; Gillies, Gwendolyn; Marquart, John P; Becktell, Kerri; Le, Hau D; Favela, Juan; Rich, Barrie S; Glick, Richard D; Seemann, Natashia M; Davidson, Jacob; Wilson, Claire A; Roach, Jonathan; Brown, Erin G; Doyle, Kathleen E; Coakley, Brian A; Emengo, Pamela; Merola, Pamela; Grant, Christa N; Tirumani, Anuritha; Tracy, Elisabeth T; Moya-Mendez, Mary E; Dasgupta, Roshni; Lautz, Timothy B; Pediatric Surgical Oncology Research Collaborative",True,False,4640.0,0.0,4640.0,2640.0,1640.0,0.0,4640.0
2024,Arthritis Care Res (Hoboken),Wiley,21514658,38693617,"Garg, Shivani; Sweet, Nadia; Boderman, Brianna; Montes, Daniel; Walunas, Theresa; Ramsey-Goldman, Rosalind; Khosroshahi, Arezou; Astor, Brad C; Lim, S Sam; Bartels, Christie M",True,False,4640.0,0.0,4640.0,2640.0,1640.0,0.0,4640.0
2024,Arthritis Care Res (Hoboken),Wiley,21514658,38751111,"Yang, Sherry; Feldman, Candace H",True,False,4640.0,0.0,4640.0,2640.0,1640.0,0.0,4640.0
2024,Angew Chem Int Ed Engl,Wiley,15213773,38753725,"Boudjelel, Maxime; Zhong, Jessica; Ballerini, Lorenzo; Vanswearingen, Ian; Al-Dhufari, Rossul; Malapit, Christian A",True,False,5790.0,0.0,5790.0,3790.0,2790.0,0.0,5790.0
2024,AIDS Behav,Springer Nature,15733254,38780867,"Zapata, Juan Pablo; Hurtado, Manuel; Avila, Andrés Alvarado; John, Steven A; Rodriguez-Diaz, Carlos E; de St Aubin, Ed",True,False,4590.0,0.0,4590.0,2590.0,1590.0,0.0,4590.0
2024,Arch Dermatol Res,Springer Nature,1432069X,38795229,"Vidal, Savanna I; Silverberg, Jonathan I",True,False,4790.0,0.0,4790.0,2790.0,1790.0,0.0,4790.0
2024,J Cancer Educ,Springer Nature,15430154,38805159,"Lott, Breanne E; Yeo, Sarah; Bekele, Etsegenet; Birhanu, Firaol; Hussein, Rehima; Muktar, Seada; Mengiste, Tsion; Asfaw, Emebet; Madhivanan, Purnima; Deressa, Biniyam Tefera",True,False,3790.0,0.0,3790.0,1790.0,790.0,0.0,3790.0
2024,J Pediatr Gastroenterol Nutr,Wiley,15364801,38828720,"Mouzaki, Marialena; Yates, Katherine P; Arce-Clachar, Ana Catalina; Behling, Cindy; Blondet, Niviann M; Fishbein, Mark H; Flores, Francisco; Adams, Kathryn Harlow; Hertel, Paula; Jain, Ajay K; Molleston, Jean P; Schwimmer, Jeffrey B; Vos, Miriam B; Xanthakos, Stavra A; NASH Clinical Research Network",True,False,3780.0,0.0,3780.0,1780.0,780.0,0.0,3780.0
2024,Hum Brain Mapp,Wiley,10970193,38339956,"Butler, Ellyn R; Samia, Noelle; White, Stuart; Gratton, Caterina; Nusslock, Robin",True,False,3520.0,0.0,3520.0,1520.0,520.0,0.0,3520.0
2024,J Neurochem,Wiley,14714159,38372595,"Hanrieder, Jörg",True,False,5330.0,0.0,5330.0,3330.0,2330.0,0.0,5330.0
2024,Transfusion,Wiley,15372995,38400625,"Wang, Ling; Rochon, Elizabeth R; Gingras, Sebastien; Zuchelkowski, Benjamin E; Sinchar, Derek J; Alipour, Elimira; Reisz, Julie A; Yang, Minying; Page, Grier P; Kanias, Tamir; Triulzi, Darrell J; Lee, Janet S; Kim-Shapiro, Daniel B; D'Alessandro, Angelo; Gladwin, Mark T",True,False,4100.0,0.0,4100.0,2100.0,1100.0,0.0,4100.0
2024,Ann Surg Oncol,Springer Nature,15344681,38418655,"Mensah, Joshua A; Fei-Zhang, David J; Rossen, Jennifer L; Rahmani, Bahram; Bentrem, David J; Stein, Joshua D; French, Dustin D",True,False,4590.0,0.0,4590.0,2590.0,1590.0,0.0,4590.0
2024,Mov Disord,Wiley,15318257,38419191,"Monje, Mariana H G; Blackburn, Joanna Sarah; Kinsley, Lisa; Krainc, Dimitri; Mencacci, Niccolò E",True,False,4480.0,0.0,4480.0,2480.0,1480.0,0.0,4480.0
2024,Alzheimers Dement,Wiley,15525279,38425134,"Ruthirakuhan, Myuri; Swardfager, Walter; Xiong, Lisa; MacIntosh, Bradley J; Rabin, Jennifer S; Lanctôt, Krista L; Ottoy, Julie; Ramirez, Joel; Keith, Julia; Black, Sandra E",True,False,4200.0,0.0,4200.0,2200.0,1200.0,0.0,4200.0
2024,J Behav Med,Springer Nature,15733521,38429598,"Pedreira, Patricia B; Fleszar-Pavlović, Sara E; Walsh, Emily A; Noriega Esquives, Blanca; Moreno, Patricia I; Perdomo, Dolores; Heller, Aaron S; Antoni, Michael H; Penedo, Frank J",True,False,4790.0,0.0,4790.0,2790.0,1790.0,0.0,4790.0
2024,J Physiol,Wiley,14697793,38431907,"Takahashi, Satoe; Zhou, Yingjie; Cheatham, Mary Ann; Homma, Kazuaki",True,False,5400.0,0.0,5400.0,3400.0,2400.0,0.0,5400.0
2024,Eur J Heart Fail,Wiley,18790844,38924328,"Kitzman, Dalane W; Lewis, Gregory D; Pandey, Ambarish; Borlaug, Barry A; Sauer, Andrew J; Litwin, Sheldon E; Sharma, Kavita; Jorkasky, Diane K; Khan, Shaharyar; Shah, Sanjiv J",True,False,5300.0,0.0,5300.0,3300.0,2300.0,0.0,5300.0
2024,Alzheimers Dement,Wiley,15525279,38958543,"Polsinelli, Angelina J; Johnson, Sierah; Crouch, Adele; Lane, Kathleen A; Pena-Garcia, Alex; Hammers, Dustin B; Wang, Sophia; Gao, Sujuan; Apostolova, Liana G",True,False,4200.0,0.0,4200.0,2200.0,1200.0,0.0,4200.0
2024,Am J Reprod Immunol,Wiley,16000897,38994889,"Ma'ayeh, Marwan; de Voest, Jessica A; Hughes, Brenna L; Grobman, William A; Saade, George R; Manuck, Tracy A; Longo, Monica; Simhan, Hyagriv N; Rouse, Dwight J; Mendez-Figueroa, Hector; Gyamfi-Bannerman, Cynthia; Bailit, Jennifer L; Costantine, Maged M; Sehdev, Harish M; Tita, Alan T N; Metz, Torri D; Eunice Kennedy Shriver National Institute of Child Health and Human Development Maternal‐Fetal Medicine Units (MFMU) Network",True,False,4460.0,0.0,4460.0,2460.0,1460.0,0.0,4460.0
2024,Am J Clin Dermatol,Unknown,11791888,39348008,"Pang, Yanzhen; Nguyen, William Q; Guerrero, Liliana I; Chrisman, Lauren P; Hooper, Madeline J; McCarthy, Morgan C; Hales, Molly K; Lipman, Rachel E; Paller, Amy S; Guitart, Joan; Zhou, Xiaolong A",True,False,,0.0,,,,,
2024,Physiol Rep,Wiley,2051817X,39209762,"Trevarrow, Michael P; Munoz, Miranda J; Rivera, Yessenia M; Arora, Rishabh; Drane, Quentin H; Pal, Gian D; Verhagen Metman, Leonard; Goelz, Lisa C; Corcos, Daniel M; David, Fabian J",True,False,2050.0,0.0,2050.0,50.0,0.0,0.0,2050.0
2024,Qual Life Res,Springer Nature,15732649,38294666,"Mansolf, Maxwell; Blackwell, Courtney K; Cella, David; Lai, Jin-Shei",True,False,3890.0,0.0,3890.0,1890.0,890.0,0.0,3890.0
2024,Magn Reson Med,Wiley,15222594,38084397,"Yang, Huili; Hong, KyungPyo; Baraboo, Justin J; Fan, Lexiaozi; Larsen, Andrine; Markl, Michael; Robinson, Joshua D; Rigsby, Cynthia K; Kim, Daniel",True,False,3680.0,0.0,3680.0,1680.0,680.0,0.0,3680.0
2024,Mov Disord,Wiley,15318257,37964479,"Indelicato, Elisabetta; Boesch, Sylvia; Mencacci, Niccolo' E; Ghezzi, Daniele; Prokisch, Holger; Winkelmann, Juliane; Zech, Michael",True,False,4480.0,0.0,4480.0,2480.0,1480.0,0.0,4480.0
2024,Ann Surg Oncol,Springer Nature,15344681,38082169,"Buchheit, Joanna T; Merkow, Ryan P",True,False,4590.0,0.0,4590.0,2590.0,1590.0,0.0,4590.0
2024,Arthritis Care Res (Hoboken),Wiley,21514658,39155684,"Rasooly, Danielle; Moonesinghe, Ramal; Fallon, Elizabeth; Barbour, Kamil E; Khoury, Muin J",True,False,4640.0,0.0,4640.0,2640.0,1640.0,0.0,4640.0
2024,J Physiol,Wiley,14697793,39303148,"Sultan, Ziyad W; Najac, Marion; Raman, Indira M",True,False,5400.0,0.0,5400.0,3400.0,2400.0,0.0,5400.0
2024,J Surg Oncol,Wiley,10969098,39348440,"Buchheit, Joanna T; Janczewski, Lauren M; Wells, Amy; Hardy, Ashley N; Abad, John D; Bentrem, David J; Halverson, Amy L; Chawla, Akhil",True,False,4570.0,0.0,4570.0,2570.0,1570.0,0.0,4570.0
