Pub Year,_journal_label,_publisher,_issn_norm,PMID,Authors,_waived_by_issn,_waived_by_title,apc_original,apc_effective,would_uncovered_if_no_waiver_cap_0,would_uncovered_if_no_waiver_cap_2000,would_uncovered_if_no_waiver_cap_3000,would_uncovered_if_no_waiver_cap_6000,avoided_usd_known
2022,J Am Heart Assoc,Wolters Kluwer,20479980,35621206,"Shi, Mingjian; Wang, Chuan; Mei, Hao; Temprosa, Marinella; Florez, Jose C; Tripputi, Mark; Merino, Jordi; Lipworth, Loren; Shu, Xiao-Ou; Gerszten, Robert E; Wang, Thomas J; Beckman, Joshua A; Gamboa, Jorge L; Mosley, Jonathan D; Ferguson, Jane F; Diabetes Prevention Program Research Group",True,False,3810.0,0.0,3810.0,1810.0,810.0,0.0,3810.0
2022,Am J Clin Dermatol,Unknown,11791888,35639253,"Chovatiya, Raj; Silverberg, Jonathan I",True,False,,0.0,,,,,
2022,Mol Psychiatry,Springer Nature,14765578,35668157,"Patel, Reesha R; Wolfe, Sarah A; Borgonetti, Vittoria; Gandhi, Pauravi J; Rodriguez, Larry; Snyder, Angela E; D'Ambrosio, Shannon; Bajo, Michal; Domissy, Alain; Head, Steven; Contet, Candice; Dayne Mayfield, R; Roberts, Amanda J; Roberto, Marisa",True,False,5490.0,0.0,5490.0,3490.0,2490.0,0.0,5490.0
2022,Mol Psychiatry,Springer Nature,14765578,35681082,"Ren, Lynn Y; Cicvaric, Ana; Zhang, Hui; Aa Meyer, Mariah; Guedea, Anita L; Gao, Pan; Petrovic, Zorica; Sun, Xiaochen; Lin, Yingxi; Radulovic, Jelena",True,False,5490.0,0.0,5490.0,3490.0,2490.0,0.0,5490.0
2022,Alzheimers Dement (N Y),Wiley,23528737,35929001,"Spencer, Barbara E; Banks, Sarah J; Dale, Anders M; Brewer, James B; Makowski-Woidan, Beth; Weintraub, Sandra; Mesulam, M-Marsel; Geula, Changiz; Rogalski, Emily",True,False,2540.0,0.0,2540.0,540.0,0.0,0.0,2540.0
2022,Neurourol Urodyn,Wiley,15206777,35686553,"Quallich, Susanne A; Quentin Clemens, J; Ronstrom, Carrie; James, Aimee S; Kreder, Karl J; Henry Lai, H; Naliboff, Bruce D; Rodriguez, Larissa V; Berry, Sandra H; Sutcliffe, Siobhan",True,False,3860.0,0.0,3860.0,1860.0,860.0,0.0,3860.0
2022,Mov Disord,Wiley,15318257,35929651,"McKee, Kathleen E; Gilbert, Rebecca M; Spigle, Wendy A; Tilley, Barbara C; Corcos, Daniel M",True,False,4480.0,0.0,4480.0,2480.0,1480.0,0.0,4480.0
2022,Oncogene,Springer Nature,14765594,35931888,"Wang, Xiaohai; Brea, Lourdes; Lu, Xiaodong; Gritsina, Galina; Park, Su H; Xie, Wanqing; Zhao, Jonathan C; Yu, Jindan",True,False,5990.0,0.0,5990.0,3990.0,2990.0,0.0,5990.0
2022,Arch Womens Ment Health,Springer Nature,14351102,35708790,"Roubinov, Danielle; Musci, Rashelle J; Hipwell, Alison E; Wu, Guojing; Santos, Hudson; Felder, Jennifer N; Faleschini, Sabrina; Conradt, Elisabeth; McEvoy, Cindy T; Lester, Barry M; Buss, Claudia; Elliott, Amy J; Cordero, José F; Stroustrup, Annemarie; Bush, Nicole R",True,False,3990.0,0.0,3990.0,1990.0,990.0,0.0,3990.0
2022,Small,Wiley,16136829,35962759,"Choi, Hyunjun; Choi, Bongseo; Han, Jun-Hyeok; Shin, Ha Eun; Park, Wooram; Kim, Dong-Hyun",True,False,5790.0,0.0,5790.0,3790.0,2790.0,0.0,5790.0
2022,Aliment Pharmacol Ther,Wiley,13652036,35971888,"Yadlapati, Rena; Gawron, Andrew J; Gyawali, C Prakash; Chen, Joan; Clarke, John; Fass, Ronnie; Jain, Anand; Lynch, Kristle; Khan, Abraham; Katz, Philip O; Katzka, David A; Richter, Joel; Schnoll-Sussman, Felice; Spechler, Stuart J; Vaezi, Michael F; Vela, Marcelo; Pandolfino, John E",True,False,5250.0,0.0,5250.0,3250.0,2250.0,0.0,5250.0
2022,Neurogastroenterol Motil,Wiley,13652982,35972282,"Low, Eric E; Fehmi, Syed Abbas; Hasan, Aws; Chang, Michael; Kwong, Wilson; Krinsky, Mary L; Anand, Gobind; Greytak, Madeline; Kaizer, Alexander; Carlson, Dustin A; Pandolfino, John E; Yadlapati, Rena",True,False,4640.0,0.0,4640.0,2640.0,1640.0,0.0,4640.0
2022,Angew Chem Int Ed Engl,Wiley,15213773,35446460,"Yang, Manxi; Hu, Hang; Su, Pei; Thomas, Paul M; Camarillo, Jeannie M; Greer, Joseph B; Early, Bryan P; Fellers, Ryan T; Kelleher, Neil L; Laskin, Julia",True,False,5790.0,0.0,5790.0,3790.0,2790.0,0.0,5790.0
2022,J Gen Intern Med,Springer Nature,15251497,35469360,"Wu, En-Ling; Kumar, Rebecca N; Moore, W Justin; Hall, Gavin T; Vysniauskaite, Indre; Kim, Kwang-Youn A; Angarone, Michael P; Stosor, Valentina; Ison, Michael G; Bba, Adam Frink; Achenbach, Chad J; Gates, Khalilah L",True,False,5290.0,0.0,5290.0,3290.0,2290.0,0.0,5290.0
2022,J Am Heart Assoc,Wolters Kluwer,20479980,35475340,"Aguayo, Liliana; Chirinos, Diana A; Heard-Garris, Nia; Wong, Mandy; Davis, Matthew M; Merkin, Sharon Stein; Seeman, Teresa; Kershaw, Kiarri N",True,False,3810.0,0.0,3810.0,1810.0,810.0,0.0,3810.0
2022,Acad Emerg Med,Wiley,15532712,35490341,"Ramsden, Shannon C; Pergjika, Alba; Janssen, Aron C; Mudahar, Sukhraj; Fawcett, Andrea; Walkup, John T; Hoffmann, Jennifer A",True,False,3900.0,0.0,3900.0,1900.0,900.0,0.0,3900.0
2022,Suicide Life Threat Behav,Wiley,1943278X,35347743,"Chang, Cindy J; Feinstein, Brian A; Chu, Brian C; Selby, Edward A",True,False,3700.0,0.0,3700.0,1700.0,700.0,0.0,3700.0
2022,Int J Cardiovasc Imaging,Unknown,18758312,35190940,"Huh, Hyungkyu; Lee, Jeesoo; Kinno, Menhel; Markl, Michael; Thomas, James D; Barker, Alex J",True,False,,0.0,,,,,
2022,Prostate,Wiley,10970045,35538398,"Morgans, Alicia K; Chen, Yu-Hui; Jarrard, David F; Carducci, Michael; Liu, Glenn; Eisenberger, Mario; Plimack, Elizabeth R; Bryce, Alan; Garcia, Jorge A; Dreicer, Robert; Vogelzang, Nicholas J; Picus, Joel; Shevrin, Daniel; Hussain, Maha; DiPaola, Robert S; Cella, David; Sweeney, Christopher J; ECOG-ACRIN E3805 Investigators",True,False,4600.0,0.0,4600.0,2600.0,1600.0,0.0,4600.0
2022,Hum Genet,Springer Nature,14321203,35226188,"Piekos, Jacqueline A; Hellwege, Jacklyn N; Zhang, Yanfei; Torstenson, Eric S; Jarvik, Gail P; Dikilitas, Ozan; Kullo, Iftikhar J; Schaid, Daniel J; Crosslin, David R; Pendergrass, Sarah A; Lee, Ming Ta Michael; Roden, Dan; Denny, Josh C; Edwards, Todd L; Velez Edwards, Digna R",True,False,5490.0,0.0,5490.0,3490.0,2490.0,0.0,5490.0
2022,J Am Heart Assoc,Wolters Kluwer,20479980,35232223,"Springer, Mellanie V; Skolarus, Lesli E; Feng, Chunyang; Burke, James F",True,False,3810.0,0.0,3810.0,1810.0,810.0,0.0,3810.0
2022,Acta Crystallogr F Struct Biol Commun,International Union of Crystallography (IUCr),2053230X,35234136,"Reyes, Alexis A; Fishbain, Susan; He, Yuan",True,False,3520.0,0.0,3520.0,1520.0,520.0,0.0,3520.0
2022,J Am Heart Assoc,Wolters Kluwer,20479980,35583146,"Freaney, Priya M; Harrington, Katharine; Molsberry, Rebecca; Perak, Amanda M; Wang, Michael C; Grobman, William; Greenland, Philip; Allen, Norrina B; Capewell, Simon; O'Flaherty, Martin; Lloyd-Jones, Donald M; Khan, Sadiya S",True,False,3810.0,0.0,3810.0,1810.0,810.0,0.0,3810.0
2022,Prev Sci,Springer Nature,15736695,35986131,"Johnson, Jessica K; Diebold, Alicia; Yeh, Chen; Ciolino, Jody D; Tandon, S Darius",True,False,3790.0,0.0,3790.0,1790.0,790.0,0.0,3790.0
2022,Mov Disord,Wiley,15318257,35997131,"Hopfner, Franziska; Tietz, Anja K; Ruf, Viktoria C; Ross, Owen A; Koga, Shunsuke; Dickson, Dennis; Aguzzi, Adriano; Attems, Johannes; Beach, Thomas; Beller, Allison; Cheshire, William P; van Deerlin, Vivianna; Desplats, Paula; Deuschl, Günther; Duyckaerts, Charles; Ellinghaus, David; Evsyukov, Valentin; Flanagan, Margaret Ellen; Franke, Andre; Frosch, Matthew P; Gearing, Marla; Gelpi, Ellen; van Gerpen, Jay A; Ghetti, Bernardino; Glass, Jonathan D; Grinberg, Lea T; Halliday, Glenda; Helbig, Ingo; Höllerhage, Matthias; Huitinga, Inge; Irwin, David John; Keene, Dirk C; Kovacs, Gabor G; Lee, Edward B; Levin, Johannes; Martí, Maria J; Mackenzie, Ian; McKeith, Ian; Mclean, Catriona; Mollenhauer, Brit; Neumann, Manuela; Newell, Kathy L; Pantelyat, Alex; Pendziwiat, Manuela; Peters, Annette; Molina Porcel, Laura; Rabano, Alberto; Matěj, Radoslav; Rajput, Alex; Rajput, Ali; Reimann, Regina; Scott, William K; Seeley, William; Selvackadunco, Sashika; Simuni, Tanya; Stadelmann, Christine; Svenningsson, Per; Thomas, Alan; Trenkwalder, Claudia; Troakes, Claire; Trojanowski, John Q; Uitti, Ryan J; White, Charles L; Wszolek, Zbigniew K; Xie, Tao; Ximelis, Teresa; Yebenes, Justo; Alzheimer's Disease Genetics Consortium; Müller, Ulrich; Schellenberg, Gerard D; Herms, Jochen; Kuhlenbäumer, Gregor; Höglinger, Günter",True,False,4480.0,0.0,4480.0,2480.0,1480.0,0.0,4480.0
2022,Depress Anxiety,Unknown,15206394,36281621,"Stamatis, Caitlin A; Meyerhoff, Jonah; Liu, Tingting; Sherman, Garrick; Wang, Harry; Liu, Tony; Curtis, Brenda; Ungar, Lyle H; Mohr, David C",True,False,,0.0,,,,,
2022,Hippocampus,Unknown,10981063,36018285,"Miller, Lisa N; Weiss, Craig; Disterhoft, John F",True,False,,0.0,,,,,
2022,Mol Neurobiol,Springer Nature,15591182,36042143,"Shih, Ling-Kai; Mukherjee, Subhas; Brat, Daniel J",True,False,4590.0,0.0,4590.0,2590.0,1590.0,0.0,4590.0
2022,Psychooncology,Wiley,10991611,36121699,"Barata, Anna; Hoogland, Aasha I; Small, Brent J; Acevedo, Karina I; Antoni, Michael H; Gonzalez, Brian D; Jacobsen, Paul B; Lechner, Suzanne C; Tyson, Dinorah Martinez; Meade, Cathy D; Rodriguez, Yvelise; Salsman, John M; Sherman, Allen C; Sutton, Steven K; Jim, Heather S L",True,False,4940.0,0.0,4940.0,2940.0,1940.0,0.0,4940.0
2022,Aliment Pharmacol Ther,Wiley,13652036,36127750,"Pandolfino, John E; Carlson, Dustin A; McGarva, Josie; Kahrilas, Peter J; Vaezi, Michael; Katzka, David; Taft, Tiffany H",True,False,5250.0,0.0,5250.0,3250.0,2250.0,0.0,5250.0
2022,J Sleep Res,Wiley,13652869,36129154,"Whitmore, Nathan W; Harris, Jasmine C; Kovach, Torin; Paller, Ken A",True,False,4340.0,0.0,4340.0,2340.0,1340.0,0.0,4340.0
2022,J Synchrotron Radiat,International Union of Crystallography (IUCr),16005775,36345757,"Chowdhury, M A Z; Ok, K; Luo, Y; Liu, Z; Chen, S; O'Halloran, T V; Kettimuthu, R; Tekawade, A",True,False,3180.0,0.0,3180.0,1180.0,180.0,0.0,3180.0
2022,Affect Sci,Springer Nature,2662205X,36385910,"Funkhouser, Carter J; Katz, Andrea C; Meissel, Emily E E; Stevens, Elizabeth S; Weinberg, Anna; Nabb, Carver B; Shankman, Stewart A",True,False,3090.0,0.0,3090.0,1090.0,90.0,0.0,3090.0
2022,J Physiol,Wiley,14697793,35997764,"Heit, Bradley Stavros; Heckman, C J",True,False,5400.0,0.0,5400.0,3400.0,2400.0,0.0,5400.0
2022,Addict Biol,Wiley,13691600,36301213,"Massey, Suena H; Pool, Lindsay R; Estabrook, Ryne; Level, Rachel A; Shisler, Shannon; Stacks, Ann M; Neiderhiser, Jenae M; Espy, Kimberly A; Wakschlag, Lauren S; Eiden, Rina D; Allen, Norrina B",True,False,3150.0,0.0,3150.0,1150.0,150.0,0.0,3150.0
2022,Protein Sci,Wiley,1469896X,36040257,"Sanders, Adam L; Hermanson, Jake N; Samuels, David C; Plate, Lars; Sanders, Charles R",True,False,4480.0,0.0,4480.0,2480.0,1480.0,0.0,4480.0
2022,J Am Geriatr Soc,Wiley,15325415,36054661,"Kotwal, Ashwin A; Batio, Stephanie; Wolf, Michael S; Covinsky, Kenneth E; Yoshino Benavente, Julia; Perissinotto, Carla M; O'Conor, Rachel M",True,False,4760.0,0.0,4760.0,2760.0,1760.0,0.0,4760.0
2022,Curr Protoc,Wiley,26911299,36165649,"Roth-Carter, Quinn R; Koetsier, Jennifer L; Broussard, Joshua A; Green, Kathleen J",True,False,4890.0,0.0,4890.0,2890.0,1890.0,0.0,4890.0
2022,Adv Healthc Mater,Wiley,21922659,36168854,"Ding, Yonghui; Fu, Rao; Collins, Caralyn Paige; Yoda, Sarah-Fatime; Sun, Cheng; Ameer, Guillermo A",True,False,4880.0,0.0,4880.0,2880.0,1880.0,0.0,4880.0
2022,Eur J Heart Fail,Wiley,18790844,36196462,"Venkateshvaran, Ashwin; Faxen, Ulrika Ljung; Hage, Camilla; Michaëlsson, Erik; Svedlund, Sara; Saraste, Antti; Beussink-Nelson, Lauren; Fermer, Maria Lagerstrom; Gan, Li-Ming; Tromp, Jasper; Lam, Carolyn S P; Shah, Sanjiv J; Lund, Lars H",True,False,5300.0,0.0,5300.0,3300.0,2300.0,0.0,5300.0
2022,J Surg Oncol,Wiley,10969098,35481919,"Shah, Dhavan; Bentrem, David",True,False,4570.0,0.0,4570.0,2570.0,1570.0,0.0,4570.0
2022,HIV Med,Wiley,14681293,35343038,"Luu, Brandon; Ruderman, Stephanie; Nance, Robin; Delaney, Joseph A C; Ma, Jimmy; Hahn, Andrew; Heckbert, Susan R; Budoff, Matthew J; Crothers, Kristina; Mathews, William C; Christopolous, Katerina; Hunt, Peter W; Eron, Joseph; Moore, Richard; Keruly, Jeanne; Lober, William B; Burkholder, Greer A; Willig, Amanda; Chander, Geetanjali; McCaul, Mary E; Cropsey, Karen; O'Cleirigh, Conall; Peter, Inga; Feinstein, Matthew; Tsui, Judith I; Lindstroem, Sara; Saag, Michael; Kitahata, Mari M; Crane, Heidi M; Drumright, Lydia N; Whitney, Bridget M",True,False,4150.0,0.0,4150.0,2150.0,1150.0,0.0,4150.0
2022,J Assist Reprod Genet,Springer Nature,15737330,35501415,"Sue, Aaron C; Wignall, Sarah M; Woodruff, Teresa K; O'Halloran, Thomas V",True,False,4690.0,0.0,4690.0,2690.0,1690.0,0.0,4690.0
2022,Int Forum Allergy Rhinol,Wiley,20426984,35362251,"Schneider, Alexander L; Racette, Samuel D; Kang, Anthony K; Reddy, Abhita T; Huang, Julia H; Lehmann, David S; Price, Caroline P E; Eide, Jacob G; Rodeghiero, Samuel R; Conley, David B; Welch, Kevin C; Kern, Robert C; Shintani-Smith, Stephanie; Peters, Anju T; Kato, Atsushi; Stevens, Whitney S; Schleimer, Robert P; Tan, Bruce K",True,False,4100.0,0.0,4100.0,2100.0,1100.0,0.0,4100.0
2022,Int Forum Allergy Rhinol,Wiley,20426984,35363947,"Racette, Samuel D; Schneider, Alexander L; Ganesh, Meera; Huang, Julia H; Lehmann, David S; Price, Caroline P E; Rodegherio, Samuel G; Reddy, Abhita T; Eide, Jacob G; Conley, David B; Welch, Kevin C; Kern, Robert C; Shintani-Smith, Stephanie; Kato, Atsushi; Schleimer, Robert P; Tan, Bruce K",True,False,4100.0,0.0,4100.0,2100.0,1100.0,0.0,4100.0
2022,Magn Reson Med,Wiley,15222594,35377476,"Fan, Lexiaozi; Hong, Kyungpyo; Hsu, Li-Yueh; Carr, James C; Allen, Bradley D; Lee, Daniel C; Kim, Daniel",True,False,3680.0,0.0,3680.0,1680.0,680.0,0.0,3680.0
2022,Mol Psychiatry,Springer Nature,14765578,35551246,"Ren, Lynn Y; Cicvaric, Ana; Zhang, Hui; Meyer, Mariah Aa; Guedea, Anita L; Gao, Pan; Petrovic, Zorica; Sun, Xiaochen; Lin, Yingxi; Radulovic, Jelena",True,False,5490.0,0.0,5490.0,3490.0,2490.0,0.0,5490.0
2022,Stat Med,Wiley,10970258,35417078,"Xue, Xiaonan; Hua, Simin; Weber, Kathleen; Qi, Qibin; Kaplan, Robert; Gustafson, Deborah R; Sharma, Anjali; French, Audrey; Burgess, Helen J",True,False,5450.0,0.0,5450.0,3450.0,2450.0,0.0,5450.0
2022,Clin Exp Allergy,Unknown,13652222,35253284,"Eide, Jacob G; Wu, Jeffanie; Stevens, Whitney W; Bai, Junqin; Hou, Songwang; Huang, Julia H; Rosenberg, Jacob; Utz, Paul; Shintani-Smith, Stephanie; Conley, David B; Welch, Kevin C; Kern, Robert C; Hulse, Kathryn E; Peters, Anju T; Grammer, Leslie C; Zhao, Ming; Lindholm, Paul; Schleimer, Robert P; Tan, Bruce K",True,False,,0.0,,,,,
2022,J Am Heart Assoc,Wolters Kluwer,20479980,35253450,"Minhas, Anum S; Post, Wendy S; Liu, Bin; Doria De Vasconcellos, Henrique; Haberlen, Sabina A; Feinstein, Matthew; Stosor, Valentina; Budoff, Matthew; Chew, Kara W; Magnani, Jared W; Brown, Todd; Lima, Joao A C; Wu, Katherine C",True,False,3810.0,0.0,3810.0,1810.0,810.0,0.0,3810.0
2022,J Synchrotron Radiat,International Union of Crystallography (IUCr),16005775,35254313,"Vacek, Everett; Jacobsen, Chris",True,False,3180.0,0.0,3180.0,1180.0,180.0,0.0,3180.0
2022,AIDS Behav,Springer Nature,15733254,35267107,"Xavier Hall, Casey D; Newcomb, Michael E; Dyar, Christina; Mustanski, Brian",True,False,4590.0,0.0,4590.0,2590.0,1590.0,0.0,4590.0
2022,Physiol Rep,Wiley,2051817X,35274819,"Mazumder, Nikhilesh R; Kazen, Avidor; Carek, Andrew; Etemadi, Mozziyar; Levitsky, Josh",True,False,2050.0,0.0,2050.0,50.0,0.0,0.0,2050.0
2022,Proteomics,Wiley,16159861,35286768,"Greer, Joseph B; Early, Bryan P; Durbin, Kenneth R; Patrie, Steven M; Thomas, Paul M; Kelleher, Neil L; LeDuc, Richard D; Fellers, Ryan T",True,False,4650.0,0.0,4650.0,2650.0,1650.0,0.0,4650.0
2022,J Am Geriatr Soc,Wiley,15325415,35726136,"Lindquist, Lee A; Miller-Winder, Amber P; Schierer, Allison; Murawski, Alaine; Opsasnick, Lauren; Curtis, Laura M; Kim, Kwang-Youn; Ramirez-Zohfeld, Vanessa",True,False,4760.0,0.0,4760.0,2760.0,1760.0,0.0,4760.0
2022,J Assist Reprod Genet,Springer Nature,15737330,35870095,"Ataman, L M; Laronda, M M; Gowett, M; Trotter, K; Anvari, H; Fei, F; Ingram, A; Minette, M; Suebthawinkul, C; Taghvaei, Z; Torres-Vélez, M; Velez, K; Adiga, S K; Anazodo, A; Appiah, L; Bourlon, M T; Daniels, N; Dolmans, M M; Finlayson, C; Gilchrist, R B; Gomez-Lobo, V; Greenblatt, E; Halpern, J A; Hutt, K; Johnson, E K; Kawamura, K; Khrouf, M; Kimelman, D; Kristensen, S; Mitchell, R T; Moravek, M B; Nahata, L; Orwig, K E; Pavone, M E; Pépin, D; Pesce, R; Quinn, G P; Rosen, M P; Rowell, E; Smith, K; Venter, C; Whiteside, S; Xiao, S; Zelinski, M; Goldman, K N; Woodruff, T K; Duncan, F E",True,False,4690.0,0.0,4690.0,2690.0,1690.0,0.0,4690.0
2022,Glia,Wiley,10981136,35809238,"Titus, Haley E; Xu, Huan; Robinson, Andrew P; Patel, Priyam A; Chen, Yanan; Fantini, Damiano; Eaton, Valerie; Karl, Molly; Garrison, Eric D; Rose, Indigo V L; Chiang, Ming Yi; Podojil, Joseph R; Balabanov, Roumen; Liddelow, Shane A; Miller, Robert H; Popko, Brian; Miller, Stephen D",True,False,5450.0,0.0,5450.0,3450.0,2450.0,0.0,5450.0
2022,J Am Geriatr Soc,Wiley,15325415,35860971,"Lindquist, Lee A; Wong, Norine; Forcucci, Chris; Rogers, Beverly; Ramirez, Ana; Ramirez-Zohfeld, Vanessa",True,False,4760.0,0.0,4760.0,2760.0,1760.0,0.0,4760.0
2022,Magn Reson Med,Wiley,15222594,35754143,"Aristova, Maria; Pang, Jianing; Ma, Yue; Ma, Liliana; Berhane, Haben; Rayz, Vitaliy; Markl, Michael; Schnell, Susanne",True,False,3680.0,0.0,3680.0,1680.0,680.0,0.0,3680.0
2022,Genet Res (Camb),Unknown,14695073,35919032,"Diakite, Brehima; Kassogue, Yaya; Maiga, Mamoudou; Dolo, Guimogo; Kassogue, Oumar; Musa, Jonah; Morhason-Bello, Imran; Traore, Ban; Traore, Cheick Bougadari; Kamate, Bakarou; Coulibaly, Aissata; Bah, Sekou; Nadifi, Sellama; Murphy, Robert; Holl, Jane L; Hou, Lifang",True,False,,0.0,,,,,
2022,Neurourol Urodyn,Wiley,15206777,35819129,"Williams, Beverly Rosa; Burgio, Kathryn L; Hebert-Beirne, Jeni; James, Aimee; Kenton, Kimberly; LaCoursiere, Daphne Yvette; Rickey, Leslie; Brady, Sonya S; Kane Low, Lisa; Newman, Diane K; Prevention of Lower Urinary Tract Symptoms (PLUS) Research Consortium",True,False,3860.0,0.0,3860.0,1860.0,860.0,0.0,3860.0
2022,Dev Med Child Neurol,Wiley,14698749,35830182,"Demarest, Scott; Calhoun, Jeff; Eschbach, Krista; Yu, Hung-Chun; Mirsky, David; Angione, Katie; Shaikh, Tamim H; Carvill, Gemma L; Benke, Tim A; WES Support Group",True,False,5300.0,0.0,5300.0,3300.0,2300.0,0.0,5300.0
2022,Acta Neuropathol,Springer Nature,14320533,35697880,"Nelson, Peter T; Brayne, Carol; Flanagan, Margaret E; Abner, Erin L; Agrawal, Sonal; Attems, Johannes; Castellani, Rudolph J; Corrada, Maria M; Cykowski, Matthew D; Di, Jing; Dickson, Dennis W; Dugger, Brittany N; Ervin, John F; Fleming, Jane; Graff-Radford, Jonathan; Grinberg, Lea T; Hokkanen, Suvi R K; Hunter, Sally; Kapasi, Alifiya; Kawas, Claudia H; Keage, Hannah A D; Keene, C Dirk; Kero, Mia; Knopman, David S; Kouri, Naomi; Kovacs, Gabor G; Labuzan, Sydney A; Larson, Eric B; Latimer, Caitlin S; Leite, Renata E P; Matchett, Billie J; Matthews, Fiona E; Merrick, Richard; Montine, Thomas J; Murray, Melissa E; Myllykangas, Liisa; Nag, Sukriti; Nelson, Ruth S; Neltner, Janna H; Nguyen, Aivi T; Petersen, Ronald C; Polvikoski, Tuomo; Reichard, R Ross; Rodriguez, Roberta D; Suemoto, Claudia K; Wang, Shih-Hsiu J; Wharton, Stephen B; White, Lon; Schneider, Julie A",True,False,4990.0,0.0,4990.0,2990.0,1990.0,0.0,4990.0
2022,J Gen Intern Med,Springer Nature,15251497,35212874,"Phillips, Aryn Z; Kiefe, Catarina I; Lewis, Cora E; Schreiner, Pamela J; Tajeu, Gabriel S; Carnethon, Mercedes R",True,False,5290.0,0.0,5290.0,3290.0,2290.0,0.0,5290.0
2022,FASEB J,Wiley,15306860,35554246,"DiStefano, Nicholas; Lloyd-Jones, Cameron; Seckler, Henrique; Compton, Philip; Sniderman, Allan; Kelleher, Neil; Wilkins, John",True,False,3740.0,0.0,3740.0,1740.0,740.0,0.0,3740.0
2022,Pediatr Pulmonol,Wiley,10990496,35574731,"Welbel, Remi Z; Rand, Casey M; Zhou, Amy; Fadl-Alla, Allaa; Chen, Maida Lynn; Weese-Mayer, Debra E; Zelko, Frank A",True,False,4740.0,0.0,4740.0,2740.0,1740.0,0.0,4740.0
2022,Cancer,Wiley,10970142,35579501,"Ver Hoeve, Elizabeth S; Simon, Melissa A; Danner, Sankirtana M; Washington, Antonio J; Coples, Susan D; Percac-Lima, Sanja; Whited, Emma C; Paskett, Electra D; Naughton, Michelle J; Gray, Darrell M; Wenzel, Jennifer A; Zabora, James R; Hassoon, Ahmed; Tolbert, Elliott E; Calhoun, Elizabeth; Barton, Debra L; Friese, Christopher R; Titler, Marita G; Hamann, Heidi A",True,False,4790.0,0.0,4790.0,2790.0,1790.0,0.0,4790.0
2022,Drug Saf,Unknown,11791942,35579811,"Zhao, Yiqing; Yu, Yue; Wang, Hanyin; Li, Yikuan; Deng, Yu; Jiang, Guoqian; Luo, Yuan",True,False,,0.0,,,,,
2022,Prev Sci,Springer Nature,15736695,36083435,"Brown, C Hendricks; Hedeker, Donald; Gibbons, Robert D; Duan, Naihua; Almirall, Daniel; Gallo, Carlos; Burnett-Zeigler, Inger; Prado, Guillermo; Young, Sean D; Valido, Alberto; Wyman, Peter A",True,False,3790.0,0.0,3790.0,1790.0,790.0,0.0,3790.0
2022,ESC Heart Fail,Wiley,20555822,36097332,"Sinha, Arjun; Sitlani, Colleen M; Doyle, Margaret F; Fohner, Alison E; Buzkova, Petra; Floyd, James S; Huber, Sally A; Olson, Nels C; Njoroge, Joyce N; Kizer, Jorge R; Delaney, Joseph A; Shah, Sanjiv S; Tracy, Russell P; Psaty, Bruce; Feinstein, Matthew",True,False,4850.0,0.0,4850.0,2850.0,1850.0,0.0,4850.0
2022,Arthritis Care Res (Hoboken),Wiley,21514658,33152181,"Legge, Alexandra; Kirkland, Susan; Rockwood, Kenneth; Andreou, Pantelis; Bae, Sang-Cheol; Gordon, Caroline; Romero-Diaz, Juanita; Sanchez-Guerrero, Jorge; Wallace, Daniel J; Bernatsky, Sasha; Clarke, Ann E; Merrill, Joan T; Ginzler, Ellen M; Fortin, Paul R; Gladman, Dafna D; Urowitz, Murray B; Bruce, Ian N; Isenberg, David A; Rahman, Anisur; Alarcón, Graciela S; Petri, Michelle; Khamashta, Munther A; Dooley, M A; Ramsey-Goldman, Rosalind; Manzi, Susan; Zoma, Asad A; Aranow, Cynthia; Mackay, Meggan; Ruiz-Irastorza, Guillermo; Lim, S Sam; Inanc, Murat; van Vollenhoven, Ronald F; Jonsen, Andreas; Nived, Ola; Ramos-Casals, Manuel; Kamen, Diane L; Kalunian, Kenneth C; Jacobsen, Søren; Peschken, Christine A; Askanase, Anca; Hanly, John G",True,False,4640.0,0.0,4640.0,2640.0,1640.0,0.0,4640.0
2022,Pediatr Dermatol,Wiley,15251470,34935180,"Zhou, Nina Y; Nili, Amanda; Blackwell, Courtney K; Ogbuefi, Nonye; Cummings, Peter; Lai, Jin-Shei; Griffith, James W; Paller, Amy S; Wakschlag, Lauren S; Fishbein, Anna B",True,False,3920.0,0.0,3920.0,1920.0,920.0,0.0,3920.0
2022,J Comp Neurol,Wiley,10969861,34958682,"Gao, Jingyi; Griner, Erin M; Liu, Mingna; Moy, Joanna; Provencio, Ignacio; Liu, Xiaorong",True,False,5450.0,0.0,5450.0,3450.0,2450.0,0.0,5450.0
2022,Gene Ther,Springer Nature,14765462,34853443,"Genç, Barış; Jara, Javier H; Sanchez, Santana S; Lagrimas, Amiko K B; Gözütok, Öge; Koçak, Nuran; Zhu, Yongling; Hande Özdinler, P",True,False,5590.0,0.0,5590.0,3590.0,2590.0,0.0,5590.0
2022,Alzheimers Dement,Wiley,15525279,34854530,"Buckles, Virginia D; Xiong, Chengjie; Bateman, Randall J; Hassenstab, Jason; Allegri, Ricardo; Berman, Sarah B; Chhatwal, Jasmeer P; Danek, Adrian; Fagan, Anne M; Ghetti, Bernardino; Goate, Alison; Graff-Radford, Neill; Jucker, Mathias; Levin, Johannes; Marcus, Daniel S; Masters, Colin L; McCue, Lena; McDade, Eric; Mori, Hiroshi; Moulder, Krista L; Noble, James M; Paumier, Katrina; Preische, Oliver; Ringman, John M; Fox, Nick C; Salloway, Stephen; Schofield, Peter R; Martins, Ralph; Vöglein, Jonathan; Morris, John C; Dominantly Inherited Alzheimer's Network",True,False,4200.0,0.0,4200.0,2200.0,1200.0,0.0,4200.0
2022,J Gen Intern Med,Springer Nature,15251497,34981350,"Khan, Sadiya S; Seegmiller, Laura E; Lloyd-Jones, Donald M; Pool, Lindsay R",True,False,5290.0,0.0,5290.0,3290.0,2290.0,0.0,5290.0
2022,J Gen Intern Med,Springer Nature,15251497,34997391,"Yu, Jingzhi; Wang, Ann A; Zimmerman, Lindsay P; Deng, Yu; Vu, Thanh-Huyen T; Tedla, Yacob G; Soulakis, Nicholas D; Ahmad, Faraz S; Kho, Abel N",True,False,5290.0,0.0,5290.0,3290.0,2290.0,0.0,5290.0
2022,Inflamm Res,Unknown,1420908X,35020000,"Singh, Sarojini; Henderson, John; Patil, Mallikarjun; Dubey, Praveen K; Dubey, Shubham; Kannappan, Ramaswamy; Zhang, Jianyi; Krishnamurthy, Prasanna",True,False,,0.0,,,,,
2022,J Surg Oncol,Wiley,10969098,34897710,"Ecker, Brett L; Brajcich, Brian C; Ellis, Ryan J; Ko, Clifford Y; D'Angelica, Michael I",True,False,4570.0,0.0,4570.0,2570.0,1570.0,0.0,4570.0
2022,Acta Neuropathol,Springer Nature,14320533,35039931,"Markwell, Steven M; Ross, James L; Olson, Cheryl L; Brat, Daniel J",True,False,4990.0,0.0,4990.0,2990.0,1990.0,0.0,4990.0
2022,Reprod Sci,Unknown,19337205,35064560,"Hutchinson, Anne P; Yin, Ping; Neale, Ilona; Coon 5th, John S; Kujawa, Stacy A; Liu, Shimeng; Bulun, Serdar E",True,False,,0.0,,,,,
2022,Pediatr Nephrol,Springer Nature,1432198X,35083530,"Millington, Kate; Barrera, Ellis; Daga, Ankana; Mann, Nina; Olson-Kennedy, Johanna; Garofalo, Robert; Rosenthal, Stephen M; Chan, Yee-Ming",True,False,4337.0,0.0,4337.0,2337.0,1337.0,0.0,4337.0
2022,J Gen Intern Med,Springer Nature,15251497,35091922,"Defoe, Maya V; Cameron, Kenzie A; Burden, Marisha; Mazurek, Sophia R; Updike, John A; Keniston, Angela; O'Leary, Kevin J; Best, Jennifer A",True,False,5290.0,0.0,5290.0,3290.0,2290.0,0.0,5290.0
2022,Int J Eat Disord,Wiley,1098108X,35092322,"Goel, Neha J; Jennings Mathis, Karen; Egbert, Amy H; Petterway, Felicia; Breithaupt, Lauren; Eddy, Kamryn T; Franko, Debra L; Graham, Andrea K",True,False,4300.0,0.0,4300.0,2300.0,1300.0,0.0,4300.0
2022,Oncogene,Springer Nature,14765594,35094010,"Yi, Yang; Li, Yanqiang; Li, Chao; Wu, Longxiang; Zhao, Dongyu; Li, Fuxi; Fazli, Ladan; Wang, Rui; Wang, Long; Dong, Xuesen; Zhao, Wei; Chen, Kaifu; Cao, Qi",True,False,5990.0,0.0,5990.0,3990.0,2990.0,0.0,5990.0
2022,J Behav Med,Springer Nature,15733521,35107655,"Noriega Esquives, Blanca; Lee, Tae K; Moreno, Patricia I; Fox, Rina S; Yanez, Betina; Miller, Gregory E; Estabrook, Ryne; Begale, Mark J; Flury, Sarah C; Perry, Kent; Kundu, Shilajit D; Penedo, Frank J",True,False,4790.0,0.0,4790.0,2790.0,1790.0,0.0,4790.0
2022,Neurogastroenterol Motil,Wiley,13652982,35122356,"Kahrilas, Peter J",True,False,4640.0,0.0,4640.0,2640.0,1640.0,0.0,4640.0
